,0
0,"PARIS —The French bank BNP Paribas suspended operations of three of its funds Thursday in the wake of turmoil in the U.S. home loans market, prompting more declines in European stock markets.BNP, the largest listed bank in France, is the latest European lender to announce problems linked to the worsening credit market in the United States, where several major companies have already announced losses.A German central bank meeting was under way Thursday to discuss details of a rescue package for the lender IKB, another victim of exposure to the crisis in so-called subprime lending that sprang from a glut of risky loans and the failure of U.S. homebuyers to keep up with their payments.Also Thursday, the Dutch lender NIBC Holding said it had lost $189 million on U.S. mortgage investments.Jonathan Mullen, a spokesman for BNP, said the credit crunch in the United States made it impossible to calculate the value of the underlying assets of the funds since Monday, and he explained that the bank was obliged by market conditions to halt holders of the funds from cashing out or new investors from buying shares in the funds.""It's quite exceptional to suspend funds, and it means that people can't buy in or sell out of the funds,"" Mullen said. ""But we hope this is going to be temporary and that the market will come back.""Mullen said that about one-third of the funds were exposed to subprime loans, but that those investments were in high quality parts of that market. ""We've seen no degradation in the quality of these assets, none of which have been put on watch for a downgrade,"" he said. ""This is just a technical problem about liquidity,"" he said.A key question is whether some European lenders know the full extent of their exposure to the subprime lending crisis. Only last week, Baudouin Prot, chief executive officer of BNP, said the bank's exposure to subprime woes was ""absolutely negligible.""BNP shares fell as much as 3.2 percent to €82.70, or $113.16, in early trading Thursday, but Mullen reiterated that the bank itself had almost no exposure to the subprime crisis. He said the funds are held by BNP clients and represent just a small fraction, about €1.6 billion, of the €600 billion the bank currently has under management.Some analysts have said it is difficult to determine banks' exposure to the U.S. subprime market because they are often held through collateralized debt obligations, financial products that bundle securities and help spread risks, and banks often do not disclose their exposure.The debt rating agency Standard & Poor's cut credit ratings in July on $6.39 billion worth of bonds backed by subprime mortgages.Fitch Ratings said it was reviewing $7.1 billion, including 19 collateralized debt obligations, for a possible downgrade.Concern among investors about the possible effects of subprime investments and recent woes in the credit markets have outweighed rising earnings at European banks last month.Shares of Deutsche Bank and BNP dropped last week, even though both reported better-than-expected profit in the first half. Investors are reducing their exposure to banks with large investment banking arms.Julia Werdigier reported from London."
1,"Stocks dropped sharply as soon as trading opened Thursday after a French bank, BNP Paribas, suspended operations of three of its funds in the wake of turmoil in the American market for home loans and the European Central Bank injected cash into the financial system because of tightening credit markets.The Dow Jones industrial average fell more than 200 points, or 1.5 percent, while the Standard & Poor's 500-stock index and the Nasdaq composite index were down just as much. Stocks remained volatile through the morning, and at 11 a.m., the Dow was down about 140 points. The S.&P. 500 was off by more than 1 percent, and the Nasdaq by about half that.Asked at a news conference this morning whether he thought the turmoil in the subprime lending market could put a chill on credit in the broader economy, President George W. Bush said, ""The fundamentals of our economy are strong,"" adding, ""I'm told there is enough liquidity to enable the system to correct.""The latest upheaval on Wall Street came after a sell-off in Europe, which was prompted after BNP, the largest publicly traded bank in France, became the latest European lender to announce problems linked to the worsening credit market in the United States, where several large companies have already announced losses.A German central bank meeting was under way to discuss details of a rescue package for the lender IKB, another victim of exposure to the crisis in subprime lending.Jonathan Mullen, a spokesman for BNP, said that the credit squeeze in the United States had made it impossible to calculate the value of the underlying assets of the funds and that the bank was obliged by market conditions to halt holders of the funds from cashing out or new investors from buying shares in the funds.""It's quite exceptional to suspend funds, and it means that people can't buy in or sell out of the funds,"" Mullen said. ""But we hope this is going to be temporary and that the market will come back.""Mullen said that about one-third of the funds were exposed to subprime loans but that those investments were in high quality parts of that market. ""We've seen no degradation in the quality of these assets, none of which have been put on watch for a downgrade,"" Mullen said. ""This is just a technical problem about liquidity.""With banks pulling back on lending over all, the European Central Bank lent more than $130 billion overnight at a rate of 4 percent to inject cash into the financial system.A key question is whether some European lenders know the full extent of their exposure to the subprime lending crisis. Only last week, BNP's chief executive, Baudouin Prot, said the bank's exposure to subprime woes was ""absolutely negligible.""BNP shares fell more than 5 percent in early trading, but Mullen reiterated that the bank itself had almost no exposure to the subprime crisis. He said the funds are held by BNP clients and represent just a fraction, or 1.6 billion euros, of the 600 billion euros the bank currently has under management.Some analysts have said it is difficult to determine the exposure of banks to the United States subprime market because they are often held through collateralized debt obligations, financial products that bundle securities and help spread risks, and banks often do not disclose their exposure.Standard & Poor's, the debt rating agency, in July cut credit ratings on $6.39 billion of bonds backed by subprime mortgages.Fitch Ratings said it was reviewing $7.1 billion, including 19 collateralized debt obligations, for a possible downgrade.Concern among investors about possible effects of subprime investments and recent woes in the credit markets have outweighed rising earnings at European banks last month.Shares of Deutsche Bank and BNP dropped on Aug. 1 even though both reported better-than-expected profit in the first half. Investors are reducing their exposure to banks with large investment banking arms, fearing losses from leveraged loans they have underwritten but cannot sell on to investors.Analysts at Keefe, Bruyette & Woods, said earlier this month that while exposures to subprime may lead to ""modest losses or slightly lower revenue"" among European banks — but that would be ""entirely manageable."""
2,"Stocks on Wall Street were down sharply Thursday after a French bank, BNP Paribas, suspended operations of three of its funds in the wake of turmoil in the American market for home loans. The European Central Bank and the Federal Reserve injected cash into the financial system because of tightening credit markets.Within minutes of the opening bell, the Dow Jones industrial average fell more than 200 points, or 1.5 percent, while the Standard & Poor's 500-stock index and the Nasdaq composite index were down just as much. Stocks remained volatile into the afternoon, recovering much of their losses, then declining anew.Shortly after 3:30 p.m., the Dow was down more than 320 points, or 2.3 percent. The S.& P. 500 was off by about 2.5 percent, while the Nasdaq was down about 1.9 percent.Prices of Treasury bonds jumped as investors fled to the safety of government paper.Asked at a news conference this morning whether he thought the turmoil in the subprime lending market could put a chill on credit in the broader economy, President George W. Bush said he did not think that the U.S. government needs to step in to provide more money to the financial markets. ""The fundamentals of our economy are strong,"" he said.""Another factor one has got to look at is the amount of liquidity in the system,"" he added. ""In other words, is there enough liquidity to enable markets to be able to correct? And I am told there is enough liquidity in the system to enable markets to correct.""The latest upheaval on Wall Street came after a sell-off in Europe, which was prompted after BNP, the largest publicly traded bank in France, became the latest European lender to announce problems linked to the worsening credit market in the United States, where several large companies have already announced losses. Late last month, a group of German government-backed banks agreed to bail out a bank, IKB Deutsche Industriebank, whose investments in American mortgage securities have fallen significantly in value.With banks pulling back on lending over all, the European Central Bank lent more than $130 billion overnight at a rate of 4 percent after the overnight rates that banks charge to lend money to one another leaped. The Federal Reserve injected $24 billion to the United States banking system to keep its benchmark overnight lending rate at 5.25 percent, after it opened this morning at 5.5 percent.It is common for central banks to step in to stabilize the financial system when banks are either pumping too much or too little money into the markets. What was unusual about the move Thursday was the size and speed with which the banks acted.""There is certainly a liquidity crisis in the financial system that the normal players themselves are having a little bit of difficulty working out,"" said Jane Caron, chief economic strategist at Dwight Asset Management, a bond firm based in Vermont. ""The Fed provided some assistance.""In the bond markets, Treasury prices were up and the yield on the 10-year note, which moves in the inverse direction of its price, fell to 4.805 percent, from 4.879 percent on Wednesday evening.The premium that investors demand to hold junk bonds and other riskier assets, which had gone down in the last couple days, increased somewhat Thursday and trading was again light across the credit market.""It's just indicative of a lack of confidence, of people really not know what is going on,"" said Kingman Penniman, president of KDP Investment Advisors, a research firm that specializes in high-yield debt. ""So they react quickly to good or bad news.""During the recent boom in credit, banks and brokerage firms lent large sums to hedge funds and other investors who drove down the premium on risky assets like bonds backed by subprime mortgages that are made to people with tarnished credit histories and those taking on excessive debt.Now as defaults on those loans are rising, banks and brokerages are demanding that fund managers come up with more collateral to back up margin loans or sell assets. Investors in these funds are also clamoring to redeem their shares in the funds.""Its like popcorn in a kettle, first you have one or two pops,"" said James Melcher, president of Balestra Capital, a hedge fund based in New York, ""then it turns into a cacophony.""Most experts believe the nation's mortgage problems will likely worsen in the coming months as hundreds of billions in adjustable-rate loans reset to higher rates in the next 12-to-18 months. At the end of March, nearly one in five subprime home loans were either past due or in foreclosure.At his press conference this morning, Bush said he does not support granting U.S. government funds to distressed homeowners who are on the verge of losing their homes, but he said the Federal Housing Administration should have flexibility to help borrowers refinance their home loans.He also said he felt ""there needs to be more transparency in financial documents"" so that borrowers ""know what they're signing up for.""The market appeared to react positively to remarks by Bush that the administration would not favor changing the way partners in private equity firms are taxed. In recent months, several prominent lawmakers have proposed subjecting the investment gains of fund managers — known as ""carried interest"" — to the ordinary income tax rate of up to 35 percent, rather than the capital gains rate of 15 percent.Noting that partnerships are a common structure among small businesses, Bush said he was satisfied with the current tax structure. ""We are very, very hesitant about trying to target one aspect of limited partnerships,"" he said, ""for fear of it affecting small business growth.""Carried interest has come under criticism because it has allowed managers of private equity firms and hedge funds to pay very little in taxes on income they derive largely from managing their investors' assets rather than putting their own capital at risk."
3,"WASHINGTON —President George W. Bush, seeking to reassure Americans about the economy and combat Democratic criticism of his policies, said that recent financial market turbulence was not a cause for worry but a natural adjustment from the improvident lending of recent years.Speaking Wednesday at the Treasury Department, with Treasury Secretary Henry Paulson Jr. sitting across the table and reporters seated in a circle around them, Bush said that his economic advisers would be ""paying close attention as the market begins to readjust its assessment of risk"" in housing and other sectors.It was an unusual presentation for Bush, both politically and economically. Presidents are usually advised not to wade into discussions of markets at a time when they are so unpredictable and anxiety-inducing.Bush's suggestion that the recent housing declines should be seen as a normal market correction from past excesses and that the government should avoid interfering with the process carries political risks at a time when people are losing their homes, lending institutions are shaky and Democrats are demanding action.Indeed, immediately after the president's comments, Democrats excoriated him for saying that the economy was in sound shape. Many called on the administration to encourage federal housing agencies to step in and make more money available, perhaps by buying up troubled mortgages to avoid foreclosures.For his part, Bush, in a verbal tour of the current economic scene, was eager to both calm the markets and bat down the Democratic calls for the administration to intervene, predicting that the turmoil in the housing sector would end with a ""soft landing"" and would not damage the larger economy.""I believe that markets ultimately look at the fundamentals of any economy,"" Bush said. ""And the fundamentals of our economy are strong. Inflation is down. Real wages are increasing. The job market is a strong job market. People are working. Small businesses are flourishing.""Bush, who has a Harvard MBA, confidently used phrases like liquidity, risk assessment and market adjustment to describe complex economic conditions.Asked about collapsing housing markets, and the risk of them declining further, Bush said: ""In a way it's a necessary reaction to a flood of liquidity that came into the market in the past couple years."" That was financial jargon for the past several years of easy money, some of it from overseas, at low interest rates.Bush said that ""housing got really hot"" as a result of the deep pools of money available and that a decline was inevitable. He added that ""if the market functions normally"" it will lead to a soft landing. ""That's kind of what it looks like so far,"" he contended.Democrats are reacting to the current situation less philosophically. Several are calling for the two big government-sponsored buyers of mortgages from lenders, Fannie Mae and Freddie Mac, to provide more money for housing by buying more loans and holding them.Senator Charles Schumer, Democrat of New York, who is chairman of the housing subcommittee of the Senate Finance Committee, said that if these agencies did not act, it would lead to a collapse of the market for sound mortgages, not just the deeply troubled ""subprime"" loans that were sold to new homebuyers and people with less-than-sterling credit.""We need to allow Fannie and Freddie to put more credit into prime lending,"" Schumer said. ""This is favored by most Democrats and a good number of Republicans.""But Bush appeared to resist that idea, saying that the agencies needed to overhaul their own practices in the wake of their accounting scandals before jumping into the current crisis. ""Let's get them reformed first,"" he said.Bush said the housing crisis had occurred in part because borrowers had not read the ""fine print"" on their mortgages. ""There needs to be financial education measures in place,"" he said.Bush's session with economic writers was unscheduled until Wednesday morning, when he was at the Treasury building for an annual meeting with his economic team. Their intent was to plan for issues like the budget, taxes and financial regulation coming up in the autumn.Bush also said he would oppose legislation aimed at punishing China for its economic practices, including its efforts to control the value of its currency to encourage cheaper exports. Expressing the need for the United States to lead the global economy, he called on Democrats to approve recently negotiated trade deals with Peru, Panama, Colombia and South Korea.The Peru and Panama deals had appeared to be on track for passage earlier this year, but Democrats backed off in June. Representative Charles Rangel, Democrat of New York, who is chairman of the House Ways and Means Committee, said in an interview that he now expected the Peru deal to proceed in September.Rangel was in Peru earlier this week and said that Peruvian leaders had committed themselves to several steps to protect worker rights, reassuring him on that subject. ""The Peruvians,"" he said, ""will be doing everything that has to be done for this to be passed.""The president said he had also discussed with Paulson and other cabinet members the possibility of tax changes and regulation reductions aimed at overcoming what some see as a weakening of the competitiveness of U.S. capital markets."
4,"U.S. Stocks dropped sharply as soon as trading opened Thursday after a French bank, BNP Paribas, suspended operations of three of its funds in the wake of turmoil in the American market for home loans and the European Central Bank and the Federal Reserve injected cash into the financial system because of tightening credit markets.The Dow Jones industrial average fell more than 200 points, or 1.5 percent, while the Standard & Poor's 500-stock index and the Nasdaq composite index were down just as much. Stocks remained volatile through the morning, and at 11:15 a.m., the Dow was down about 120 points. The S.&P. 500 was off by about 1 percent, while the Nasdaq had recovered most of its losses.Asked at a news conference this morning whether he thought the turmoil in the subprime lending market could put a chill on credit in the broader economy, President George W. Bush said, ""The fundamentals of our economy are strong,"" adding, ""I'm told there is enough liquidity to enable the system to correct.""The latest upheaval on Wall Street came after a sell-off in Europe, which was prompted after BNP, the largest publicly traded bank in France, became the latest European lender to announce problems linked to the worsening credit market in the United States, where several large companies have already announced losses.A German central bank meeting was under way to discuss details of a rescue package for the lender IKB, another victim of exposure to the crisis in subprime lending.Jonathan Mullen, a spokesman for BNP, said that the credit squeeze in the United States had made it impossible to calculate the value of the underlying assets of the funds and that the bank was obliged by market conditions to halt holders of the funds from cashing out or new investors from buying shares in the funds.""It's quite exceptional to suspend funds, and it means that people can't buy in or sell out of the funds,"" Mullen said. ""But we hope this is going to be temporary and that the market will come back.""Mullen said that about one-third of the funds were exposed to subprime loans but that those investments were in high quality parts of that market. ""We've seen no degradation in the quality of these assets, none of which have been put on watch for a downgrade,"" Mullen said. ""This is just a technical problem about liquidity.""With banks pulling back on lending over all, the European Central Bank lent more than $130 billion overnight at a rate of 4 percent to inject cash into the financial system, and the Federal Reserve added $24 billion in temporary reserves to the United States banking system.A key question is whether some European lenders know the full extent of their exposure to the subprime lending crisis. Only last week, BNP's chief executive, Baudouin Prot, said the bank's exposure to subprime woes was ""absolutely negligible.""BNP shares fell more than 5 percent in early trading, but Mullen reiterated that the bank itself had almost no exposure to the subprime crisis. He said the funds are held by BNP clients and represent just a fraction, or 1.6 billion euros, of the 600 billion euros the bank currently has under management.Some analysts have said it is difficult to determine the exposure of banks to the United States subprime market because they are often held through collateralized debt obligations, financial products that bundle securities and help spread risks, and banks often do not disclose their exposure.Standard & Poor's, the debt rating agency, in July cut credit ratings on $6.39 billion of bonds backed by subprime mortgages.Fitch Ratings said it was reviewing $7.1 billion, including 19 collateralized debt obligations, for a possible downgrade.Concern among investors about possible effects of subprime investments and recent woes in the credit markets have outweighed rising earnings at European banks last month.Shares of Deutsche Bank and BNP dropped on Aug. 1 even though both reported better-than-expected profit in the first half. Investors are reducing their exposure to banks with large investment banking arms, fearing losses from leveraged loans they have underwritten but cannot sell on to investors.Analysts at Keefe, Bruyette & Woods, said earlier this month that while exposures to subprime may lead to ""modest losses or slightly lower revenue"" among European banks — but that would be ""entirely manageable."""
