,0
23,"This should have been Edward M. Gramlich’s moment.For more than a decade, even before he was named a governor of the Federal Reserve Board in 1997, Mr. Gramlich was warning of dangers in the housing market, a stance that has made him a sought-after expert in the current crisis.As chairman of the Neighborhood Reinvestment Corporation, he urged legislators to better protect consumers against predatory lenders, and toughen regulation of mortgage lenders and banks. Nonetheless, his efforts met resistance within the Fed and on Capitol Hill, and even he admits he could have pushed earlier for reform.Still, in June, he published a timely book, “Subprime Mortgages: America’s Latest Boom and Bust,” that has linked his name once more to the home loan situation, which he says he never could have expected would become so dire.By rights, Mr. Gramlich would be entitled to be at the center of the debate. But instead, he is fighting for his life.After falling ill during a trip to Africa in March, he was diagnosed withacute myeloid leukemia, an advanced cancer of the white blood cells, for which treatment is arduous and survival rates low.It is his second bout with the disease. In 2002, while at the Federal Reserve, he was diagnosed with acute lymphocytic leukemia, a more treatable form of blood cancer. After chemotherapy, he went into remission.Mr. Gramlich, 68, has been offered a highly experimental treatment, overseen by his doctors at Johns Hopkins Medical Center in Baltimore, to help fight his new cancer, for which he already has undergone one round of procedures. But he has decided to forgo it, at least for now.Though doctors cannot say with certainty how long he will live without the therapy, his wife estimates it may be no more than a few months.“It’s a hard decision,” Mr. Gramlich, known as Ned, said in a telephone interview this week from his home in Washington (unable to go out in crowds, he now sees few visitors except family). “This whole thing, I have to say, is tremendously unfair, that it hit. But it did hit, and what do you do now? You make the best of it.”As to be expected from the author of a book on cost-benefit analysis, as well as the former chairman of the federal loan board for the airline industry, Mr. Gramlich is weighing the pros and cons of his own situation with an economist’s detachment.In this case, he balanced the quality of life, or lack thereof, that the treatment might afford. “It’s a great maybe,” Mr. Gramlich said.With remission unlikely, the experimental treatment might extend his life, “but maybe not, and it could shorten it,” he said. Moreover, Mr. Gramlich, who is already weak from his disease, was told he would probably become even sicker as the treatment progressed.“I just didn’t want to do it,” Mr. Gramlich said. He added that he might consider other treatment options, but he and his wife also plan to investigate hospice care soon.Though his decision was made pragmatically, it has still shaken his friends. “For him to talk about going out is a lot easier than it is for all of us,” said Roger W. Ferguson, a former vice chairman of the Federal Reserve who served with Mr. Gramlich, and is now chairman of Swiss Re America Holding, the United States branch of the global insurer.But Mr. Gramlich’s conclusion was “in character” with his analytical side, Mr. Ferguson added.Mr. Gramlich’s decisions recall those of the author and political columnist Art Buchwald. In February 2006, he chose to discontinue receiving dialysis for kidney disease.Although told he might be dead within weeks, Mr. Buchwald lived on for nearly a year, writing another book, and playing host to famous friends at his hospice bedside. He died in January, and marked his passing with avideo obituaryfor The New York Times’s Web site that began with this declaration: “I’m Art Buchwald, and I just died!”Mr. Gramlich acknowledged the similarities: “He essentially made the decision that treatment was awful, he couldn’t abide it, and so, to hell with it, let’s see what happens.”While not approaching his fate with quite so much humor, Mr. Gramlich is displaying at least as much candor.This month, he and his wife, Ruth, shared his decision not to seek further experimental treatment in a newsletter they had posted on a Web site calledCarePages, which allows patients to update family and friends about their treatment, and receive messages of support.More than 350 people have logged in to read Mr. Gramlich’s CarePage, which Mrs. Gramlich said had spared the family the time and emotional trauma of notifying people themselves.“You’re overwhelmed by caring people who want to know what’s going on,” Mrs. Gramlich said.Readers have included family friends, former government colleagues and associates at the University of Michigan, where Mr. Gramlich served as dean of its public policy school and, more recently, as acting provost in 2005 and 2006.Along with health updates, the entries have shared the family’s emotional frustration.“We were brought up by the older generation to be much less forthcoming about these things, both the facts and the emotions,” Mrs. Gramlich said.With close friends, “Ned and I would be absolutely honest that this is incurable; it also would be dishonest not to say we’re sad and devastated.”But his illness has not yet prevented Mr. Gramlich from having his say about the housing market, an interest of his that predates his years at the Fed.While there, he spoke frequently about the boom in home prices that took place earlier this decade, warning that loans by predatory lenders to low-income buyers were not receiving enough scrutiny.Their practices, like charging excessive fees and refinancing for the sole purpose of collecting more fees, “jeopardize the twin American dreams of owning a home and building wealth,” he said in a 2002 speech.Mr. Gramlich said that upon leaving the Fed two years ago, he had planned to write about the housing boom. But his tenure at Michigan intervened, and by the time he completed the manuscript last December, the subprime market was on its way to collapsing, fulfilling his worst policy fears.Last month, despite his obvious poor health,he spoke at lengthabout potential solutions during a televised panel sponsored by the Urban Institute; he is a senior fellow there, and the institute published his book. (The group’s president, Robert Reischauer, said of Mr. Gramlich: “Ned is to the policy community what an Olympic gold medal decathlete is to the world of sports.”)He voiced a repeated theme, that more regulation of subprime lenders is needed from the Fed and other agencies. Lately, that is a point the Federal Reserve has made, “but they seem to be alone,” Mr. Gramlich said.Rather than watch troubled borrowers flounder, he would like to see community groups help them avoid foreclosure, and even purchase homes that could be sold to low-income borrowers. “With very small amounts of money, they could do a world of good,” he said.He noted the incongruity of the timing of his illness, coming just as an issue so important to him had become front-of-mind for many policy makers. “It’s good news and bad news,” Mr. Gramlich said.On the downside, his illness is preventing him from making many more appearances to promote his book, since he is susceptible to infection.But the good news “is that the last thing I ever did was really important,” Mr. Gramlich said. “I really feel I got it right at the end.”"
24,"The Federal Reserve, saying for the first time that the recent disorder in the financial markets has raised the risk of an economic downturn, took the unusual step yesterday of encouraging the nation’s banks to borrow directly from the Fed, particularly to support home mortgage lending.The early morning announcement of a drop in the so-called discount rate, made even before the stock market opened, sent Wall Street soaring as relieved investors celebrated the Fed’s tacit acknowledgment that it had made a mistake last week in playing down concerns over the spreading distress in the credit markets. After falling for six straight days, the Dow Jones industrial average shot up 233.30 points, to 13,079.08, a 1.8 percent increase.The Fed, while not yet cutting a rate that wields more influence over the economy, moved to stimulate lending in part because it recognized that even well-to-do families with good credit ratings were having difficulty getting mortgages. That problem, radiating through the housing market and then the broader economy, had “the potential to restrain economic growth,” the Fed said.The sudden action also suggested that the nation’s central bankers were worried that a major financial institution might be at risk of failure if the Fed did not move before its policy makers gather for their next regular meeting, on Sept. 18.Analysts predicted that the Fed was likely to go further, cutting market interest rates soon, perhaps even before its meeting next month if its action yesterday does not help to shore up confidence on Wall Street and elsewhere in the economy.The mechanism for lifting the mortgage market was a cut of half a percentage point, to 5.75 percent, on borrowing from the discount window, a normally rare practice in which the Fed lends directly to banks facing some sort of trouble.“We want to make it very clear that we are happy to lend,” one Fed policy maker said, “and we are eager for banks to use the discount window.”In a conference call yesterday, Fed officials told major banks that discount window borrowing would be viewed as a sign of strength, not weakness.Just the way in which the Fed acted showed how quickly its previous concerns about the greater risk of inflation had evaporated. The Fed’s standard practice, for more than a decade, has been to change rates and issue statements only at scheduled meetings of policy makers. Inter-meeting actions only underscore the dire nature of the situation.But as stock prices moved wildly once again on Thursday, the Fed’s chairman, Ben S. Bernanke, convened a 6 p.m. teleconference call, and after an hour of discussion, the 10 policy makers present voted unanimously for the discount rate cut and for an assessment of the economy clearly more negative than the upbeat one issued just 10 days earlier.That earlier statement, issued after the Fed’s Aug. 7 meeting, said that the economy “seems likely to continue to expand at a moderate pace over coming quarters.” The new description repeated the view that the economy would expand at a “moderate pace,” but added “that the downside risks to growth have increased appreciably.”William Poole, president of the Federal Reserve Bank of St. Louis, was missing from the conference call and Fed officials explained carefully to reporters that he was absent only because of a conflict with a long-scheduled dinner appearance, adding that suddenly canceling that appearance might alarm the marketplace. Mr. Poole has publicly opposed a cut in the federal funds rate.Indeed, no change was made yesterday in the more important federal funds rate, which the Fed uses as its main policy tool, cutting it to stimulate a flagging economy or raising it to rein in a potentially inflationary one. Still, yesterday’s action suggested that the funds rate itself — which directly affects what businesses pays for loans and what ordinary Americans pay for home equity borrowing, car loans and various other consumer credit — would soon be cut.“What the Fed is really saying is that this recovery is more in danger than it has been since it started nearly six years ago,” said Jan Hatzius, chief United States economist for Goldman Sachs, who predicted an initial cut in the funds rate to 5 percent, from the present 5.25 percent.The discount move, coupled with formal acknowledgment that the economy might be in trouble, represents Mr. Bernanke’s boldest attempts to relieve the financial crisis, his first real test since becoming Fed chairman 18 months ago.The Fed’s admission that the economy might not be so healthy suggested to Mr. Hatzius and others on Wall Street that an initial cut in the federal funds rate, which has been at 5.25 percent for nearly 14 months, could be followed by several more in the months ahead as the Fed braces for the possibility of a weakening economy, dragged down by a shrinking housing market.“This is a watershed statement from the Fed to let the markets and politicians know that the Fed is prepared to act as needed,” Stuart G. Hoffman, chief economist at PNC Financial Services Group, wrote in a note to clients.Fed policy makers and Treasury officials said that in cutting the discount rate, the Fed’s principal goal was to shore up the market for creditworthy mortgages, including those for more expensive homes.While that market is primarily for more affluent borrowers, Fed officials said they were worried that average Americans would suffer, too, if the troubles in the so-called jumbo mortgage market infected the rest of the economy. The collapse of so many subprime mortgage securities had spread to the larger market, and lenders of high-quality mortgages were having trouble selling the loans they made.So the Fed said to the banks in effect: borrow at the discount window, using the mortgages as collateral, at a rate of 5.75 percent, down from 6.25 percent. Moreover, banks were encouraged, if necessary, to roll over the loans every 30 days, an easing of the usual 24-hour rule.That brought the discount window into the financial crisis, which the Fed, until yesterday, had dealt with in a different manner. It did so by adding billions of dollars to the banking system, to keep the federal funds rate at 5.25 percent. This is the interest that banks and other lending institutions pay to borrow from each other to finance their operations.In the midst of the crisis, the federal funds rate spiked to a level above 6 percent.Cutting it will inevitably raise the charge that the Fed is bailing out hedge funds and others who borrowed billions of dollars to invest in subprime mortgages, ignoring the risk that many of the low-income households who got these mortgages would default.Lower interest rates raise the odds that risk takers can sell bad investments with less of a loss.“You would be mitigating their problems,” said Alan Blinder, a Princeton University economist and a former Fed governor, but “I would count that as a social cost of saving the economy.”What remains unclear is how much damage, if any, the economy has suffered from the market turmoil. The Fed promised “to act as needed to mitigate the adverse effects,” but data documenting any damage takes weeks to collect.Home construction is clearly down, and recent economic reports show that consumption has weakened since the first quarter.“If there was evidence of a significant decline in spending, that would induce the Fed to cut rates, but there is no evidence of a significant decline in spending,” said Mark Gertler, a New York University economist who did research with Mr. Bernanke when the Fed chairman was a Princeton professor.The earliest damage would show up in consumer sentiment. The University of Michigan’s Survey of Consumers released a poll yesterday showing that Americans were somewhat more pessimistic because of costly food and fuel, not the unfolding financial crisis. “People have not yet begun to calculate how the market turmoil might affect their own situation,” said Richard T. Curtain, director of the Michigan survey. “That is still in the future, if it ever happens.”"
25,"MORTGAGE lenders aren’t the only ones reassessing their appetite for risk. So, too, are equity investors, many of whom have been oblivious to the concept of risk in recent years, thanks to what had been a beneficent bull market.But the recent troubles in the subprime mortgage market have changed all that.Rising mortgage delinquencies have roiled some hedge funds and institutional owners of mortgage-backed securities, and the equity markets have suffered sympathy pains — leading to a drop that at its worst moment last week amounted to more than 1,100 points in the Dow Jones industrial average.And last week, there was yet another round of hand-wringing on Wall Street as several mortgage companies had difficulty raising funds in the credit market. But on Friday, the Federal Reserve took action to ease some of those fears by lowering the discount rate, the interest rate that it charges for short-term bank loans, by half a percentage point. And the Fed said it was prepared to take further action if needed. Still, it’s clear that stock investors have lowered their assessment of riskier investments, said James W. Paulsen, chief investment strategist at Wells Capital Management in Minneapolis. There’s still a question hanging over the market. “It’s whether this shift is aggressive enough and persistent enough to affect how this market cycle turns out,” he said.While it’s impossible to know whether this will turn out to be just another short-term scare — like previous sell-offs, in late February and in May 2006 — or if this is the start something bigger, investors would be wise to reassess their exposure to risk, financial planners say.That’s because once the market loses its appetite for risky assets, investors “tend to throw out the babies with the bath water,” said Ronald W. Rogé, a financial planner in Bohemia, N.Y.Where are equity investors most vulnerable? Financial planners and market strategists point to at least three basic areas:SMALL-COMPANY STOCKSAt the start of 2000, the typical retirement investor held $1 in small-capitalization stocks for every $16 invested in large, blue-chip shares, according to Hewitt Associates, the employee benefit research firm in Lincolnshire, Ill. But by July this year, that ratio had shrunk to just 1 to 3.6, as investors chased hot-performing small-cap stocks — and as those shares grew faster than the broader market.This portfolio allocation may be putting investors in a precarious position. “The sword cuts both ways,” said Greg Schultz, a principal at Asset Allocation Advisors, a financial planning firm in Walnut Creek, Calif. Though small-cap stocks tend to climb faster than blue chips in a market upswing, they also tend to lose ground more quickly in a market downturn.Indeed, since the start of July, large stocks, as measured by the Standard & Poor’s 500-stock index, have fallen 3.8 percent while small stocks in the Russell 2000 have lost 5.7 percent.And there’s another reason to fear overexposure to small stocks: many savings institutions — those traditionally classified as savings and loans — are small-cap companies, and many of them have been buffeted by the mortgage debacle. In fact, a recent analysis by Morningstar showed that while 67 percent of large-cap stock funds have some exposure to these savings institutions, 88 percent of small-cap funds are so exposed. And this financial industry group has been among the worst-performing so far this year, down nearly 18 percent, on average.FINANCIAL SECTOR STOCKSNo sector of the economy is more vulnerable to the current mortgage crisis than the financial services industry. And no sector accounts for a larger slice of the Standard & Poor’s 500-stock index. At the end of last year, financial companies represented a record 22.3 percent of the S.& P. 500. That was up from 7.5 percent at the end of 1990.To be sure, there was never a bubble in this sector, as there was in technology in the late 1990s. Indeed, financial stocks in the S.& P. 500 now trade at a lower price-to-earnings ratio than the broad market. That was certainly not the case for tech in 1999.But there is still a potential problem, if only because the sector represents such a wide swath of the market. If your domestic stock portfolio mimics the broad market, more than one-fifth of your holdings are in this sector just as this credit crisis is unfolding.“I think it’s going to be guilt by association,” said Christopher Orndorff, head of equity strategy at Payden & Rygel, an asset manager in Los Angeles. “Financial firms will be presumed guilty” when it comes to their exposure to the subprime crisis until they prove themselves innocent, he said.Mr. Orndorff added: “This is no time to go bargain-hunting in financials.”EMERGING-MARKET STOCKSDespite its lack of exposure to the domestic mortgage crisis, the average diversified emerging-market stock fund has lost 16.4 percent of its value over the past month. That’s more than the average financial sector fund has lost.That is to be expected, said James A. Shambo, a financial planner in Colorado Springs. “Some folks will flee risk in general because they don’t understand what’s going on.”Mr. Shambo says he’s not sure that the credit crunch means the end of investors’ five-year love affair with emerging-market stocks. But eventually, he said, the performance of emerging-market stocks will slow and return to historical norms. And when that happens, the “emerging markets will be affected in their own right.”Though emerging-market stock funds have produced enviable annualized gains of nearly 28 percent over the past five years, investors forget that these same funds lost money in five of the six years from 1997 to 2002.Now, the average investor in a 401(k) retirement plan holds only 1.3 percent of his or her assets in emerging-market equities. “But the average can be very deceptive,” said Pamela Hess, Hewitt’s director of retirement research.Of those 401(k) participants who invested any of their money in the emerging markets, Ms. Hess noted, the typical allocation is 16.4 percent, according to a study Hewitt conducted last year.In many cases, investors may have started with a much more modest exposure to emerging markets, she said. But by failing to rebalance their accounts in recent years, some investors allowed their allocations to this and other risky asset classes to explode.The concern is now this: Will those risky assets blow up investors’ portfolios now that the market has a new-found aversion to risk?"
