,0
34,"The wild swings in the stock market over the last few weeks have reawakened memories of the technology crash of 2000 in which many small investors lost their savings. But this time around, market experts say, ordinary investors seem less vulnerable than the professionals who have taken a beating.The excesses in the financial markets are now generally believed to reside in complex mortgage securities and other esoteric investments, not in the traditional stock and bond markets where average Americans put their money.Over all, analysts say that the situation may well get worse before it gets better. The Standard & Poor’s 500-stock index has fallen about 6.4 percent since July 19 when it set a record high. It is considered normal for the market to fall as much as 10 percent periodically during bull markets. That leaves room for the Dow Jones industrial average to fall another 640 points, to 12,600.In the near term, average Americans can expect more turmoil and uncertainty in the stock market and may have a harder time obtaining mortgages. But investment experts say that ordinary long-term investors, as long as they are diversified, should worry less.“There is no immediate crisis” for the long-term individual investor, said Michael Poulos, a managing director at Oliver Wyman, a consulting firm that specializes in financial services. “This is mostly a case of relatively rich, sophisticated investors who made big bets on the credit spreads that will have big problems. It is not Joe 401(k).”The crisis has reverberated throughout the financial markets, but the greatest impact has been felt by investors in mortgage securities and those involved with corporate buyouts. Also, hundreds of thousands of homeowners are facing resetting rates on loans and may not be able to refinance easily into another loan.Last week, the Federal Reserve and other central banks lent $293 billion to banks to ensure that there was enough money to lend to borrowers.But even skeptical market watchers acknowledge that stocks, which average Americans buy through mutual funds, appear less vulnerable than the market for complex debt investments typically bought by hedge funds, pension funds and insurance companies. Since bottoming out in late 2002, stocks have risen at a more modest pace than in the 1990s — an average of 13 percent a year. And despite recent losses, the Dow is still up 6.2 percent since Jan. 1.The ratio of stock prices to corporate profits for the Standard & Poor’s 500 stock index is 16.8, slightly above the average of 15.7 since 1935, but below the average of 22.8 since 1988.On numerous occasions in recent decades, stocks have fallen 6 percent or more in a short period. In most cases — in 1998, 1999 and 2003, for example — stocks began rising again soon. In a few cases, most notably 2000, the initial declines signaled larger problems.There is no way to predict where the market will go, but many investment specialists say the economy is fundamentally strong. Companies are adding jobs and real wages are rising. (On Monday morning, Japanese stocks increased slightly, with the Nikkei 225 index up 0.48 percent at midday.)Still, the fact that the markets in the United States are falling despite a vibrant global economy has been unnerving to individual investors.“How concerned should I be?” asked Shanna Rendon, a 53-year-old retired lab technician in Grand Junction, Colo. “I am managing the finances for our retirement — and I don’t want to lose money.”She and her husband lost more than $1 million of their retirement nest egg in the crash that followed the boom of the late 1990s. But they have been able to recover over the last few years as the stock market rallied.“I look back at the tech wreck and see overvalued companies,” she said. “Now, I am looking at a country where the economy has a problem because of a lot of credit. What is going to prop up the economy with all that debt?”In the short term, investors like Ms. Rendon can probably expect more turmoil. Expectations of future volatility — though they are far lower by one popular measure than they were early in this decade and in the late 1990s — have surged to their highest levels in more than four years.“Certainly for young folks, this is a shocker,” Jim T. Swanson, chief investment strategist at MFS Investments in Boston, said about volatility. “But the 20-year numbers suggest that this is a return to normal.”Individual investors should figure out how comfortable they are with the risks of their investments, while considering their financial circumstances and investment goals, advisers say.Many financial experts suggest investors consider moving their money to less risky investments like Treasury notes and blue-chip stocks, which they expect to now perform better than junk bonds and smaller stocks.But they caution against impulsively buying and selling stocks based on a short-term market swing. “None of us are going to be able to time our moves,” said Liz Ann Sonders, chief investment strategist at Charles Schwab. “If you take a more systematic approach, then you are sort of putting yourself on the right side of the market. But it’s not human nature to do that. We love to ride our winners until something happens.”For now, anxiety is particularly high among well-heeled investors in some hedge funds that have reported losses. Many are flocking for the exits, forcing portfolio managers to sell otherwise solid investments.And the demands could intensify this week: Wednesday marks 45 days before the end of the quarter, the deadline by which most hedge fund investors must notify the funds if they want to redeem their investments.Stock prices could also decline further if investors no longer expect the big premiums that private equity firms have been paying to buy public companies.Financial stocks, which often lead the market, are down 10 percent for the year. Many banks and brokerages were riding high in recent years because of the lucrative fees they earned during the buyout boom. A big test will come when bankers have to raise money for big private equity acquisitions like the ones that are pending for the First Data Corporation and Sallie Mae.In the mortgage market, the prognosis is expected to be bleak for some time. A glut of unsold properties in many parts of the country suggests that home prices have further to fall.Optimists, however, note that the American economy is running smoothly. Unemployment is at 4.6 percent, near record lows.Borrowing costs are rising but are still cheap compared with historical rates. Public companies are flush with cash and corporate profits are growing at a robust pace. Investors have trillions of dollars sitting on the sidelines, waiting for the right time to jump into the market.Larry Reno, a retired government worker who lives in Atlanta, is among the would-be bargain hunters. “There are a lot of stocks out there that are getting beat up and have good fundamentals,” said Mr. Reno, who calls himself a long-term investor. “To me, it’s like the day after Christmas, when all the department stores put the stuff on sale.”To place the current period in context, many experts are studying the credit crisis in 1998, when Russia defaulted on its debts and the hedge fund Long-Term Capital Management collapsed. “In 1998, 60 subprime companies went out of business,” said Meredith A. Whitney, an analyst with CIBC World Markets. “And that didn’t send our economy into a recession.”In fact, the stock market climbed higher after the Fed intervened to save Long-Term Capital and the International Monetary Fund lent money to Russia.But other market watchers contend that employment and profits are often lagging indicators and that the American economy is already slowing.As adjustable-rate mortgages are reset, many homeowners will face higher monthly housing payments. That could force some families to cut back on spending.Sallie L. Krawcheck, head of global wealth management at Citigroup, said investors should be “making adjustments for risk and, if appropriate, exploring possible buying opportunities.”They should focus on whether “the market volatility bleeds over into the health and behavior of consumer,” she said. “That is the key for the real economy.”"
35,"SINGAPORE, Aug. 13 — If there is a crisis in global financial markets, it wasn’t apparent in Asia today.After Friday’s slide in Asia, some of the region’s biggest markets sprang back today. They were helped by the slight recovery on Wall Street after the close of Asian markets late last Friday.Australia’s benchmark index gained 1.3 percent and South Korea’s main index rose 1.6 percent.Reflecting some of the inverse logic that seems to govern markets of late, Japan’s Nikkei 225 Stock Average index rose on news that the country’s economic growth was slowing, and that the central bank had lent an additional $5 billion to banks to ensure adequate funds in the money market.Commodity prices recovered after declining on concerns that hedge funds were selling their positions to cover losses related to the United States subprime mortgage market.It appeared that moves by the world’s most important monetary authorities, the Federal Reserve, the European Central Bank and the Bank of Japan, to avert a shortage of cash in global markets had worked for the time being.After the Bank of Japan’s announcement today, the Reserve Bank of Australia and the European Central Bank said they were putting more funds into the market.Last week, concerns about growing losses in the ailing market for subprime mortgages in the United States prompted many investors in Asia to take funds out of any investments that were considered relatively risky, either because they involved emerging markets or because they were tied to high levels of debt.The recovery today encouraged some analysts to sound a note of optimism. They pointed to a growing awareness that Asia is still flush with funds and doesn’t suffer from the same reliance on debt as investors do in Europe and the United States.“The worst of it’s behind us in Asian markets,” said Adrian Mowat, a strategist at J.P. Morgan in Hong Kong. “Asian monetary systems have been relatively flush with cash and growth here is typically being funded by earnings — household and corporate, rather than debt funding.”Others, however, warned that more surprises could be in store for the region and that today’s recovery might in retrospect be only a temporary respite.“We think the volatility will continue for a while,” said Hans Goetti, head of research strategy at Citi Private Bank in Singapore.There was, therefore, still an air of uncertainty in Asia today, analysts said, with investors selling stocks in some smaller markets and buying stocks in larger economies, especially financial and commodity-related stocks that had been pushed down last week.“As information flows out, people are waiting to see what happens next,” said Rahul Malhotra, managing director for private banking in the Middle East and Pacific Rim at Merrill Lynch in Singapore.Merrill’s advice to its clients, Mr. Malhotra said, was not to join the panic selling, advice he said that most appeared to be taking.Indeed, some analysts said the latest declines provided an opportunity to buy Asian stocks more cheaply.“I like these types of events because the market overreacts,” said Mr. Mowat. ”The comments that come across in the media are overstating what the real impact is.”Australia’s benchmark S&P/ASX 200 Index climbed back part of the way after falling 3.7 percent on Friday, its biggest drop in six years.Traders said moves by the Federal Reserve and by Australia’s Reserve Bank of Australia to ensure adequate liquidity restored confidence among investors.The Australian dollar climbed higher after the Reserve Bank raised its outlook for inflation, increasing the likelihood that it would raise interest rates.Because metals are Australia’s largest export, the Australian dollar also tends to move with commodity prices.Prices for oil and copper rose today amid signs of growing Chinese demand and falling global stockpiles.The Bank of Japan said today that it had lent banks an additional 600 billion yen to help ensure adequate funding in the interbank market, after pumping 1 trillion yen into the market on Friday."
36,"If there is a crisis in global financial markets, it was not apparent in Asia and Europe today. And on Wall Street, the week got off to an unremarkable start.Stock prices were up moderately but broadly in the United States for most of the day, with little of the volatility that had characterized the markets last week. But the major indexes shed their modest gains late in the trading session and finished the day not far from where they closed on Friday.When trading ended, the Dow Jones industrial average closed down 3.01 points, at 13,263.53. The broader Standard & Poor’s 500 stock index and the Nasdaq composite were each off 0.1 percent or less.A number of early developments appeared to help put investors at ease today. Before the market opened, the government reported that retail sales rose in July at a solid pace. With mortgage markets tightening and home values dropping in many parts of the country, some economists have questioned whether consumer spending could stand up.Also, Goldman Sachs moved today to shore up one of its hedge funds that has suffered huge losses in the recent market turmoil. The investment bank said it and other investors would add $3 billion to the fund.Separately, the Federal Reserve today added more money into the financial system, providing $2 billion in loans in an effort to help calm the markets.Financial stocks were a drag on the market today. Countrywide Financial, the nation’s largest mortgage lender, closed at $26.61, down 4 percent, and Fannie Mae was off 3.5 percent at $64.12.Technology equipment and telecommunications stocks were among the strongest performers. EMC, the data storage company, was up 7.5 percent to $19.05 ahead ofthe initial public offering of its VMware unit this week.Hewlett-Packard gained 2.6 percent to $48.43, and Sprint Nextel was up 3.4 percent at $19.49.In Europe today, stock indexes in Paris and Frankfurt finished about 2 percent higher, and British stocks were up almost 3 percent.The day’s tone was set in Asia, where some of the region’s biggest markets sprang back today after a slide last Friday. They were helped by the slight recovery in American markets after the close of Asian markets late last Friday.Australia’s benchmark index gained 1.3 percent and South Korea’s main index rose 1.6 percent.Reflecting some of the inverse logic that seems to govern markets of late, Japan’s Nikkei 225 Stock Average index closed slightly higher on news that the country’s economic growth was slowing, and that the central bank had lent an additional $5 billion to banks to ensure adequate funds in the money market.Central banks from Australia to the United States made similar loans today. The European Central Bank added $65.3 billion to the markets today.Last week, concerns about growing losses in the ailing market for subprime mortgages in the United States prompted many investors in Asia to take funds out of any investments that were considered relatively risky, either because they involved emerging markets or because they were tied to high levels of debt.The recovery today encouraged some analysts to sound a note of optimism. They pointed to a growing awareness that Asia is still flush with funds and doesn’t suffer from the same reliance on debt as investors do in Europe and the United States.“The worst of it’s behind us in Asian markets,” said Adrian Mowat, a strategist at J.P. Morgan in Hong Kong. “Asian monetary systems have been relatively flush with cash and growth here is typically being funded by earnings — household and corporate, rather than debt funding.”Others, however, warned that more surprises could be in store for the region and that today’s recovery might in retrospect be only a temporary respite.“We think the volatility will continue for a while,” said Hans Goetti, head of research strategy at Citi Private Bank in Singapore.There was, therefore, still an air of uncertainty in Asia today, analysts said, with investors selling stocks in some smaller markets and buying stocks in larger economies, especially financial and commodity-related stocks that had been pushed down last week.“As information flows out, people are waiting to see what happens next,” said Rahul Malhotra, managing director for private banking in the Middle East and Pacific Rim at Merrill Lynch in Singapore.Merrill’s advice to its clients, Mr. Malhotra said, was not to join the panic selling, advice he said that most appeared to be taking."
37,"If there is a crisis in global financial markets, it was not apparent in Asia and Europe on Monday. And in morning trading on Wall Street, the week was off to a relatively calm start.After the big slide Friday in Asia, some of the region's biggest markets sprang back Monday. They were helped by the slight recovery in American markets after the close of Asian markets late last Friday.The benchmark Australian index gained 1.3 percent and the main South Korean index rose 1.6 percent.Reflecting some of the inverse logic that seems to govern markets of late, the Nikkei 225 Stock Average index in Japan closed slightly higher on news that the country's economic growth was slowing, and that the central bank had lent an additional $5 billion to banks to ensure adequate funds in the money market.Central banks from Australia to the United States made similar loans Monday. The European Central Bank added $65.3 billion to the markets, and the Federal Reserve poured in an additional $2 billion.Stock prices rose moderately but broadly in the United States in morning trading, with the three major stock indexes gaining 0.5 to 0.7 percent, and little of the volatility that had characterized the markets last week. The Dow Jones industrial average was up about 70 points at the end of the first hour of trading, and remained there at noon.In Europe, stock indexes in London, Paris and Frankfurt rose more than 2 percent.Last week, concerns about growing losses in the ailing market for subprime mortgages in the United States prompted many investors in Asia to take funds out of any investments that were considered relatively risky, either because they involved emerging markets or because they were tied to high levels of debt.The recovery Monday encouraged some analysts to sound a note of optimism. They pointed to a growing awareness that Asia is still flush with funds and does not suffer from the same reliance on debt as investors do in Europe and the United States.""The worst of it's behind us in Asian markets,"" said Adrian Mowat, a strategist at J.P. Morgan in Hong Kong. ""Asian monetary systems have been relatively flush with cash and growth here is typically being funded by earnings - household and corporate, rather than debt funding.""Others, however, warned that more surprises could be in store for the region and that the rally Monday might prove to be only a temporary respite.""We think the volatility will continue for a while,"" said Hans Goetti, head of research strategy at Citi Private Bank in Singapore.There was, therefore, still an air of uncertainty in Asia on Monday, analysts said, with investors selling stocks in some smaller markets and buying stocks in larger economies, especially financial and commodity-related stocks that had been pushed down last week.""As information flows out, people are waiting to see what happens next,"" said Rahul Malhotra, managing director for private banking in the Middle East and Pacific Rim at Merrill Lynch in Singapore.Merrill's advice to its clients, Malhotra said, was not to join the panic selling, advice he said that most appeared to be taking.Indeed, some analysts said the latest declines provided an opportunity to buy Asian stocks more cheaply.""I like these types of events because the market overreacts,"" Mowat said. ""The comments that come across in the media are overstating what the real impact is.""The Australian benchmark S&P/ASX 200 rebounded after falling 3.7 percent Friday, its biggest drop in six years.Traders said moves by the Federal Reserve and by the Reserve Bank of Australia to ensure adequate liquidity restored confidence among investors.The Australian dollar climbed higher after the Reserve Bank raised its outlook for inflation, increasing the likelihood that it would raise interest rates.Because metals are the largest Australian export, the Australian dollar also tends to move with commodity prices.Prices for oil and copper rose Monday amid signs of growing Chinese demand and falling global stockpiles.The Bank of Japan said that it had lent banks an additional 600 billion yen, or $5.1 billion, to help ensure adequate funding in the interbank market, after pumping 1 trillion yen into the market Friday."
