,0
27,"FOR something that everybody assured us was “contained,” the subprime mortgage mess certainly has spread.Last week, the hemorrhaging credit markets bled right into the stock market. The major indexes are still up for the year, thankfully, but the Dow Jones industrial average, which hit 14,000 just three weeks ago, has lost 5.4 percent of its value since then. And the Standard & Poor’s 500-stock index is down 6.4 percent from its July peak.Why are the bond market’s troubles something for stock investors to worry about?The easy answer is that all markets, both here and around the globe, are intertwined. And despite Wall Street’s insistence that diversification — and therefore safety — could be found in different types of assets, investors are again learning that diverse holdings often behave similarly. This is especially true in periods of uncertainty like the one we are enduring now.But there are other reasons that the stock market is getting dinged by bond woes. One involves private equity firms, which provided perhaps the biggest push to stock prices when they paid significant premiums to acquire public companies. If these firms cannot borrow money in the bond market to finance their buyouts, or if they must pay more for those borrowings, their business models do not work as well. And that means the private equity bid for stocks fades away.Even more surprising, to young hedge fund managers at least, is the way the credit crisis has begun to hammer seemingly conservative equity investment funds. This is another explanation for the stock market’s upheaval last week.Using what are known as market-neutral strategies designed by computer models, hedge fund traders have been blindsided by a correlation between bonds and stocks that they never expected would occur.Portfolios of this stripe are often known as quantitative funds; some of their most common trades are called statistical arbitrage. These bets are suggested by brilliant mathematicians and academics, using computer models to scour the markets for interesting trading patterns that continue for long periods.For example, a computer might trace the relationship and trading characteristics of two similar assets, like shares of General Motors and Ford. The fund manager then makes trades, going both long and short, based on the way these shares generally trade. If Ford typically trades cheaper than General Motors, the manager would short Ford and buy G.M., capturing what might be small profits, but on a large volume.Another type of trade might involve stocks’ performance immediately after an analyst downgrade or upgrade. Trades are placed on thousands of stocks to try to capitalize on the “typical” behavior that the computer coughs up.Seeing that such bets typically generated profits over long periods left traders believing that their stakes were conservative.The only trouble is, financial markets do not always trade in a way that is typical or predictable. And when they deviate from the norm, all the wonderful and smart trades stop behaving according to plan.ANALYSTS call it model misbehavior.In a research report from Lehman Brothers last week, Matthew S. Rothman described the phenomenon. Fund managers experiencing losses in their fixed-income portfolios who were unable to sell their positions then tried to unwind the trades they could sell — that is, stocks. They cashed in the shares they had purchased and bought back the ones they had sold short.The result was that stocks that had historically been weaker became stronger, and vice versa.“It is not simply that model returns are flat (or not working),” Mr. Rothman wrote, “but specifically that the models (ours included) are behaving in the opposite way we would predict and have seen and tested for over very long time periods (45-plus years).”As a result, “risk models are miscalibrated for the current market environment,” he wrote.Compounding the problem, of course, is the borrowed money these funds use to enhance their performance. When things start to unravel, leverage aggravates an already painful fall.Mr. Rothman also pointed out that so many fund managers had the same trades on their books that when they went to cash out of them, the ill effects were exaggerated.The losses that investors are suffering this month, he wrote, are comparable only to those in the 1960s and during the bursting of the Internet bubble. “This appears to be an event with little precedent,” he wrote.None of this would be a problem, of course, if fund managers were not relying so heavily on just that — precedent — to make their decisions. Computer models seem so perfect, so scientific, so flawless, and they are advertised to investors in precisely that fashion. Ingenious models lull investors into a dangerous complacency about the risks they are taking. It is almost as if the models eliminate risk entirely from the markets.But risk is never gone, as investors are recognizing with a jolt. And that is so even if Wall Street assigns conservative-sounding labels to portfolio strategies that are, in fact, aggressive.“They have their standard deviations, correlations, ‘stable value’ and ‘real return’ funds and nothing for what the normal human being would call risk at all,” said Frederick E. Rowe Jr., a money manager at Greenbrier Partners in Dallas. “They’ve taken the word ‘risk’ and hijacked it. The concept of risk — the permanent loss of capital — vanished in the minds of the people who speak the new language.”Risk, and all that it should connote to investors, is back in the language now. Unfortunately, it has brought an awful lot of losses with it."
28,"THE job of an economist, among many other duties, is to put things into perspective. So, because I am an economist, among other duties, here is a little perspective on the recent turmoil in the stock and bond markets.First, when the story of this turbulence is reported, the usual explanation mainly has to do with some new loss in the subprime mortgage world — the universe of mortgages and mortgage-backed instruments related to buyers with poor credit histories or none at all.Here is the first instance in which proportion tells us that something is out of whack:The total mortgage market in the United States is roughly $10.4 trillion. Of that, a little over 13 percent, or about $1.35 trillion, is subprime — certainly a large sum. Of this, nearly 14 percent is delinquent, meaning late in payment or in foreclosure. Of this amount, about 5 percent is actually in foreclosure, or about $67 billion. Of this amount, according to my friends in real estate, at least about half will be recovered in foreclosure. So now we are down to losses of about $33 billion to $34 billion.The rate of loss in subprime mortgages keeps climbing. In time, perhaps it will double, maybe back to $67 billion. This is a large sum by absolute standards, and I would sure like to have it in my bank account.But by the metrics of a large economy, it is nothing. The total wealth of the United States is about $70 trillion. The value of the stocks listed in the United States is very roughly $15 trillion to $20 trillion. The bond market is even larger.Much more to the point, the fears and terrors about subprime mortgages have helped knock off 6.7 percent of the stock market’s value in recent weeks. This amounts to about $1.1 trillion, or more than 30 times the losses so far in the subprime market. In other words, these subprime losses are wildly out of all proportion to the likely damage to the economy from the subprime problems.The disconnect goes even further. The Dow Jones industrial average has been heavily moved by fears about the subprime market. But how are most of the Dow 30 affected by subprime mortgages in any meaningful way? No Dow company is short of liquidity, and consumer spending is still strong.Foreign stocks, especially in developing countries, have been hard hit, and this is supposedly connected with a “repricing of risk,” which in turn is connected with subprime mortgages. But how are the risks in Thailand or Brazil or Indonesia intrinsically related to problems in a housing tract in Las Vegas? The developing countries are fantastically strong and liquid. Why should problems at a mortgage company in Long Island have anything to do with them?European stocks have also been hard hit, and this has to do with relatively small amounts of subprime in some European banks. On a global scale, the numbers in Germany and France are minuscule for subprime exposure. For European markets to fall on subprime issues makes no sense.News last Thursday that a small amount of unpriceable subprime mortgages was in a BNP Paribas fund in France sent the markets in Europe and the United States sharply lower. Why? The losses in France are at most in the single billions, while the losses in United States markets alone were in the hundreds of billions on the BNP news.Then there is the supposed “drying up” of credit for private equity deals because of fears of risk. But this is also puzzling. I can’t think of a single recent major private equity deal in which the bonds have defaulted.More to the point, suppose that all private equity deals were stalled for a year. Why should this affect the Dow? None of companies in the Dow 30 is having trouble raising cash. And suppose that all private equity deals went away for good. Taken together, they are not all that big a piece of the United States economy. Why should they put the markets of the richest nation in the world, as well as all of the world’s other markets, into turmoil?Then let’s take a peek at Bear Stearns. This venerable and clever financial house has taken some major hits on subprime mortgages lately. That is sad for the stockholders (I am a very small stockholder), and the price of Bear Stearns stock has tumbled.A little over a week ago, news about Bear Stearns’ liquidity issues lowered the its market value by about more than $1 billion in one day. That is a big hit to a single company, to be sure, but then came the shocker: that news also helped wipe out hundreds of billions off the total value of United States stocks.MY point is this: I don’t know where the bottom is on subprime. I don’t know how bad the problems are at Bear. Yet I do know that the market reactions are wildly out of proportion to the real problems that have been revealed. Maybe there is some giant thing hiding in the closet that might rationalize the market’s fears. But if it’s hidden, how can the market be reacting to it in the first place?More will be revealed, as the saying goes. But recently, investors have been selling out of all relation to what we know. Reassurances in word and deed from Ben Bernanke, chairman of the Federal Reserve, helped calm the markets on Friday. But recent events are a disturbing commentary on the power of fear.This economy is extremely strong. Profits are superb. The world economy is exploding with growth. To be sure, terrible problems lurk in the future: a slow-motion dollar crisis, huge Medicare deficits and energy shortages. But for now, the sell-off seems extreme, not to say nutty.Some smart, brave people will make a fortune buying in these days, and then we’ll all wonder what the scare was about."
29,"The job of an economist, among many other duties, is to put things into perspective. So, because I am an economist, among other duties, here is a little perspective on the recent turmoil in the stock and bond markets.First, when the story of this turbulence is reported, the usual explanation mainly has to do with some new loss in the subprime mortgage world - the universe of mortgages and mortgage-backed instruments related to buyers with poor credit histories or none at all.Here is the first instance in which proportion tells us that something is out of whack:The total mortgage market in the United States is roughly $10.4 trillion. Of that, a little over 13 percent, or about $1.35 trillion, is subprime - certainly a large sum. Of this, nearly 14 percent is delinquent, meaning late in payment or in foreclosure. Of this amount, about 5 percent is actually in foreclosure, or about $67 billion. Of this amount, according to my friends in real estate, at least about half will be recovered in foreclosure. So now we are down to losses of about $33 billion to $34 billion.The rate of loss in subprime mortgages keeps climbing. In time, perhaps it will double, maybe back to $67 billion. This is a large sum by absolute standards, and I would sure like to have it in my bank account.But by the metrics of a large economy, it is nothing. The total wealth of the United States is about $70 trillion. The value of the stocks listed in the United States is very roughly $15 trillion to $20 trillion. The bond market is even larger.Much more to the point, the fears and terrors about subprime mortgages have helped knock off about 6 percent of the stock market's value in recent weeks. This amounts to about $1.2 trillion, or about 100 times the losses so far in the subprime market. In other words, these subprime losses are out of all proportion to the likely damage to the economy from the subprime problems.The disconnect goes even further. The Dow Jones industrial average has been heavily moved by fears about the subprime market. But how are most of the Dow 30 affected by subprime mortgages in any meaningful way? No Dow company is short of liquidity, and consumer spending is still strong.Foreign stocks, especially in developing countries, have been hard hit, and this is supposedly connected with a ""repricing of risk,"" which in turn is connected with subprime mortgages. But how are the risks in Thailand or Brazil or Indonesia closely related to problems in a housing tract in Las Vegas? The developing countries are fantastically strong and liquid. Why would problems at a mortgage company in Long Island have anything to do with them?European stocks have also been hard hit, and this has to do with small amounts of subprime in some European banks. But the numbers in Germany and France are minuscule for subprime exposure. For European markets to fall on subprime issues makes no sense.News last Thursday that a small amount of unpriceable subprime mortgages were in a BNP Paribas fund in France sent the markets in Europe and the United States lower by hundreds of billions of dollars. Why? The losses in France are at most in the billions, not the hundreds of billions.Then there is the supposed ""drying up"" of credit for private equity deals because of fears of risk. But this is also puzzling. I can't think of a single recent major private equity deal in which the bonds have defaulted.More to the point, suppose that all private equity deals were stalled for a year. Why would this affect the Dow? None of companies in the Dow 30 are having trouble raising cash. And suppose that all private equity deals went away for good. Taken together, they are not all that big a piece of the U.S. economy. Why should they put the markets of the richest nation in the world, as well as all of the world's other markets, into turmoil?Then let's take a peek at Bear Stearns. This venerable and clever financial house has taken some major hits on subprime mortgages lately. That is sad for the stockholders (I am a very small stockholder), and the price of Bear Stearns stock has tumbled.A little over a week ago, news about Bear Stearns's liquidity issues lowered the market value of the company by about $1.2 billion. That is a big hit to a single company, to be sure, but then came the shocker: that news also helped wipe hundreds of billions of dollars off the total value of U.S. stocks.My point is this: I don't know where the bottom is on subprime. I don't know how bad the problems are at Bear. Yet I do know that the market reactions are wildly out of proportion to the real problems that have been revealed or even hinted at. Maybe there is some giant thing hiding in the closet that might rationalize the market's fears.But if it's hidden, how can the market be reacting to it in the first place?More will be revealed, as the saying goes. But recently, investors have been selling out of all relation to what we know. Reassurances in word and deed from Ben Bernanke, chairman of the Federal Reserve, helped calm the markets Friday. But recent events are a disturbing commentary on the power of fear.This economy is extremely strong. Profits are superb. The world economy is exploding with growth. To be sure, terrible problems lurk in the future: a slow-motion dollar crisis, huge Medicare deficits and energy shortages. But for now, the sell-off seems extreme, not to say nutty.Some smart, brave people will make a fortune buying in these days, and then we'll all wonder what the scare was about.Ben Stein is a lawyer, writer, actor and economist. E-mail: ebiz@nytimes.com."
30,"Should the U.S. Federal Reserve help bail out billionaire hedge fund managers and millionaire traders - the very people who bought the risky mortgages that led to the current market panic?That, in essence, is the question swirling around Ben Bernanke as he confronts the first crisis of his 18 months as Fed chairman.There are no shortages of opinions, and some are being shouted. Jim Cramer, known for his histrionics on the CNBC financial news channel, angrily called for Bernanke to lower interest rates, something the Fed has resisted doing.A week ago, Cramer charged that the Fed was ""asleep"" and that the chairman ""has no idea how bad it is out there"" in the markets. A video clip of his remarks has been viewed more than a million times on YouTube.Lower interest rates would help operators of hedge funds and other money managers because the housing market, presumably, would strengthen as mortgage rates fell. A revived mortgage market would give hedge fund operators and other holders of the risky securities a chance to sell them, which they are having trouble doing in the current panic.But others see a bigger danger for the economy in acting on the pleas of Cramer and others on Wall Street. Cutting interest rates to help the hedge funds would tend to encourage a resurgence of the very risky mortgage lending that has caused the turmoil.The issue is often referred to as ""moral hazard,"" meaning that the risk-takers who brought on this panic would feel bailed out and would be more likely do it again - just as a young adult whose parents paid off a large credit card bill might feel free to run up a debt again.""The argument is, people did risky things,"" said Jan Hatzius, chief domestic economist at Goldman Sachs. ""They are getting punished now, and if you ease interest rates, you reduce the punishment.""Bernanke sees the issue in a more pragmatic way. The Fed's actions and words suggest that, far from concerning himself with moral hazard, the chairman is attempting to protect and reassure ordinary stockholders and bondholders.Pumping a total of $59 billion on Thursday and Friday into the pool of funds available for lending meant small investors could continue to trade securities, confident that the checks they receive from their brokers would not bounce. This new liquidity allows the banks to provide credit to the marketplace without driving up interest rates.Short-term rates, in fact, had spiked because of the panic, and the Fed's action brought the key rate that it controls back to the 5.25 percent level that the Fed considers about right to keep the economy growing while minimizing the risk of higher inflation and, eventually, a slowing economy.""The first line of defense for dealing with a liquidity problem is to make sure the system has enough reserves, so there can be an adequate amount of lending,"" said Brian Sack, an economist at Macro Economic Advisers.The next line of defense, if the market panic were to persist and threaten a recession, would be to cut interest rates. Cramer and some others on Wall Street want Bernanke to do that now.Bernanke has kept the federal funds rate steady for more than a year, arguing as recently as last week that the economy is reasonably strong and that cutting interest rates might drive up inflation. ""The predominant policy concern remains the risk that inflation will fail to moderate as expected,"" the Fed said in a statement after its last policy meeting, on Tuesday.Still, if the panic persists and the economy begins to suffer, Bernanke would presumably be forced to rely on the only other tool the Fed has - a rate cut. His training, and the books and scholarly papers he has written, suggest he would be reluctant to do that.His background suggests a different way of thinking, one in which market panics should be dealt with not by cutting interest rates but by focusing on short-term liquidity.For all the turmoil in the markets this week, the people most immediately affected are the hedge funds, banks and mortgage companies that most aggressively traded, invested in and sold subprime mortgages. The people involved are mostly the nation's wealthiest. Hedge funds, for example, require investors to have a net worth of at least $5 million.""It is a limited crisis as of now,"" said Albert Wojnilower, a Wall Street economist. ""And if I had to bet my life, I would bet that it would remain that way. But I would not want to bet my life."""
