,0
37,"BEIJING —China announced Tuesday that it would raise interest rates for a fourth time this year in an effort to contain its racing economy and rein in soaring consumer prices.The People's Bank of China, the central bank, said on its Web site that the benchmark one-year lending rate would rise 18 basis points to 7.02 percent as of Wednesday, and the rate for deposits would rise 27 basis points to 3.6 percent.Analysts said that the rate increase was also aimed at cooling the Chinese stock market which has so far escaped the turmoil that the U.S. subprime mortgage crisis has unleashed on global financial markets.In the aftermath of the U.S. Federal Reserve's move Friday to cut its discount rate to steady financial markets, China's decision demonstrates how the world's fastest growing major economy sometimes appears to be insulated from global economic forces.""China is now counteracting the U.S. cycle,"" said Connie Leung, chief economist at ERA Economic Research Analysis, a research and advisory business in Hong Kong. ""China is one of the few markets in the world to be raising rates rather than holding or cutting rates.""The ruling Communist Party fears that rising prices fueled by an overheated economy could hurt millions of poor Chinese, particularly in rural areas where economic hardship or dissatisfaction with the government can often lead to protests and unrest.But the authorities must avoid too sharp a slowdown because rapid economic growth is needed to provide jobs for millions of surplus rural workers.Leung and other analysts expect China to raise rates further before the end of the year, perhaps more than once, as part of a sustained campaign to bring growth under control.In addition to raising rates, the central bank, six times this year, has ordered lenders to increase the amount of funds they must hold in reserve in an effort to tighten the supply of credit.Many economists had expected China to raise rates further after official statistics showed that inflation jumped to 5.6 percent in July, the biggest monthly increase since 1997, mainly due to steep increases in the cost of food including pork and other household goods.The official target for inflation for 2007 is 3 percent. The Chinese economy expanded at 11.9 percent in the second quarter compared to the same period last year, the fastest growth in more than 12 years as exports and investment continue to boom.In July, China's trade surplus jumped 67 percent from a year earlier to $24 billion. Fixed asset investment in urban China increased 26.6 percent during the first seven months of the year.But, China's top economic planning agency and price monitor, the National Development and Reform Commission, said the country was not in danger of entering a period of ""full-scale"" inflation, the official China Daily newspaper reported Tuesday.The paper reported that the NDRC had analyzed rising prices and found that they were limited to a narrow ranger of consumer goods.With limited options for investment outside bank deposits, millions of Chinese savers have turned to the stock market in recent years, driving a surge in share prices that has seen the benchmark Shanghai Composite Index rise 80 percent this year following a 130 percent increase last year.The flow of savings to the stock market has accelerated as inflation outpaced interest paid on deposits."
38,"FRANKFURT —European investors sought refuge in government bonds Tuesday, following similar runs in Asia and the United States. But the tone in Europe remained notably different from the deep-seated jumpiness elsewhere, as investors looked past downbeat bits of news to focus on the bigger picture of a growing European economy.Though Europe will eventually have to fear the effects of any slowdown in the United States over the coming year, the group of nations will be largely spared the wrenching effects of unwinding the excesses in mortgage lending that have been wracking Wall Street.Despite the exposure of some European financial institutions to those ""subprime"" investments, Europe will not experience the same kind of meltdown because the lending industry that focuses on borrowers with spotty credit records barely exists in Europe, analysts said. And with the prospect of a softer landing here, investors are better able to size up an economic picture that still looks reasonably sunny.""Now what is dawning on people is that the root cause is in the United States,"" said Kenneth Wattret, chief euro-zone economist at BNP Paribas in London. ""The ball has been tossed back over there.""After a Monday session in which the three-month U.S. Treasury bill registered its biggest one-day slide in yield since the 1987 stock market crash, U.S. and European government bonds both rose Tuesday. Yet despite some of that money flowing out of stocks, most benchmark indexes across Europe were up slightly Tuesday at the close.Investors largely shrugged off a collection of new alarm bells - ranging from fresh central bank intervention to negative survey data to worrying comments by a top German banker - which only a week ago might have led to sharp sell-offs.""These are early signs,"" said Jean-Michel Six, chief Europe economist with Standard & Poor's. ""We are starting to see a bit of a decoupling from the atmosphere in the United States.""Yields on three-month U.S. Treasury bills rose Tuesday, but not as much as they fell Monday.The Bank of England, which has so far refrained from intervening in credit markets, announced that it had lent £314 million, or $628 million, to an unspecified bank at its emergency interest rate for the first time since the market turmoil began two weeks ago. The announcement sparked a guessing game as to which bank tapped the cash, though the amount pales in comparison to the multibillion-euro and -dollar injections other central banks have made into money markets.In Germany, the ZEW survey of investor confidence fell in August to its lowest level since last December, largely due to subprime worries.Illustrating the problem, the head of the state-owned German bank WestLB said that investors who normally buy short-term debt from German institutions were shying away from them.""We sense in the markets that the readiness of foreign banks to extend credit lines to German banks has become difficult,"" Alexander Stuhlmann, chief executive of WestLB, said in Berlin, according to news reports.Two weeks ago, German regulators engineered a rescue of IKB Deutsche Industriebank, a small lender in Düsseldorf, and another German bank, SachsenLB, had similar problems revealed on Friday.A WestLB spokesman, Hans Obermeier, said Stuhlmann was emphasizing that a government-sponsored bailout creates ""perception problems"" for German banks, not that there is a general liquidity crisis.The flight of money into U.S. and European government issues was accompanied by signs of increased aversion to bonds sold by other countries that are considered riskier investments.The Philippines and Indonesia, both emerging market economies, scaled back sales at auctions Tuesday because investors demanded returns so high they were deemed too costly.By contrast, demand for bonds from less risky countries grew. New Zealand announced that it would increase the amount of bonds it would offer in an auction this week. And Greece - a member of the euro zone - managed to sell €1.44 billion, or $1.95 billion, in 15-year bonds, more than originally planned.To be sure, the potential for a bombshell to send European markets reeling is all too present.U.S. mortgage lenders packaged subprime mortgages into securities that were sold globally to investors hungry for a higher returns - and willing to take the risks. The notion that a major European fund or bank might yet be driven into insolvency is still thinkable.""That is what is keeping investors and market regulators concerned,"" said Six, of Standard & Poor's. ""But we do not have any endogenous factors that are driving this in Europe.""Policy makers embarked Tuesday on another round of efforts to persuade markets that the subprime crisis would be limited in scope.""We have no reason to believe that the consequences of the crisis that has been caused by the U.S. mortgage sector will spill over to Germany and Europe,"" the German finance minister, Peer Steinbrück, said in Berlin, news agencies reported. ""As far as we can see, there is no spillover effect into the real economy.""That sanguine outlook will not last forever, analysts said, because the U.S. housing crisis is likely to crimp spending by American consumers, whose appetite for buying has fed the world economy for years.Countrywide Financial, the biggest independent U.S. mortgage lender, has said it will lay off employees, possibly signaling the beginning of a softening in the labor market, which has so far held up despite a slowdown in the United States.""These are material things, material impacts,"" said Orlando Green, a bond strategist at Calyon in London.So far, Europe has managed to cope with a weaker economy in the United States, but its toughest test lies ahead, economists have said.Germany, for example, has benefited from brisk sales to China, whose export machine has fed the U.S. market. A slowdown in the United States will slowly ripple through Asia to Europe, undercutting the notion that Europe can entirely avoid problems made across the Atlantic.""We have to be a little skeptical of this idea,"" said Jacques Cailloux, chief Europe economist at Royal Bank of Scotland. ""There are still very strong linkages."""
39,"WASHINGTON —Christopher Dodd, the chairman of the U.S. Senate Banking Committee, said Tuesday that he had received assurances that the Federal Reserve was moving to deal with the turmoil spreading from the mortgage market. But he said the response from the Treasury was less encouraging.""I think the Fed gets it,"" Dodd said after a meeting Tuesday morning with the Fed chairman, Ben Bernanke, and the Treasury secretary, Henry Paulson Jr., to discuss steps to stabilize the markets and stave off home foreclosures.But he added, ""I'm still concerned that Treasury doesn't understand the importance of the issue.""Dodd, a Connecticut Democrat who is seeking his party's presidential nomination, said he had asked Bernanke if the Fed was prepared to use ""all the tools at its disposal"" and said the Fed chairman's response was, ""Absolutely.""Dodd spoke in a Capitol hearing room after the meeting. Bernanke and Paulson did not appear with him.His remarks appeared to lift the stock market, which had opened lower after Paulson said during an interview that he thought it would take time to work out the problems in the credit markets.Dodd was careful to make clear that he was not pressing the Fed specifically to lower the federal funds rate on overnight loans between banks. That benchmark rate has the most direct effect on consumers, and the Fed is widely expected to lower it if its measures so far do not tamp down the upheaval in the credit market.He also said he had raised the possibility of loosening the limits on the holdings of Fannie Mae and Freddie Mac, the giant government-sponsored lenders that bundle mortgages into tradable securities, a move that many Democrats are pressing for and that the White House has resisted.Dodd said, however, that the Fed and the Treasury ""do not appear to be going in that direction.""Among Democrats, Dodd is considered among the more cautious in his approach to the growing mortgage crisis. He has asserted that changes in the limits on Fannie Mae and Freddie Mac and new consumer protection rules can be dealt with through the Fed and bank regulatory agencies, rather than through legislation. ""The ball is really in their court,"" he said, referring to the role of regulators in helping to limit the number of foreclosures.As for providing relief directly to distressed homeowners, as Democrats including Senator Hillary Rodham Clinton of New York have advocated, Dodd said, ""I'm reluctant to go that way.""Dodd said he thought Paulson's comments Tuesday morning during an interview with the cable financial network CNBC had been positive, though he was critical of the Treasury secretary for saying that it would take considerable time to work out the mortgage problems even while affirming that the economy was sound.In his remarks on CNBC, Paulson said, ""We're thinking through options to reduce the strain in the mortgage markets,"" adding that officials were ""clearly focused - and the president wants us to be focused - on actions that can be taken, things that we can do to help mortgage holders who are in danger of losing their homes.""But referring to Fannie Mae and Freddie Mac, he said, ""Raising the cap doesn't do much of anything,"" because the problems are concentrated ""in the nonconforming jumbo market and in the subprime market,"" not in the markets where those two agencies are active. And he said that loosening the limits on the agencies would require legislative action.He also expressed confidence that with the Fed's recent actions, including its reduction Friday of the rate on its loans to banks, ""I think that as the process unfolds and you see investors gain more confidence, that they understand the risks and the returns here, you're going to see liquidity return to normal in these markets.""The Central Bank of Russia intervened Tuesday to support a weakening ruble and pumped fresh liquidity into the banking system as foreign investors cut their exposure to risky assets in a global credit crunch, Reuters reported from Moscow.Typically, the Central Bank of Russia is seen bidding for dollars as it offsets upward pressure on the ruble stemming from the half a billion petrodollars a day earned by Russia, the world's No. 2 oil exporter after Saudi Arabia.But this time the central bank stepped in as a dollar seller when the ruble eased by over half a percent against the dollar/euro basket of currencies it uses as a target.Analysts said the investor pullback might actually help Russian policy makers in their fight against inflation. The economy minister, German Gref, predicted that consumer price growth would be held within the 8 percent official target this year.The ruble's fall wiped out last week's gains and pared back its advance against the currency basket, composed of 55 U.S. cents and 45 euro cents, to 0.6 percent so far this year."
40,"LONDON —Finance chiefs of the world's two biggest economies pledged Tuesday to keep a close watch on jittery markets, while banks at the sharp end of a global financial storm said they faced serious trouble.The Japanese finance minister, Koji Omi, said there were no plans for an emergency meeting of the Group of Seven industrialized nations because of sharp gyrations in global markets.But Omi said at a press conference that he had spoken by telephone with the U.S. Treasury secretary, Henry Paulson Jr., and that they had agreed to keep a close eye on markets and stay in close contact.""I could tell he has been making various efforts,"" Omi said of Paulson, though he did not give specific details. ""We agreed that we will watch markets developments carefully for a while.""The German finance minister, Peer Steinbrück, insisted that the wider economy was sustaining little damage, an assertion consistently put forward by policy makers so far.""I have no reason to doubt that we can effectively manage the effects of the U.S. mortgage crisis in Europe,"" Steinbrück said, adding that expert opinion suggested that the home loan crisis would not feed through to the real economy.But investors remained ultracautious, fearing there may be more problems that have yet to come to light, stemming from a meltdown in the U.S. subprime sector, which could slow the world economy.""There is still sense of caution in the air,"" said Irvin Seah, an economist at DBS Bank in Singapore. ""If there is more bad news, what we saw last week is probably going to repeat itself. Most people think it will take another two months before things calm down.""U.S. policy makers will hold center stage Tuesday - Paulson, the Federal Reserve chairman, Ben Bernanke, and the Senate Banking Committee chairman, Christopher Dodd, are due to meet to discuss conditions in financial markets.Speculation is feverish that the Federal Reserve may cut the federal funds rate, its key policy rate, from 5.25 percent at its Sept. 18 meeting.On Friday, it cut the discount rate that governs Fed loans to banks by half a percentage point to 5.75 percent, a move that helped bloodied stock markets gain back lost ground.Other central banks remained watchful as doubts about the health of financial markets lingered. Australia's central bank again pumped sizeable amounts of cash into its banking system to help meet short-term mismatches in liquidity.In its regular daily money market operation, the Reserve Bank of Australia added 3.45 billion Australian dollars, or $2.78 billion, in cash. The injection compared with a daily average of about 2.55 billion dollars last week. Before the recent turmoil in markets led to a drying up of credit, the average daily cash injection was around 1.8 billion dollars.The New Zealand Debt Management Office said it would offer an extra 100 million New Zealand dollars, or $70 million, in short-term bonds this week to satisfy a surge in demand amid liquidity concerns.In Berlin, the chief executive of Germany's WestLB bank, Alexander Stuhlmann, said that turmoil in the U.S. subprime mortgage market was making it difficult for German banks to get credit lines from their foreign partners.Stuhlmann told reporters that German banks were in a ""not uncritical situation"" overall.WestLB has said it has over €1.2 billion, or $1.6 billion, in overall exposure to the U.S. subprime sector."
41,"FRANKFURT —European investors sought refuge in government bonds Tuesday, following similar runs in Asia and the United States. But the tone in Europe remained notably different from the deep-seated jumpiness elsewhere, as investors looked past downbeat bits of news to focus on the bigger picture of a growing European economy.Though Europe will eventually have to fear the effects of any economic slowdown in the United States over the coming year, the group of nations will be largely spared the wrenching effects of unwinding the excesses in mortgage lending that have been wracking Wall Street.Despite the exposure of some European financial institutions to those ""subprime"" investments, Europe will not experience the same kind of meltdown because the lending industry that focuses on borrowers with spotty credit records barely exists in Europe, analysts said. And with the prospect of a softer landing here, investors are better able to size up an economic picture that still looks reasonably sunny.""Now what is dawning on people is that the root cause is in the United States,"" said Kenneth Wattret, chief euro-zone economist at BNP Paribas in London. ""The ball has been tossed back over there.""After a Monday during which the benchmark U.S. Treasury bond registered its biggest one-day slide since the 1987 stock market crash, U.S. and European government bonds both gained. Yet despite some of that money flowing out of stocks, most benchmark indexes across Europe were up slightly Tuesday at the close.Investors largely shrugged off a collection of new alarm bells - ranging from fresh central bank intervention to negative survey data to worrying comments by a top German banker - which only a week ago might have led to sharp sell-offs.""These are early signs,"" said Jean-Michel Six, chief Europe economist with Standard & Poor's. ""We are starting to see a bit of a decoupling from the atmosphere in the United States.""Prices for short-term U.S. government debt eased slightly in late afternoon trading Tuesday in New York.The Bank of England, which has so far refrained from intervening in credit markets, announced that it had lent £314 million, or $628 million, to an unspecified bank at its emergency interest rate for the first time since the market turmoil began two weeks ago. The announcement sparked a guessing game as to which bank tapped the cash, though the amount pales in comparison to the multibillion euro and dollar injections other central banks have made into money markets.In Germany, the ZEW survey of investor confidence fell in August to its lowest level since last December, largely due to subprime worries.Illustrating the problem, the head of the state-owned German bank WestLB said that investors who normally buy short-term debt from German institutions are shying away from them.""We sense in the markets that the readiness of foreign banks to extend credit lines to German banks has become difficult,"" Alexander Stuhlmann, chief executive of WestLB, said in Berlin, according to news reports.Two weeks ago, German regulators engineered a rescue of IKB Deutsche Industriebank, a small lender in Düsseldorf, and another German bank, SachsenLB, had similar problems revealed on Friday.A WestLB spokesman, Hans Obermeier, said Stuhlmann was emphasizing that a government-sponsored bailout creates ""perception problems"" for German banks, not that there is a general liquidity crisis.The flight of money into U.S. and European government issues was accompanied by signs of increased aversion to bonds sold by other countries that are considered riskier investments.The Philippines and Indonesia, both emerging market economies, scaled back sales at auctions Tuesday because investors demanded returns so high they were deemed too costly.By contrast, demand for bonds from less risky countries grew. New Zealand announced that it would increase the amount of bonds it would offer in an auction this week. And Greece - a member of the euro zone - managed to sell €1.44 billion, or $1.95 billion, in 15-year bonds, more than originally planned.To be sure, the potential for a bombshell to send European markets reeling is all too present.U.S. mortgage lenders packaged subprime mortgages into securities that were sold globally to investors hungry for a higher returns - and willing to take the risks. The notion that a major European fund or bank might yet be driven into insolvency is still thinkable.""That is what is keeping investors and market regulators concerned,"" said Six, of Standard & Poor's. ""But we do not have any endogenous factors that are driving this in Europe.""Policy makers embarked Tuesday on another round of efforts to persuade markets that the subprime crisis would be limited in scope.""We have no reason to believe that the consequences of the crisis that has been caused by the U.S. mortgage sector will spill over to Germany and Europe,"" the German finance minister, Peer Steinbrück, said in Berlin, news agencies reported. ""As far as we can see, there is no spillover effect into the real economy.""That sanguine outlook will not last forever, analysts said, because the U.S. housing crisis is likely to crimp spending by American consumers, whose appetite for buying has fed the world economy for years.Countrywide, the biggest American mortgage lender, has said it will lay off employees, possibly signaling the beginning of a softening in the labor market, which has so far held up despite a slowdown in the United States.""These are material things, material impacts,"" said Orlando Green, a bond strategist at Calyon in London.So far, Europe has managed to cope with a weaker economy in the United States, but its toughest test lies ahead, economists have said.Germany, for example, has benefited from brisk sales to China, whose export machine has fed the U.S. market. A slowdown in the United States will slowly ripple through Asia to Europe, undercutting the notion that Europe can entirely avoid problems made across the Atlantic.""We have to be a little skeptical of this idea,"" said Jacques Cailloux, chief Europe economist at Royal Bank of Scotland. ""There are still very strong linkages."""
42,
