,0
0,"SINGAPORE —Stocks in Asia and Europe resumed their slide Wednesday after the largest bank in Japan disclosed losses on investments linked to U.S. subprime mortgages, exacerbating investors' fears that U.S. credit problems are spreading across the globe.Mitsubishi UFJ Financial Group said it lost about $43 million as of last month on investments connected to risky U.S. home loans. That news prompted the Nikkei 225 stock average in Japan to fall by almost 2.2 percent to its lowest point in nine months, extending the latest tumble on Wall Street that began on Tuesday.Stocks in Hong Kong, Australia and Taiwan fell by 3 percent or more. But the continuing rout of equity markets on concerns about tightening global credit turned the brunt of its impact Wednesday on Indonesia, where stocks fell almost 6 percent. (Page 12)The hunt was on for icebergs in Asian financial markets. Analysts and economists were assuring investors that Asia's exposure to the worsening mortgage loan market in the United States was too low to worry about.They say Asia's cash horde could withstand the exodus of investors whose exposure is worrisome, and that Asia's economic momentum can survive lower spending by American consumers.But investors were still anxious that somehow, somewhere, the credit cave-in taking place in Europe and the United States will eventually claim a big victim in Asia.""You never know: All of a sudden something could come out of the blue,"" said Hans Goetti, an investment strategist at Citi Global Wealth Management in Singapore.Perhaps the biggest trigger setting off the Wednesday slide in stock prices was news that the giant U.S. retail chains Wal-Mart Stores and Home Depot had reported disappointing earnings for the second quarter and predicted an even bumpier year ahead because of higher energy costs and a sagging housing market.That news sent the Dow Jones industrial average down almost 2 percent Tuesday, and it resonated throughout Asia, stoking investor concerns that the U.S. housing slump could hurt demand for Asian exports.Economists disagree over the extent to which Asia is still dependent on U.S. export demand, though most concur that a significant decline in U.S. retail spending would hurt Asia.Stocks in China continue to rise nonetheless, despite an unfolding scandal over tainted food products and the recall by Mattel and other toy makers of products made in China.But in Hong Kong, shares of exporters like Li & Fung dropped along with the Hang Seng China enterprises index, which tracks 41 mainland companies.In Japan, shares in Mitsubishi UFJ Financial Group and Sumitomo Mitsui Financial fell to their lowest level in two years after the two banks reported losing several billion yen due to the declines in the U.S. subprime market.Mitsubishi UFJ said it had unrealized losses of about ¥5 billion, or $42.6 million. Sumitomo Mitsui said it had sold about ¥350 billion in U.S. mortgage-backed securities, suffering losses of several billions of yen as a result.Declines in Tokyo were exacerbated by the fact that many domestic investors, who have been steadily buying Japanese shares recently, were away for Japan's traditional mid-August Buddhist holidays, according to Ed Merner, who manages the Atlantis Japan Growth Fund in Tokyo.""A lot of people are panicking,"" said Merner.What concerns many investors in Asia now is not the direct exposure institutions may have to the U.S. subprime market, but rather their overall exposure to credit derivatives like collateralized debt obligations that have become less valuable as subprime concerns send interest rates higher.""It's simply not known to what extent Asian institutions are exposed to CDOs,"" said Goetti, at Citi.As a percentage of their overall assets, the losses reported by banks in Asia so far have been tiny. Analysts say the fallout is widening, however, as the implosion of credit emanating from the United States reverberates through credit markets worldwide.Even for banks and other institutions with little or no subprime exposure, the U.S. subprime mess is forcing up short-term interest rates. This is particularly harmful to lenders borrowing short-term to make long-term loans, which is what happened to the Australian mortgage lender Rams Home Loans Group, according to Ben Zucker, an analyst at Macquarie Bank in Sydney.Rams said Tuesday that the situation in U.S. markets was forcing it to pay more to cover its financing, potentially hurting earnings. Rams does not invest in U.S. mortgage loans or lend money to American homeowners, but it had been taking out loans of less than a year in order to lend out mortgages that can run for as long as 25 years, Zucker said.Most banks do not have to worry about rising short-term borrowing costs, Zucker said. They have alternative source of capital, such as deposits, and can easily pass along higher funding costs to borrowers.But rising short-term borrowing costs could hit companies with heavy borrowings, he said. ""This is the next stage contagion that's coming out - the repricing of risk occurring in the corporate debt market,"" said Zucker.The good news in Asia is that most corporations have significantly less debt than their counterparts elsewhere in the world, a legacy of the Asian financial crisis a decade ago.""Companies had a phobia for debt after the Asian crisis,"" said Paul Schulte, Asian regional strategist at Lehman Brothers in Hong Kong.As a result, he said, Asian corporations have $350 billion of cash on their balance sheets. Over all, Asia has roughly $2.3 trillion in foreign-exchange reserves, an increasing amount of which is being invested within the region as central banks try to diversify away from U.S. Treasury securities and the declining U.S. dollar.With inflation now rising faster than real interest rates, Asia's central bankers and corporate treasurers managers are under pressure to put that cash to work.As the U.S. crisis unfolds, Schulte said, that could give rise to an interesting situation: ""Asia can now go on the hunt for busted-up assets in the States,"" he said, just as American investors sought to buy up distressed Asia assets in the wake of its financial crisis.""Boy, how the tables have turned,"" he said."
1,"NEW YORK —Turmoil in the subprime mortgage market has spread again - this time to a type of short-term security held by money-market mutual funds. These funds have become the investment of choice for many people seeking a safe haven.Standard & Poor's, the ratings agency, warned Tuesday that it might downgrade several issuers of commercial paper, a short-term i.o.u. issued by companies that promise to repay the loans, typically within a few weeks to a year.In these cases, Standard & Poor's said, the commercial paper was backed by residential mortgages.The amount of commercial paper in the United States has grown to $2.2 trillion, according to Lehman Brothers, with about $1.2 trillion backed by residential mortgages, credit card receivables, car loans and other bonds. The major buyers include pension funds, insurance companies, hedge funds and short-term money market funds.Investors have flocked to money market funds to avoid volatile stocks and the seized-up bond market. Last week, more than $36 billion moved into money market funds, the largest shift since December 2005.In all, $2.6 trillion is in money market funds, according to AMG Data Services.Such funds are sold to investors as the equivalent of cash, and their $1-a-share net asset value is viewed as inviolate. But if the funds experienced enough losses, the value of their assets could be vulnerable.Standard & Poor's acted a day after a $1.6 billion cash-management fund run by Sentinel Management Group halted redemptions because it could not sell its assets at what it considered acceptable prices.Until recently, the crisis in the credit markets has been limited to problems related to subprime mortgages, those given to borrowers with questionable credit histories. But as these troubles seep into other parts of the securities markets, fears of losses are rising in unexpected places.Companies that issue asset-backed commercial paper - the borrowers - have found it highly profitable. These companies have typically used the money they borrow to buy securities - slices of mortgage pools, for example - that generated yields much higher than the interest rates they paid to the short-term lenders.But there are risks: First, the companies that issue short-term notes backed by assets with considerably longer terms are exposing themselves to the risk that the interest rates they earn will not exceed the amount they must pay to their lenders. Perhaps more significantly, the borrowers must be concerned about possible losses in the assets they buy, especially when investors will no longer lend them money by purchasing their commercial paper.Standard & Poor's highlighted four commercial paper issuers for possible downgrades. Broadhollow Funding, which was set up by American Home Mortgage Investment, a lender that filed for bankruptcy last week; KKR Atlantic Funding Trust and KKR Pacific Funding Trust, two affiliates of the buyout firm Kohlberg Kravis Roberts; and Ottimo Funding, an affiliate of Aladdin Capital Management, an investment manager in Stamford, ConnecticutKKR declined to comment Tuesday.Ottimo Funding holds about $3 billion in residential mortgages, all rated AAA. George Marshman, chief investment officer at Aladdin , said: ""It's a negotiation process. We're working with all the investors to make things as orderly as possible. I'm optimistic we can get a good outcome.""Among the money market funds that held commercial paper issued by the companies singled out for possible downgrade were two offered by Evergreen Investments. The $16.6 billion Evergreen Institutional Money Market Fund held $385 million in Broadhollow Funding and $72 million in Ottimo Funding, as of last May. The $4.5 billion Evergreen Prime Cash Management Money Market Fund held $50 million in Ottimo Funding as well.A spokeswoman for Evergreen declined to comment.Legg Mason's Master Portfolio Trust Liquid Reserves Portfolio, a $52.5 billion fund, owned almost $200 million in securities issued by Ottimo Funding and $750 million in KKR Atlantic Funding.Mary Athridge, a Legg Mason spokeswoman, said: ""The holdings represent less than 1.4 percent of the portfolio. We believe the current disruption in the marketplace is liquidity-related rather than credit-related, which the Fed has stepped into the market to address.""As of May 31, Columbia Funds Series Trust Cash Reserves, a $62 billion fund, had a $120 million stake in Ottimo Funding and $400 million in KKR Pacific Funding Trust. A Columbia Management spokesman did not return calls requesting comment.""If the stigma of mortgage-related extendable-asset-backed commercial paper spreads to asset-backed commercial paper as a whole, you could see bailout events,"" said Peter Crane, president of Crane Data, the publisher of Money Fund Intelligence, a newsletter about money market mutual funds. But he added: ""The stuff that the money funds are invested in are the highest quality, so it's the last thing to have trouble.""But investment strategies that once were considered conservative no longer are.The Sentinel fund that banned redemptions Monday advertised itself as risk-averse. In a letter to investors, Sentinel said that it had hoped to ride out the troubles but was unable to do so.""We are concerned that we cannot meet any significant redemption requests without selling securities at deep discounts to their fair value and therefore causing unnecessary losses to our clients,"" the letter said. ""We will continue to monitor the markets and we will raise cash as opportunities present themselves.""Sentinel officials did not return calls seeking comment.Douglas Kass, a general partner of Seabreeze Partners Management, an investment firm in Palm Beach, Florida, said the Sentinel disclosure and upheaval in commercial paper markets is an example of the risk investors take when they reach for higher yields. ""This is symptomatic of a whole body of investors, including money market and cash management funds, that are attempting to enhance yields and this is the downside to that journey,"" he said."
2,
3,"Stocks staged a late rally today on Wall Street after a day of wild swings as investors continued to weigh the impact of the crunch in the American credit market.Shortly after noon, the Dow Jones industrial average was off by more than 340 points, or 2.6 percent, following big declines in Asian and European trading. But after reversing field several times, the market recovered its losses in the final hour.At the close, the Dow was off 15.69 points for the day, or 0.1 percent. The Standard & Poor’s 500-stock index was showing a gain, and the Nasdaq composite was down only slightly.“It was a pretty remarkable turn, and I don’t think anybody can really make sense of it,” said Tobias M. Levkovich, chief United States equity strategist for Citigroup. “It’s not about any fundamental development because we didn’t get any news today that would push you any one way or another.”In the course of the day, all three indexes were showing losses of more than 10 percent since their peak last month — the threshold at which the market’s fall is considered to have reached a correction. But by the close, they had escaped that territory.The upheaval came amid a bruising week for stocks, and a day after the market plunged in the final hour of trading, with the Dow closing off 167 points and the S.& P. 500 erasing its own gains for the year.That set the tone for a wild ride in foreign financial markets overnight. The main stock indexes in nearly every developed nation around the world closed lower or were headed toward finishing the day in the red.The sell-off on Wall Street was so steep that at 12:01 p.m., the New York Stock Exchange imposed limits on automated program trading, known as a circuit breaker, a move intended to prevent bigger declines.Even with the late rally, share values of blue-chip companies like Apple, Exxon Mobil, Boeing and I.B.M. still suffered significant losses.Adding to an already tense environment, more problems became apparent in the mortgage market today. Countrywide Financial, the nation’s largest mortgage lender, said it had tapped $11.5 billion in emergency loans from 40 of the world’s largest banks, as it seeks to shore up its cash position.The company, which relies heavily on raising money from Wall Street, acted a day after a prominent analyst suggested it may have to file for bankruptcy if banks and investors shut off the spigot of money to Countrywide. Shares of the company closed down 11 percent, after falling 13 percent yesterday. The stock is down more than 50 percent for the year.In a statement released early this morning, the company also said that 90 percent of the home loans it will now make will be to standards set by Fannie Mae and Freddie Mac, the big purchasers of mortgage loans, because it is not able to sell them to other buyers.The reversal of fortune in the housing market was further illustrated by figures released by the Commerce Department today that showed the rates of construction of new homes and building permits issued fell in July to their lowest levels in more than a decade.A move by the Federal Reserve intended to calm the markets seemed to have little impact at first. The Fed injected $17 billion into the system this morning in two open-market actions by lending against mortgage securities.Whether the turbulence in financial markets will have larger ramifications for the American economy is still unclear. Many economists, including those at the Fed, have said they believe the damage will remain contained. With each day of turmoil in the markets, however, the outlook becomes more and more murky.Henry Paulson, the Treasury secretary, told The Wall Street Journal in an interview published today that market troubles “will extract a penalty” on economic growth, but he said he did not believe a recession was likely.The market tumult seemed to put a dent in oil prices today. On the New York Mercantile Exchange, oil futures contracts declined even as two tropical disturbances grew more powerful in the Atlantic.In Europe today, the FTSE-100 in London closed down more than 4 percent, while the CAC-40 of France dropped 3.3 percent and the DAX in Germany was down more than 2 percent. The Asian slump was led by a nearly 7 percent decline in South Korea as nervousness spreading there from finance professionals to ordinary small investors.“The psychology is shifting notably today,” said David Bowers, a global strategist at Absolute Strategy Research in London. “When a market drops by 10 percent, people start to feel it in their portfolios. People are used to stock markets behaving in a non-volatile and even bullish manner.”In Europe, shares of banking stocks were hard-hit as equity markets retreated. The worst-hit included BNP Paribas, which last week sparked a market rout when it revealed it had frozen three funds in subprime mortgages had been invested. Shares were down 2.9 percent at midday. ABN Amro, the target of a takeover battle that would create the world’s largest bank, fell 1.3 percent at midday.And fears that the credit crunch might make it harder to finance deals hit the Dutch chemicals group Akzo Nobel, whose shares slid 3.1 percent midday on concerns that Henkel, its partner in the takeover of Britain’s ICI would have trouble financing its part of the deal, Reuters reported.Concerns are beginning to mount that the subprime crisis may generate a consumer pullback in the United States, triggering an economic slowdown that may hit America’s export partners.“Although today will likely again be dominated by concerns over credit markets, at some point the concerns will move to consumer confidence, consumption and the global economy,” ABN Amro said in a note to clients.The losses reverberated most sharply in Asia, where investors were also shaken after Rams Home Loans Group of Australia, a nonbank lender which earlier in the week warned that its earnings could be hurt by rising costs for its U.S. borrowings, confirmed Thursday that it had been unable to refinance $5 billion in debt.“It’s a kind of a panic among individual investors,” said Cho Hong Rae, head of research at Korea Investment & Securities in Seoul, adding that domestic retail investors had up until today generally been buying shares as they declined.The South Korean benchmark stock index suffered its biggest decline in more than five years today, falling nearly 7 percent late in the afternoon in Asia after an initial 10 percent plunge that forced the Korea Exchange to suspend trading for 20 minutes.Similar declines occurred in Indonesia and the Philippines, where stocks also fell by roughly 7.7 percent and 6 percent, respectively. Declines in the region’s other big markets were less severe, but still dramatic: Japan’s benchmark Nikkei 225 stock average fell by about 2 percent; and Hong Kong’s benchmark dropped by about 3.5 percent.Chinese stocks were lower too. During recent trading sessions, they have brushed off drops in other parts of the world.Analysts in Australia said Rams’s problems were unlikely to have much effect on the country’s banks, because they do not rely significantly on borrowing from the United States.“In the end the impact on them will not be so severe,” said Ben Zucker, an analyst at Macquarie Bank in Sydney.Nonetheless, companies and financial institutions that had taken advantage of a booming American appetite for debt to borrow United States dollars cheaply and fund costs at home in Australia where the currency has been appreciating are likely to suffer a sudden whiplash effect now as interest rates rise and the United States dollar regains ground, he said.In South Korea, Mr. Cho said that most domestic selling was still by individuals trying to unload individual stocks. So far, he said, local mutual funds were not seeing a market increase in redemptions that would force them to join the selling. And automatic contributions to pension funds were still being made to big institutions, which were taking advantage of the latest declines to buy stocks more cheaply, he said."
