,0
11,"SINGAPORE, SEOUL, DELHI —Stocks tumbled across Asia Thursday amid the widening fallout from theUnited States' subprime mortgage crisis, led by a nearly 7 percent drop inSouth Korea, as nervousness spread from finance professionals to ordinarysmall investors.In a deluge of sell orders, the Korea Exchange in Seoul temporarilysuspended computer-generated program trading, an emergency move compelledby a drop in futures prices.The office of President Roh Moo Hyun urged investors not to overreact tothe global financial market instability.""South Korea's stock market is overly sensitive to the subprime mortgagefinancial crisis,"" Cheon Ho Seon, a spokesman for the president, said at anews conference. ""The fundamentals of the South Korean economy are solidand the impact from the subprime mortgage will be limited.""The South Korean benchmark Kospi stock index suffered its biggest declinein more than five years Thursday, falling 6.9 percent.Bourses also opened lower in Europe, and similar declines occurred inIndonesia and the Philippines, where stocks also fell by 5.9 percent and 6percent, respectively. Declines in the region's other big markets were lesssevere, but still dramatic: Japan's benchmark Nikkei 225 stock average fellby about 2 percent; and Hong Kong's benchmark dropped 3.3 percent.Chinese stocks were lower too. During recent trading sessions, they havebrushed off drops in other parts of the world.In South Korea, panic and frustration among retail investors were clear. Ina small investors' Web forum called the ""Stocks Chart,"" one investor withthe username ""pinkydol"" lamented that all but one of the seven stocks heowned dropped by the daily limit on Thursday.In another forum called ""With Stock,"" an investor who identified herself byher username ""Rain Drop"" said she stormed out of her home after having afight with her husband because he dumped all his stocks at a huge lossThursday fearing an even bigger loss if he didn't act.""It's a kind of a panic among individual investors,"" said Cho Hong Rae,head of research at Korea Investment & Securities in Seoul, adding thatdomestic retail investors had up until Thursday generally been buyingshares as they declined.Nervousness heightened this week in the United States after an analyst atMerrill Lynch who just days ago wrote approvingly of Countrywide Financial,the nation's largest and one of its most respected mortgage lenders, put asell rating on the stock, speculating that the company could be forced toseek bankruptcy protection if it could not raise money from banks andinvestors. That contributed to a sharp fall in U.S. stocks on Wednesdaythat was echoed in Asia on Thursday.The market in Australia was also hit Thursday by more repercussions fromthe U.S. credit crisis. Rams Home Loans Group, a nonbank lender whichearlier in the week warned that its earnings could be hurt by rising costsfor its U.S. borrowings, confirmed Thursday that it had been unable torefinance $5 billion in debt.The company's shares dropped 46 percent to 86.5 Australian cents, wellbelow its price at an initial share offering last month.Analysts in Australia said Rams' problems were unlikely to have much affecton the country's banks, because they do not rely significantly on borrowingfrom the United States.""In the end the impact on them will not be so severe,"" said Ben Zucker, ananalyst at Macquarie Bank in Sydney.Nonetheless, companies and financial institutions that had taken advantageof a booming American appetite for debt to borrow U.S. dollars cheaply andfund costs at home in Australia where the currency has been appreciatingare likely to suffer a sudden whiplash effect now as interest rates riseand the U.S. dollar regains ground, he said.The benchmark Australian S&P/ASX 200 index ended down 1.3 percent.The most recent sell off of Asian markets started with hedge fundsunwinding their positions, but now broadly focused retail investors arestarting to sell, said Henry To, co-founder of MarketThoughts, a hedge fundadvisor in Los Angeles.The subprime implosion in the United States is taking a direct toll onretail investors, spooking them further. Unlike in the United States,retail investors in some Asian markets, particularly Australia, can investin hedge funds, To noted. Basis Capital, one of Australia's largest hedgefunds, said it may have lost 80 percent of its capital because of Americansubprime problems. ""Most of those losses were taken by retail investors,""Mr. To said.""We don't know the full extent of the subprime problem in Asia yet,"" saidTo. ""At this point everyone is still guessing,"" he said.To be sure, it remains unclear exactly to what extent retail investors arepulling out of the market.In India, the benchmark BSE Sensex 30 index was down about 4 percent afterbeeing shut on Wednesday for a holiday.Markets in India have been whipsawed in recent months, and many marketmakers were loathe to call the drop a sign that retail investors weredeserting stocks.""Definitely foreign investors have sold off, but the way they put moneyinto the markets over the past two or three months, that sell off wasexpected,"" said Dinesh Thakkar, the managing director of Angel Broking,headquartered in Mumbai.""I don't see any panic happening in India,"" said Thakkar. Much ofThursday's drop was due to foreign investors who are booking profits, hesaid, and a lot of what they had to sell was absorbed by domestic investorswho had been sitting on the sidelines.There is some evidence that domestic investors helped to prevent steepersell-offs in India over the past week. From July 27 to August 14, foreigninvestors sold 773 billion rupees ($TK) from India's Bombay Stock Exchangeand National Stock Exchange, as domestic investors bought some 454 billionrupees in the same exchanges, according to data from the exchanges.But in South Korea, Cho said that most domestic selling was still byindividuals trying to unload individual stocks. So far, he said, localmutual funds were not seeing a market increase in redemptions that wouldforce them to join the selling.And automatic contributions to pension funds were still being made to biginstitutions, which were taking advantage of the latest declines to buystocks more cheaply, he said."
12,"FRANKFURT —Stocks on Wall Street plunged Thursday for a second straight day, extending a selloff that has gripped markets around the world as credit fears stemming from the American mortgage market crisis deepened. The seemingly unstoppable declines brought calls by European officials for more scrutiny of financial markets and the ratings agencies responsible for assessing the risk of subprime debt.""The psychology is shifting notably today,"" said David Bowers, a global strategist at Absolute Strategy Research in London. ""When a market drops by 10 percent, people start to feel it in their portfolios. People are used to stock markets behaving in a non-volatile and even bullish manner.""The Dow Jones Industrial Average traded down more than 300 points at one point, pulling the blue chip index into a 10 percent drop in stock prices from their highs. Asian markets, burned by Wall Street's sharp losses a day earlier, slumped Thursday as the Korean index slid nearly 7 percent, setting off a regional selloff. Across Europe, major markets fell between 2.5 percent and 4 percent.President Nicolas Sarkozy of France urged the Group of 7 industrial countries to step up their monitoring of international financial markets, and his finance minister, Christine Lagarde, said ministers could meet before their next meeting scheduled for October.The European Commission also said it would seek greater scrutiny of ratings agencies like Moody's and Standard & Poor's, companies that have built lucrative businesses by providing credible ratings to companies and investment products, a call that was also joined by Sarkozy. Now, the agencies stand accused of being slow to warn investors of problems in the subprime mortgage industry in the United States.""We have to ask ourselves the exact role rating agencies should play in mapping risks,"" Sarkozy said in letter to German Chancellor Angela Merkel a released Thursday, news services reported. ""Their role, which allies the creation of these products and the risk assessment, should be submitted to a careful examination.""Ratings agencies have said they are cooperating in an review led by securities regulators.Suspicions that hidden losses from investments in subprime-related securities might still pop up world still loom large, making investors reluctant to fuel what only recently seemed like a bullish market.On Thursday, a Spanish fund, March Monetario Dinamico, announced it had limited withdrawals for around 3,000 investors due to knock-on effects from the world-wide credit squeeze, Reuters reported. The limitation on withdrawals from the €250 million, or $340 million, fund is in response to the freezing of the BNP Paribas fund Parvest Dynamic ABS, although withdrawals were restricted to just the 5.6 percent weighting of the BNP Paribas fund, Banca March said.Citing subprime exposure, BNP Paribas, one of the largest French banks, froze €1.6 billion worth of funds last Thursday, triggering a sharp decline in financial markets.At the heart of the problem with subprime loans is the seized-up market for these securities, which are backed by mortgages that are now going sour.Very little trading of them is going on, making it difficult to fix a price. To remedy the situation, holders of these investments have to be willing or able to take losses, while buyers need to have the appetite for new risk - two developments that are likely to unfold slowly.""This process is likely to play out for the next three to six months,"" said Chris Mahoney, Vice Chairman-Moody's Investors Service.Against this backdrop, many investors found themselves pondering whether the subprime crisis, now mostly confined to one sector of the U.S. economy, would spread and help trigger slowdowns elsewhere in the world - two contingencies that seemed remote until very recently.""We are getting a lot of questions on these basic tenets of the economy,"" said Erik Nielsen, chief Europe economist at Goldman Sachs in London.U.S. Treasury Secretary Henry Paulson told The Wall Street Journal that market turmoil ""will extract a penalty"" on growth in the United States, but said the economy and financial markets are ""strong enough to absorb the losses."" That fact is helping to drive down stocks in emerging markets and Asia, two regions heavily reliant on exports to the world's largest economy.Lagarde of France offered a similar, if more narrow, assessment for France. ""We have every reason to feel confident about the situation of the French banking sector,"" Lagarde said, Reuters reported.The notion that sliding markets might be a more common feature of the financial landscape appeared to be sinking in as even smaller investors contemplated whether now was the time to cut their losses.But evidence of widespread small-investor exodus appeared spotty, for now at least.""The majority of our investors seem to be holding tight at the moment,"" said Juliette Schooling, head of research for Chelsea Financial Services in London, which manages roughly £1 billion in investments for retail investors ranging from small savers to high net worth individuals.While Chelsea's fund managers have received some calls from concerned investors, she said, there did not seem to be any sense of panic. Some of that calm could be due to the fact that many people are away on summer vacations and not keeping close tabs on the market's recent gyrations, Schooling conceded.Countrywide Financial, the largest U.S. mortgage lender, said Thursday it has tapped $11.5 billion in emergency loans from 40 of the world's largest banks, as it seeks to shore up its cash position, deepening the fresh slide on Wall Street.The company, which relies heavily on raising money from Wall Street, acted a day after a prominent analyst suggested it may have to file for bankruptcy if banks and investors shut off the spigot of money to Countrywide.Wayne Arnold reported from Singapore, Sang- Hun Choe from Seoul, Heather Timmons from Delhi and James Kanter and Nicola Clark from Paris."
13,
14,"OTTAWA, Aug. 16  Banks and money managers came together Thursday to end a credit crisis in an arcane branch of Canada’s debt market.The group signed an agreement that is expected to resolve a situation where some nonbank holders of asset-backed commercial paper were unable to roll over their debt and get their banks to provide emergency financing.Unlike the subprime mortgages causing turmoil in markets in the United States, the debt in the Canadian liquidity problem was viewed as generally of high quality. It is made up largely of credit card loans, auto loans and leases and market-rate mortgages that have been repackaged into short-term securities.“This does not appear to be an issue of the underlying assets,” said David Wolf, the head of Canadian economics and chief strategist of Merrill Lynch Canada. “The flare-up looks to be an outgrowth of increased risk aversion globally.”The specific problem resulted from another Canadian exception. Unlike their United States counterparts, Canadian banks are not required by regulators to give holders of commercial paper  companies that have made the loans  cash for liquidity on demand. Instead, they must extend cash only in the event of a “market disruption,” a determination that the government leaves up to the bankers.The Toronto-based Coventree, which has about 16 billion Canadian dollars ($14.8 billion) in asset-backed commercial paper, was the first of several companies that said the bankers would not provide it with cash after concluding that there was no market disruption.About 40 billion Canadian dollars in asset-backed commercial paper is held outside banks, in addition to about 75 billion Canadian dollars held by the country’s five large chartered banks.On Wednesday, the Caisse de Dépôt et Placement du Québec summoned several other pension plans, ABN Amro, Barclays Capital, UBS, the National Bank of Canada, the Desjardins Group, Deutsche Bank, HSBC and Merrill Lynch to its Montreal headquarters.After a session that ran late Wednesday and resumed Thursday morning, the group agreed to convert asset-backed commercial paper, which normally matures in 30 to 60 days, into long-term notes with a floating interest rate. Until that happens, they have agreed not to make margin calls on holders of the paper for 150 days and to drop all current liquidity calls.“This agreement that was published isn’t necessarily a great solution for everyone,” Mr. Wolf said. “But what would happen if they said no?”Coventree, the Bank of Canada and the country’s finance minister, Jim Flaherty, were among those who supported the plan.Not everyone was convinced that the problem was solved. Despite the agreement, Coventree’s shares fell 5.3 percent, to 3.70 Canadian dollars, below its 52-week high of 16.30 Canadian dollars.Nor will all investors be interested in the debt after its maturity extension begins.Among them is Ken Anderson, who manages the United States and Canada money market funds for Fidelity Investments.“They’re going to take these extendible securities and turn them out into a three- and five-year portion of the curve,"" Mr. Anderson said during a conference call with investment advisers. “We cannot invest out past one year. So I’m not sure what type of solution this is. I think the holders of these securities will be forced to sell and most likely take some losses in their funds."""
15,"Shut out of the short-term debt market by an expanding credit crisis, Countrywide Financial, the nation’s largest mortgage lender, turned yesterday to 40 of the biggest banks, borrowing $11.5 billion as it tried to shore up its cash.The move sent ripples through the stock market — the Standard & Poor’s 500-stock index fell as much as 2.6 percent before recovering and ending the day slightly up — and it raised the chance that even the bluest of blue-chip mortgage companies could fail if investors and lenders lost confidence in them.Countrywide said it would make significant changes in its operations by largely limiting itself to only the safest mortgages that can be bought by Fannie Mae and Freddie Mac, the government-chartered agencies.That means some home buyers will pay more and have fewer choices when they borrow more than $417,000, the limit on loans the agencies can buy. Others will be required to put down at least 10 percent of the purchase price, and those with blemished or incomplete credit histories may no longer qualify for loans.“For better or for worse, Countrywide is the public face of U.S. mortgage lending,” said Guy Cecala, publisher of Inside Mortgage Finance, which covers home lending. “It has been the largest, and it has grown with the market.”In the first six months, the company made $245 billion in home loans, 17.4 percent of the total nationwide.Shares of Countrywide fell 11 percent, or $2.34, to close at $18.95. They had fallen as low as $15. The stock is down about 55 percent for the year. The price of the company’s bonds also fell and the cost of insuring its debt jumped sharply.Traditionally, banks made mortgages by lending the money that they took in as deposits, and they held the loans until they were repaid. Countrywide and most rivals largely do not operate that way. They borrow money from banks and investors on Wall Street, and when they close a mortgage they quickly sell, repeating the cycle over and over. Until recently, the relationship has been extremely profitable for both sides.But as defaults on mortgages made in recent years have surged, the system has started to break down.On Wednesday, Countrywide sought to raise money by issuing short-term debt known as commercial paper, something it does regularly. But there was no demand on Wall Street, according to two people briefed on the situation. Less than two weeks ago, the company said it had access to $50 billion in commercial paper, which has a term of nine months or less. In the last few days, the market for short-term debt has seized up, particularly for loans that are tied to mortgages, because investors say they can no longer value them.John Kodweis, managing director in JPMorgan’s short-term fixed income group, called it “the most challenging day since 1998,” but said his firm was able to place almost $30 billion with investors. That is JPMorgan’s typical volume, but the debt was placed at higher prices, and it took longer to find buyers.On Wednesday, an analyst at Merrill Lynch, Kenneth Bruce, put a “Sell” rating on Countrywide stock, saying liquidity problems could force the company to seek bankruptcy protection in severe circumstances. Dozens of lenders have already met a similar fate. Yesterday, First Magnus Financial, a small lender, stopped making loans because it could not sell mortgages to investors.“This is a credit crunch and crisis created independently of individual companies,” said Eric Flamholtz, a management professor at the University of California, Los Angeles who previously served as a consultant to Countrywide executives. “All these companies are getting crushed, some for no reason.”Analysts say Countrywide is likely to have a better chance of surviving than many of its rivals. For one thing, it had a contingency plan that included the committed bank loans it used yesterday. The company also has a bank subsidiary, Countrywide Bank, which it plans to use to make the majority of its loans by the end of September.If it does make it, the company will look significantly different.In a statement, Countrywide, which is based in Calabasas, Calif., said that 90 percent of the home loans it will make will conform to standards set by Fannie Mae and Freddie Mac. Less than two months ago, the company had said about 50 percent of its loans were eligible to be bought by the agencies.A spokesman for Countrywide, Rick Simon, said the company was still making loans, including so-called jumbo mortgages that are larger than $417,000. He declined to comment further.The changes are expected to significantly alter how the company and the industry do business. Countrywide, which was hiring aggressively in recent months as rivals were shutting down, will probably scale back its operations. At the end of June, the company had 33,800 employees in its loan production business, up from 32,500 12 months before.As Countrywide retrenches, traditional banks like Bank of America, Citibank and JPMorgan that can make and hold jumbo loans are expected to gain market share. Another winner will be regional banks and credit unions, which lost significant market share during the real estate boom.“Thousands and thousands of homes are coming back to us,” said Alfred A. DelliBovi, the president of the Federal Home Loan Bank of New York, which finances community banks.In fact, Countrywide itself is turning to the Federal Home Loan Bank system, which was created in the 1930s by the federal government to stimulate lending during the Depression. Countrywide Bank is a member of the Federal Home Loan Bank of Atlanta. At the end of June, Countrywide had the capacity to borrow $40.7 billion from the Home Loan Bank, of which $11.9 billion was still available.In a securities filing, Countrywide said its new debt would restrict its ability to engage in merger or acquisition talks and require the company to maintain a net worth of at least $7.7 billion. About $4.3 billion of the loans have a term of five years and the rest have a one-year term.Moody’s Investor Service, Standard & Poor’s and Fitch Ratings, the bond ratings firms, cut their ratings on Countrywide yesterday and said further cuts were possible. The company’s ratings are still considered investment grade. Moody’s and Fitch also cut the ratings of Residential Capital, the home lending arm of GMAC, to junk status.Moody’s also downgraded 691 mortgage securities totaling $19.4 billion that are backed by second loans used when borrowers with weak, or subprime, credit do not have enough for a down payment. The deals represent 76 percent of all such securities issued last year, including many that had Moody’s top Aaa rating."
