Title,Date,Link
"How to Solve a Subprime Mess? An Iowan Says, Let’s Caucus","Dec. 9, 2007",https://www.nytimes.com/2007/12/09/business/09ag.html?searchResultPosition=759
UBS Sells Stake After Write-Down,"Dec. 10, 2007",https://www.nytimes.com/2007/12/10/business/worldbusiness/10cnd-bank.html?searchResultPosition=760
Big Banks Scale Back Plan to Aid in Debt Crisis,"Dec. 10, 2007",https://www.nytimes.com/2007/12/10/business/10finance.html?searchResultPosition=765
MBIA Gets $1 Billion Investment from Warburg,"Dec. 10, 2007",https://www.nytimes.com/2007/12/10/business/worldbusiness/10iht-10mbia.8672530.html?searchResultPosition=766
Subprime surprise: UBS writes down $10 billion,"Dec. 10, 2007",https://www.nytimes.com/2007/12/10/business/worldbusiness/10iht-ubs.4.8676496.html?searchResultPosition=767
UBS sells stake after subprime write-down,"Dec. 10, 2007",https://www.nytimes.com/2007/12/10/business/worldbusiness/10iht-10ubs.8669297.html?searchResultPosition=768
UBS to Write Down $10 Billion as It Prepares Stake Sales,"Dec. 10, 2007",https://www.nytimes.comhttps://dealbook.nytimes.com/2007/12/10/ubs-to-write-down-10-billion-as-it-prepares-stake-sales/?searchResultPosition=769
Mortgage Crisis Forces the Closing of a Fund,"Dec. 11, 2007",https://www.nytimes.com/2007/12/11/business/11money.html?searchResultPosition=771
Federal Reserve cuts benchmark U.S. short-term rate by one-quarter point,"Dec. 11, 2007",https://www.nytimes.com/2007/12/11/business/worldbusiness/11iht-fed.5.8699909.html?searchResultPosition=772
UBS Records a Big Write-Down and Sells a Stake,"Dec. 11, 2007",https://www.nytimes.com/2007/12/11/business/worldbusiness/11bank.html?searchResultPosition=773
Fed Cuts Rate a Quarter Point; Stocks Dive,"Dec. 11, 2007",https://www.nytimes.com/2007/12/11/business/11cnd-fed.html?searchResultPosition=774
Mortgage Crisis Forces BofA Fund to Close,"Dec. 11, 2007",https://www.nytimes.comhttps://dealbook.nytimes.com/2007/12/11/mortgage-crisis-forces-the-closing-of-a-fund/?searchResultPosition=775
Bankers Face Grim Truth: Worst Is Yet to Come,"Dec. 12, 2007",https://www.nytimes.com/2007/12/12/business/12place.html?searchResultPosition=776
Shares Fall on a Rate Cut Considered a Disappointment to Fed Watchers,"Dec. 12, 2007",https://www.nytimes.com/2007/12/12/business/12stox.html?searchResultPosition=777
Credit Crisis Prompts Fed to Roll Back Rates Again,"Dec. 12, 2007",https://www.nytimes.com/2007/12/12/business/12fed.html?searchResultPosition=778
Chief Says G.E. Profit Will Grow 10% or More,"Dec. 12, 2007",https://www.nytimes.com/2007/12/12/business/12electric.html?searchResultPosition=779
U.S. Federal Reserve rate cut fails to quell crisis,"Dec. 12, 2007",https://www.nytimes.com/2007/12/12/business/worldbusiness/12iht-fed.1.8708293.html?searchResultPosition=780
Countrywide Subpoenaed by Illinois,"Dec. 13, 2007",https://www.nytimes.com/2007/12/13/business/13lend.html?searchResultPosition=784
Euphoria wears off quickly for investors,"Dec. 13, 2007",https://www.nytimes.com/2007/12/13/business/worldbusiness/13iht-credit.4.8735672.html?searchResultPosition=785
Can Things Get Worse?,"Dec. 13, 2007",https://www.nytimes.comhttps://economix.blogs.nytimes.com/2007/12/13/can-things-get-worse/?searchResultPosition=786
Big Rescue of Funds by Citigroup,"Dec. 14, 2007",https://www.nytimes.com/2007/12/14/business/14citi.html?searchResultPosition=787
Investors Shrug Off Global Cash Injection,"Dec. 14, 2007",https://www.nytimes.com/2007/12/14/business/14credit.html?searchResultPosition=788
Confidence Falls Among Japan’s Manufacturers,"Dec. 14, 2007",https://www.nytimes.com/2007/12/14/business/worldbusiness/14yen.html?searchResultPosition=789
Lehman’s Earnings Fall 12% in a Season That Could Have Been Worse,"Dec. 14, 2007",https://www.nytimes.com/2007/12/14/business/14wall.html?searchResultPosition=790
Germany’s KfW May Lose Billions on IKB Bailout,"Dec. 17, 2007",https://www.nytimes.comhttps://dealbook.nytimes.com/2007/12/17/germanys-kfw-may-lose-billions-on-ikb-bailout/?searchResultPosition=791
2007: Who Is the Bank of the Year?,"Dec. 17, 2007",https://www.nytimes.comhttps://dealbook.nytimes.com/2007/12/17/2007-who-is-the-bank-of-the-year/?searchResultPosition=792
Fed Shrugged as Subprime Crisis Spread,"Dec. 18, 2007",https://www.nytimes.com/2007/12/18/business/18subprime.html?searchResultPosition=793
ECB pumps record €348 billion into money markets,"Dec. 18, 2007",https://www.nytimes.com/2007/12/18/business/worldbusiness/18iht-credit.html?searchResultPosition=794
"In Reversal, Fed Approves Plan to Curb Risky Lending","Dec. 19, 2007",https://www.nytimes.com/2007/12/19/business/19subprime.html?searchResultPosition=795
European Union businesses largely escape global credit crunch - so far,"Dec. 20, 2007",https://www.nytimes.com/2007/12/20/business/worldbusiness/20iht-credit.html?searchResultPosition=796
$9.4 Billion Write-Down at Morgan Stanley,"Dec. 20, 2007",https://www.nytimes.com/2007/12/20/business/20wall.html?searchResultPosition=797
"The mortgage mess, viewed from a Christmas past.","Dec. 20, 2007",https://www.nytimes.com/2007/12/20/business/worldbusiness/20iht-norris21.html?searchResultPosition=798
Bond Insurer Cut to Junk; Negative Outlook for 4 More,"Dec. 20, 2007",https://www.nytimes.com/2007/12/20/business/20bond.html?searchResultPosition=799
The Year of Puncturing Wall Street Orthodoxy,"Dec. 21, 2007",https://www.nytimes.com/2007/12/21/business/21insider.html?searchResultPosition=800
Big Bond Insurer Discovers That Layers of Risk Do Not Create a Cushion,"Dec. 21, 2007",https://www.nytimes.com/2007/12/21/business/21bond.html?searchResultPosition=804
"Class-Action Cases Rise, Fueled by Subprime Troubles","Dec. 21, 2007",https://www.nytimes.com/2007/12/21/business/21suit.html?searchResultPosition=805
Solving the Mortgage Crisis May Require a Guardian Angel,"Dec. 21, 2007",https://www.nytimes.com/2007/12/21/business/21norris.html?searchResultPosition=806
Not a Jolly Season for 2 Top Bankers,"Dec. 21, 2007",https://www.nytimes.com/2007/12/21/business/21wall.html?searchResultPosition=807
Subprime Troubles Fuel Class-Action Suits,"Dec. 21, 2007",https://www.nytimes.comhttps://dealbook.nytimes.com/2007/12/21/subprime-troubles-fuel-class-action-suits/?searchResultPosition=808
Banks’ Big Fund to Prop Up Securities Is Scrapped,"Dec. 24, 2007",https://www.nytimes.comhttps://dealbook.nytimes.com/2007/12/24/banks-big-fund-to-prop-up-securities-is-scrapped/?searchResultPosition=811
Restructuring Aims to Give Canada’s Debt Market a $33 Billion Lift,"Dec. 25, 2007",https://www.nytimes.com/2007/12/25/business/25paper.html?searchResultPosition=812
Toyota Aims to Be No. 1 in 2008 Vehicle Sales,"Dec. 26, 2007",https://www.nytimes.com/2007/12/26/business/26toyota.html?searchResultPosition=813
Floyd Norris: New wave of defaults in the offing for 2008,"Dec. 27, 2007",https://www.nytimes.com/2007/12/27/business/worldbusiness/27iht-norris28.html?searchResultPosition=814
"In Europe, Tighter Lending but Not a Squeeze","Dec. 27, 2007",https://www.nytimes.com/2007/12/27/business/worldbusiness/27credit.html?searchResultPosition=815
Stocks End the Day on a Slide,"Dec. 27, 2007",https://www.nytimes.com/2007/12/27/business/27cnd-stox.html?searchResultPosition=816
Deal Chatter 2007: What Got You Talking,"Dec. 27, 2007",https://www.nytimes.comhttps://dealbook.nytimes.com/2007/12/27/deal-chatter-2007-what-got-you-talking/?searchResultPosition=817
Weak Data Puts Shares in a Tailspin,"Dec. 28, 2007",https://www.nytimes.com/2007/12/28/business/28stox.html?searchResultPosition=818
New-Home Sales Hit 12-Year Low in November,"Dec. 28, 2007",https://www.nytimes.com/2007/12/28/business/28cnd-home.html?searchResultPosition=819
"Another year, another set","Dec. 28, 2007",https://www.nytimes.com/2007/12/28/business/worldbusiness/28iht-MYEAR.html?searchResultPosition=820
Credit Crisis? Just Wait for a Replay,"Dec. 28, 2007",https://www.nytimes.com/2007/12/28/business/28norris.html?searchResultPosition=825
"A Winner, but Now With a Lot to Lose","Dec. 29, 2007",https://www.nytimes.com/2007/12/29/business/29place.html?searchResultPosition=826
UBS Cancels Buyout of Indian Bank,"Dec. 29, 2007",https://www.nytimes.com/2007/12/29/business/worldbusiness/29bank.html?searchResultPosition=827
"The Debt Crisis, Where It’s Least Expected","Dec. 30, 2007",https://www.nytimes.com/2007/12/30/business/30loan.html?searchResultPosition=828
Winners and Losers in a Year of Deal-Making,"Dec. 30, 2007",https://www.nytimes.com/2007/12/30/business/30deal.html?searchResultPosition=829
Markets End Lower to End the Year,"Dec. 31, 2007",https://www.nytimes.com/2007/12/31/business/01stox-web.html?searchResultPosition=830
"For financial companies, 2007 was a topsy turvy year","Jan. 1, 2008",https://www.nytimes.com/2008/01/01/business/worldbusiness/01iht-markets.4.8979476.html?searchResultPosition=1
"U.S. stocks slip, ending year of turmoil","Jan. 1, 2008",https://www.nytimes.com/2008/01/01/business/worldbusiness/01iht-01stox1.8967825.html?searchResultPosition=2
"Stocks slip, ending year of turmoil","Jan. 1, 2008",https://www.nytimes.com/2008/01/01/business/worldbusiness/01iht-01socks.8975009.html?searchResultPosition=3
"Fund frozen, Florida towns feel the pinch","Jan. 1, 2008",https://www.nytimes.com/2008/01/01/business/worldbusiness/01iht-fund.4.8977712.html?searchResultPosition=4
"Stocks Slip, Ending Year of Turmoil","Jan. 1, 2008",https://www.nytimes.com/2008/01/01/business/01stox-1.html?searchResultPosition=5
Investment in clean energy topped $100 billion for first time in 2007,"Jan. 2, 2008",https://www.nytimes.com/2008/01/02/business/worldbusiness/02iht-energy.4.8994691.html?searchResultPosition=6
A Wall Street reversal as brokers suffer while investors gain,"Jan. 2, 2008",https://www.nytimes.com/2008/01/02/business/worldbusiness/02iht-markets.1.8983551.html?searchResultPosition=7
"2007 Was Unpredictable, but Let’s Brave 2008 Anyway","Jan. 2, 2008",https://www.nytimes.com/2008/01/02/business/02predict.html?searchResultPosition=8
"Customers, Not Brokers, Profited in an Odd 2007","Jan. 2, 2008",https://www.nytimes.com/2008/01/02/business/02cnd-markets.html?searchResultPosition=9
Educated guesses: A look at 2008,"Jan. 2, 2008",https://www.nytimes.com/2008/01/02/business/worldbusiness/02iht-predict.1.8984632.html?searchResultPosition=11
In the Land of Many Ifs,"Jan. 2, 2008",https://www.nytimes.com/2008/01/02/business/02econ.html?searchResultPosition=12
Fund Manager Faces Legal Siege Over Investments,"Jan. 3, 2008",https://www.nytimes.com/2008/01/03/business/03cnd-state.html?searchResultPosition=13
Mortgage crisis inquiry reviews whether data on loans was withheld,"Jan. 3, 2008",https://www.nytimes.com/2008/01/13/business/worldbusiness/13iht-mortgage.1.9170018.html?searchResultPosition=14
Clean Energy Investments Top $100 Billion,"Jan. 3, 2008",https://www.nytimes.comhttps://dealbook.nytimes.com/2008/01/03/clean-energy-investments-break-100-million-barrier/?searchResultPosition=15
State Street Corp. Is Sued Over Pension Fund Losses,"Jan. 4, 2008",https://www.nytimes.com/2008/01/04/business/04state.html?searchResultPosition=16
"U.S. job growth slows, sending stocks lower","Jan. 4, 2008",https://www.nytimes.com/2008/01/04/business/worldbusiness/04iht-usecon.3.9023194.html?searchResultPosition=17
Rate shift signals growing gap between U.S. and China economies,"Jan. 4, 2008",https://www.nytimes.com/2008/01/04/business/worldbusiness/04iht-04rates.9020196.html?searchResultPosition=18
Spin and denial survive the global credit crunch,"Jan. 4, 2008",https://www.nytimes.com/2008/01/04/business/worldbusiness/04iht-wbdance.1.9021958.html?searchResultPosition=19
Inside the Markets: History isn't much help for  predicting,"Jan. 4, 2008",https://www.nytimes.com/2008/01/14/business/worldbusiness/14iht-rtrcol15.4.9200855.html?searchResultPosition=20
Credit Agricole to sell 2 percent of Suez,"Jan. 4, 2008",https://www.nytimes.com/2008/01/14/business/worldbusiness/14iht-ca.4.9213308.html?searchResultPosition=21
"As State Street Faces Suit Over Losses, Will Others Follow?","Jan. 4, 2008",https://www.nytimes.comhttps://dealbook.nytimes.com/2008/01/04/as-state-street-faces-suit-over-losses-will-others-follow/?searchResultPosition=22
Merrill Lynch seeking capital infusion in Japan,"Jan. 5, 2008",https://www.nytimes.com/2008/01/15/business/worldbusiness/15iht-merrill.9221213.html?searchResultPosition=23
India's biggest IPO raises $3 billion in a minute for Reliance Power,"Jan. 5, 2008",https://www.nytimes.com/2008/01/15/business/worldbusiness/15iht-ipo.1.9223622.html?searchResultPosition=24
Fears on Inflation and Jobs Give 2008 a Stumbling Start,"Jan. 5, 2008",https://www.nytimes.com/2008/01/05/business/05markets.html?searchResultPosition=25
Bond sales in Australia illustrate flight from global risks,"Jan. 6, 2008",https://www.nytimes.com/2008/01/16/business/worldbusiness/16iht-bonds.1.9253215.html?searchResultPosition=26
Testing Investors’ Faith in State Street,"Jan. 6, 2008",https://www.nytimes.com/2008/01/06/business/06gret.html?searchResultPosition=27
Harry Macklowe’s $6.4 Billion Bill,"Jan. 6, 2008",https://www.nytimes.com/2008/01/06/business/06harry.html?searchResultPosition=28
Damage from subprime is still being tallied,"Jan. 6, 2008",https://www.nytimes.com/2008/01/06/business/worldbusiness/06iht-morgenson.1.9035455.html?searchResultPosition=29
U.S. banks turn to new sources to replenish capital,"Jan. 6, 2008",https://www.nytimes.com/2008/01/16/business/worldbusiness/16iht-banks.4.9271133.html?searchResultPosition=30
Banks in Japan stumble after helping U.S. rivals,"Jan. 6, 2008",https://www.nytimes.com/2008/01/16/business/worldbusiness/16iht-jbank.1.9254076.html?searchResultPosition=31
"Minus Housing, U.S. Job Cuts Look Tame","Jan. 6, 2008",https://www.nytimes.com/2008/01/06/business/06count.html?searchResultPosition=32
Asian stocks hit a two-week low as recession fears grow,"Jan. 7, 2008",https://www.nytimes.com/2008/01/07/business/worldbusiness/07iht-07stocksupdate1.9048809.html?searchResultPosition=33
"Bush administration working to combat mortgage crisis, Paulson says","Jan. 7, 2008",https://www.nytimes.com/2008/01/07/business/worldbusiness/07iht-paulsonweb.9056091.html?searchResultPosition=34
Asian stocks start the week lower as recession fears grow,"Jan. 7, 2008",https://www.nytimes.com/2008/01/07/business/worldbusiness/07iht-07markets.9047425.html?searchResultPosition=35
Paulson says Bush administration working to combat subprime crisis,"Jan. 7, 2008",https://www.nytimes.com/2008/01/07/business/worldbusiness/07iht-paulson.4.9057461.html?searchResultPosition=36
Merrill Lynch reports record loss after $16.7 billion in write-downs,"Jan. 7, 2008",https://www.nytimes.com/2008/01/17/business/worldbusiness/17iht-merrill.4.9298820.html?searchResultPosition=37
Time is Crucial for China’s Wealth Fund,"Jan. 7, 2008",https://www.nytimes.comhttps://dealbook.nytimes.com/2008/01/07/chinas-wealth-fund-is-in-a-hurry/?searchResultPosition=38
Credit Suisse Shares Fall Amid Write-Down Fears,"Jan. 7, 2008",https://www.nytimes.comhttps://dealbook.nytimes.com/2008/01/07/credit-suisse-shares-fall-amid-write-down-fears/?searchResultPosition=39
Co-president quits at Barclays Capital,"Jan. 8, 2008",https://www.nytimes.com/2008/01/08/business/worldbusiness/08iht-barclays.4.9085552.html?searchResultPosition=40
New York panel rethinks securities oversight,"Jan. 8, 2008",https://www.nytimes.com/2008/01/18/business/worldbusiness/18iht-19regulate.9334356.html?searchResultPosition=41
Bush acknowledges challenges to U.S. economy,"Jan. 8, 2008",https://www.nytimes.com/2008/01/08/business/worldbusiness/08iht-08bush.9070919.html?searchResultPosition=42
Bear Stearns CEO stepping down,"Jan. 8, 2008",https://www.nytimes.com/2008/01/08/business/worldbusiness/08iht-08bear.9070400.html?searchResultPosition=43
Bush Admits Economy Faces Challenges,"Jan. 8, 2008",https://www.nytimes.com/2008/01/08/business/08bush.html?searchResultPosition=44
"U.S. may expand mortgage aid, Paulson says","Jan. 8, 2008",https://www.nytimes.com/2008/01/08/business/worldbusiness/08iht-08webpaulson.9080458.html?searchResultPosition=45
Bear’s Cayne to Quit as Chief Executive,"Jan. 8, 2008",https://www.nytimes.com/2008/01/08/business/08bear.html?searchResultPosition=46
Bear Stearns Announces New Leadership,"Jan. 8, 2008",https://www.nytimes.com/2008/01/08/business/08cnd-bear.html?searchResultPosition=47
Losses May Leave Banks Short on Capital,"Jan. 8, 2008",https://www.nytimes.comhttps://dealbook.nytimes.com/2008/01/08/losses-may-leave-banks-short-on-capital/?searchResultPosition=49
Bear Stearns chief passes the baton,"Jan. 9, 2008",https://www.nytimes.com/2008/01/09/business/worldbusiness/09iht-09bear.9093066.html?searchResultPosition=50
Extrication Time at Bear Stearns,"Jan. 9, 2008",https://www.nytimes.com/2008/01/09/business/09bear.html?searchResultPosition=51
Bear Stearns announces new leadership,"Jan. 9, 2008",https://www.nytimes.com/2008/01/09/business/worldbusiness/09iht-08cndbear.9092002.html?searchResultPosition=52
MBIA cuts dividend and says it will raise $1 billion,"Jan. 9, 2008",https://www.nytimes.com/2008/01/09/business/worldbusiness/09iht-mbia.4.9104822.html?searchResultPosition=53
American chief executives face tenuous times,"Jan. 9, 2008",https://www.nytimes.com/2008/01/09/business/worldbusiness/09iht-exec.1.9096108.html?searchResultPosition=54
Executive Leaving Barclays Capital,"Jan. 9, 2008",https://www.nytimes.com/2008/01/09/business/09bank.html?searchResultPosition=55
Bear Stearns CEO confirms departure,"Jan. 9, 2008",https://www.nytimes.com/2008/01/09/business/worldbusiness/09iht-08bear.9091799.html?searchResultPosition=56
Some entrepreneurs prosper during U.S. housing slump,"Jan. 9, 2008",https://www.nytimes.com/2008/01/09/business/worldbusiness/09iht-sbiz.4.9112164.html?searchResultPosition=57
Co-President of Barclays Capital Resigns,"Jan. 9, 2008",https://www.nytimes.comhttps://dealbook.nytimes.com/2008/01/09/co-president-of-barclays-capital-resigns/?searchResultPosition=58
"Toyota's yearly sales rise, possibly edging out GM","Jan. 10, 2008",https://www.nytimes.com/2008/01/10/business/worldbusiness/10iht-toyota.1.9126879.html?searchResultPosition=60
Keeping the Housing Slump at Bay,"Jan. 10, 2008",https://www.nytimes.com/2008/01/10/business/smallbusiness/10hunt.html?searchResultPosition=61
Bank of America in talks to buy Countrywide,"Jan. 10, 2008",https://www.nytimes.com/2008/01/10/business/worldbusiness/10iht-10cndbank.9140973.html?searchResultPosition=62
Bank of America in Talks to Buy Countrywide,"Jan. 10, 2008",https://www.nytimes.com/2008/01/10/business/10cnd-bank.html?searchResultPosition=63
Fed Chief Signals Further Rate Cut,"Jan. 11, 2008",https://www.nytimes.com/2008/01/11/business/11fed.html?searchResultPosition=64
Europe struggles to avoid effects of U.S. weakness,"Jan. 11, 2008",https://www.nytimes.com/2008/01/11/business/worldbusiness/11iht-euecon.4.9157618.html?searchResultPosition=65
Bank Agrees to Buy Troubled Loan Giant for $4 Billion,"Jan. 11, 2008",https://www.nytimes.com/2008/01/11/business/12bank-web.html?searchResultPosition=66
Bank of America agrees to acquire troubled lender,"Jan. 11, 2008",https://www.nytimes.com/2008/01/11/business/worldbusiness/11iht-bofa.2.9150111.html?searchResultPosition=67
Write-down at Merrill Lynch may hit $15 billion,"Jan. 11, 2008",https://www.nytimes.com/2008/01/11/business/worldbusiness/11iht-11wall.9146251.html?searchResultPosition=68
Bank of America may buy troubled Countrywide,"Jan. 11, 2008",https://www.nytimes.com/2008/01/11/business/worldbusiness/11iht-11bank.9146224.html?searchResultPosition=69
Giant Write-Down Is Seen for Merrill,"Jan. 11, 2008",https://www.nytimes.com/2008/01/11/business/11wall.html?searchResultPosition=70
Merrill Lynch facing a $15 billion write-down from soured investments,"Jan. 11, 2008",https://www.nytimes.com/2008/01/11/business/worldbusiness/11iht-merrill.4.9158486.html?searchResultPosition=71
Bernanke sees bleak outlook for U.S. economy,"Jan. 11, 2008",https://www.nytimes.com/2008/01/11/business/worldbusiness/11iht-fed.1.9148850.html?searchResultPosition=73
Northern Rock Sells Some Assets,"Jan. 11, 2008",https://www.nytimes.com/2008/01/11/business/worldbusiness/11cnd-rock.html?searchResultPosition=74
"Shares Up, Aided by Talk of Bank Deal","Jan. 11, 2008",https://www.nytimes.com/2008/01/11/business/11stox.html?searchResultPosition=75
Bank of America to buy Countrywide,"Jan. 11, 2008",https://www.nytimes.com/2008/01/11/business/worldbusiness/11iht-bofa.3.9157464.html?searchResultPosition=76
Bank May Buy Troubled Giant in Home Loans,"Jan. 11, 2008",https://www.nytimes.com/2008/01/11/business/11bank.html?searchResultPosition=77
Europe and U.S. Diverge on Rate Prospects,"Jan. 11, 2008",https://www.nytimes.com/2008/01/11/business/worldbusiness/11cnd-euro.html?searchResultPosition=78
BofA to Buy Countrywide for $4 Billion,"Jan. 11, 2008",https://www.nytimes.comhttps://dealbook.nytimes.com/2008/01/11/bofa-to-buy-countrywide-for-4-billion/?searchResultPosition=80
BofA’s Countrywide Deal: Bargain or Bad Move?,"Jan. 11, 2008",https://www.nytimes.comhttps://dealbook.nytimes.com/2008/01/11/bofas-countrywide-deal-bargain-or-bad-move/?searchResultPosition=81
Inquiry Focuses on Withholding of Data on Loans,"Jan. 12, 2008",https://www.nytimes.com/2008/01/12/business/12lend.html?searchResultPosition=82
Chase Buys Some of Lender’s Assets,"Jan. 12, 2008",https://www.nytimes.com/2008/01/12/business/12rock.html?searchResultPosition=83
U.S. and Europe Ponder Divergent Rate Policies,"Jan. 12, 2008",https://www.nytimes.com/2008/01/12/business/worldbusiness/12euro.html?searchResultPosition=84
Some fear U.S. economic measures already too late,"Jan. 13, 2008",https://www.nytimes.com/2008/01/13/business/worldbusiness/13iht-14usecon.9170658.html?searchResultPosition=85
Financial markets facing tough questions this week,"Jan. 13, 2008",https://www.nytimes.com/2008/01/13/business/worldbusiness/13iht-14rtrmarket.9169509.html?searchResultPosition=86
No Quick Fix to Downturn,"Jan. 13, 2008",https://www.nytimes.com/2008/01/13/business/13econ.html?searchResultPosition=87
Economists see no quick fix for U.S. downturn,"Jan. 13, 2008",https://www.nytimes.com/2008/01/13/business/worldbusiness/13iht-econ.1.9171661.html?searchResultPosition=88
Europe searches for adequate regulations,"Jan. 14, 2008",https://www.nytimes.com/2008/01/14/business/worldbusiness/14iht-rtrinside15.1.9190637.html?searchResultPosition=89
Inquiry Focuses on Banks’ Data on Loans,"Jan. 14, 2008",https://www.nytimes.comhttps://dealbook.nytimes.com/2008/01/14/inquiry-focuses-on-banks-data-on-loans/?searchResultPosition=90
Citigroup Loses $9.8 Billion; Will Cut Jobs,"Jan. 15, 2008",https://www.nytimes.com/2008/01/15/business/16citi.html?searchResultPosition=91
Poor U.S. retail sales for Dec. add to economic gloom,"Jan. 15, 2008",https://www.nytimes.com/2008/01/15/business/worldbusiness/15iht-econ.5.9244165.html?searchResultPosition=92
Drastic steps from Citigroup and Merrill Lynch,"Jan. 15, 2008",https://www.nytimes.com/2008/01/15/business/worldbusiness/15iht-banks.4.9239382.html?searchResultPosition=93
Poor U.S. retail sales for December add to economic gloom,"Jan. 15, 2008",https://www.nytimes.com/2008/01/15/business/worldbusiness/15iht-econ.4.9240624.html?searchResultPosition=94
Ex-Wall St. Chiefs Asked to Testify on Pay,"Jan. 15, 2008",https://www.nytimes.comhttps://dealbook.nytimes.com/2008/01/15/congress-asks-prince-oneal-to-testify-on-pay/?searchResultPosition=96
"CNBC Video: Rohatyn on Subprime, Sovereign Wealth Funds","Jan. 15, 2008",https://www.nytimes.comhttps://dealbook.nytimes.com/2008/01/15/cnbc-video-rohatyn-on-subprime-sovereign-wealth-funds/?searchResultPosition=97
"Buddy, Can You Spare a Billion?","Jan. 16, 2008",https://www.nytimes.com/2008/01/16/business/16capital.html?searchResultPosition=98
JPMorgan Joins Banks in Write-Downs,"Jan. 16, 2008",https://www.nytimes.com/2008/01/16/business/16cnd-bank.html?searchResultPosition=99
Citigroup Loss Raises Anxiety Over Economy,"Jan. 16, 2008",https://www.nytimes.com/2008/01/16/business/16bank.html?searchResultPosition=100
U.S. financial woes: More to come after Citigroup,"Jan. 16, 2008",https://www.nytimes.com/2008/01/16/business/worldbusiness/16iht-usecon.1.9250742.html?searchResultPosition=102
Global markets fall on fears for U.S. economy,"Jan. 16, 2008",https://www.nytimes.com/2008/01/16/business/worldbusiness/16iht-markets.1.9255218.html?searchResultPosition=103
Fed chief backs quick action to aid U.S. economy,"Jan. 17, 2008",https://www.nytimes.com/2008/01/17/business/worldbusiness/17iht-17cndfeda.9296326.html?searchResultPosition=105
Bernanke urges measures to jolt U.S. economy,"Jan. 17, 2008",https://www.nytimes.com/2008/01/17/business/worldbusiness/17iht-usecon.4.9300528.html?searchResultPosition=106
Fed's warning on economy pushes down U.S. stocks,"Jan. 17, 2008",https://www.nytimes.com/2008/01/17/business/worldbusiness/17iht-17webstox.9296428.html?searchResultPosition=107
Fed Chief Backs Quick Action to Aid Economy,"Jan. 17, 2008",https://www.nytimes.com/2008/01/17/business/17cnd-fed.html?searchResultPosition=108
Merrill Lynch loss is nearly $10 billion,"Jan. 17, 2008",https://www.nytimes.com/2008/01/17/business/worldbusiness/17iht-17merrillFW.9289611.html?searchResultPosition=109
Lehman Cuts Back in Mortgages,"Jan. 18, 2008",https://www.nytimes.com/2008/01/18/business/18lehman.html?searchResultPosition=111
UBS plans massive cuts,"Jan. 18, 2008",https://www.nytimes.com/2008/01/18/business/worldbusiness/18iht-18webubs.9317733.html?searchResultPosition=112
Wall Street’s Next Crisis: Bond Insurers?,"Jan. 18, 2008",https://www.nytimes.comhttps://dealbook.nytimes.com/2008/01/18/as-bond-insurers-falter-wall-street-cringes/?searchResultPosition=113
