Title,Date,Link
Senate Approves Housing Relief Bill,"April 11, 2008",https://www.nytimes.com/2008/04/11/business/11housing.html?searchResultPosition=628
"Blankfein, Goldman Sachs chief, says credit crisis in late stages","April 11, 2008",https://www.nytimes.com/2008/04/11/business/worldbusiness/11iht-11goldman.11890918.html?searchResultPosition=629
U.S. Senate approves housing relief bill,"April 11, 2008",https://www.nytimes.com/2008/04/11/business/worldbusiness/11iht-11housing.11892558.html?searchResultPosition=630
"G.E. Earnings Drop, Raising Broader Fears","April 12, 2008",https://www.nytimes.com/2008/04/12/business/12electric.html?searchResultPosition=632
But What of the Small Investor?,"April 13, 2008",https://www.nytimes.com/2008/04/13/business/13maker.html?searchResultPosition=633
A Lender Failed. Did Its Auditor?,"April 13, 2008",https://www.nytimes.com/2008/04/13/business/13audit.html?searchResultPosition=634
G-7 leaders talk tough on currency markets,"April 13, 2008",https://www.nytimes.com/2008/04/13/business/worldbusiness/13iht-13g7fw.11941719.html?searchResultPosition=635
But what about the small investor?,"April 13, 2008",https://www.nytimes.com/2008/04/13/business/worldbusiness/13iht-13maker.11930273.html?searchResultPosition=636
U.S. housing collapse spreads overseas,"April 13, 2008",https://www.nytimes.com/2008/04/13/business/worldbusiness/13iht-housing.1.11931770.html?searchResultPosition=637
Accounting failures enter the subprime equation,"April 13, 2008",https://www.nytimes.com/2008/04/13/business/worldbusiness/13iht-audit.1.11931913.html?searchResultPosition=638
Housing Woes in U.S. Spread Around Globe,"April 14, 2008",https://www.nytimes.com/2008/04/14/business/worldbusiness/14real.html?searchResultPosition=639
Asia banks have no clear choice on the dollar,"April 14, 2008",https://www.nytimes.com/2008/04/14/business/worldbusiness/14iht-rtrinvest15.1.11956825.html?searchResultPosition=640
Asia looks to itself for funding,"April 14, 2008",https://www.nytimes.com/2008/04/14/business/worldbusiness/14iht-liquidity.1.11952978.html?searchResultPosition=641
"Despite Tough Times, Ultrarich Keep Spending","April 14, 2008",https://www.nytimes.comhttps://dealbook.nytimes.com/2008/04/14/despite-tough-times-ultrarich-keep-spending/?searchResultPosition=642
Treasury Reports to Propose Hedge-Fund Guides,"April 15, 2008",https://www.nytimes.comhttps://dealbook.nytimes.com/2008/04/15/treasury-reports-lay-out-hedge-fund-best-pratice-guidelines/?searchResultPosition=644
Stronger earnings lift U.S. stocks,"April 16, 2008",https://www.nytimes.com/2008/04/16/business/worldbusiness/16iht-16marketsfw.12051185.html?searchResultPosition=645
UBS reduces dividend to bolster equity base,"April 16, 2008",https://www.nytimes.com/2008/04/16/business/worldbusiness/16iht-ubs.1.12036753.html?searchResultPosition=646
UBS’s Next Chair Sees Long Road to Redemption,"April 16, 2008",https://www.nytimes.comhttps://dealbook.nytimes.com/2008/04/16/ubss-next-chair-sees-long-road-to-redemption/?searchResultPosition=647
"Bank Earnings Fall, but Investors Seem Relieved","April 17, 2008",https://www.nytimes.com/2008/04/17/business/17bank.html?searchResultPosition=648
Credit crisis triggers downturn in Iceland,"April 17, 2008",https://www.nytimes.com/2008/04/17/business/worldbusiness/17iht-iceland.4.12111174.html?searchResultPosition=649
"In Spain, your casa is suddenly the state's casa","April 17, 2008",https://www.nytimes.com/2008/04/17/business/worldbusiness/17iht-casa.4.12097102.html?searchResultPosition=650
"Iceland, a Tiny Dynamo, Loses Steam","April 18, 2008",https://www.nytimes.com/2008/04/18/business/worldbusiness/18iceland.html?searchResultPosition=652
House Votes to Shore Up Student Loans,"April 18, 2008",https://www.nytimes.com/2008/04/18/business/18loan.html?searchResultPosition=653
Citigroup posts $5.1 billion loss; Royal Bank of Scotland to raise funds,"April 18, 2008",https://www.nytimes.com/2008/04/18/business/worldbusiness/18iht-rbs.1.12130972.html?searchResultPosition=654
"Citigroup reports $5.1 billion loss, while Royal Bank of Scotland prepares rights issue","April 18, 2008",https://www.nytimes.com/2008/04/18/business/worldbusiness/18iht-banks.4.12147734.html?searchResultPosition=655
"When the Focus Is Expansion, Not Subprime Worries","April 19, 2008",https://www.nytimes.com/2008/04/19/business/19interview.html?searchResultPosition=656
"As Crocs Departs, Quebec Turns Bitter","April 20, 2008",https://www.nytimes.com/2008/04/20/business/20suits.html?searchResultPosition=657
Worked Over and Overworked,"April 20, 2008",https://www.nytimes.com/2008/04/20/business/20workexcerpt.html?searchResultPosition=658
Bank of England to provide liquidity to British banks,"April 20, 2008",https://www.nytimes.com/2008/04/20/business/worldbusiness/20iht-credit.4.12168930.html?searchResultPosition=659
"Muni Bonds, Safe With High Yields","April 21, 2008",https://www.nytimes.com/2008/04/21/business/retirement/21MUNIS.html?searchResultPosition=660
U.K. central bank acts to ease credit markets,"April 21, 2008",https://www.nytimes.com/2008/04/21/business/worldbusiness/21iht-21credit.12178941.html?searchResultPosition=661
Bank of America braces for consumer loan losses,"April 21, 2008",https://www.nytimes.com/2008/04/21/business/worldbusiness/21iht-21cndbank.12194312.html?searchResultPosition=662
Bank losses hit Wall St.,"April 21, 2008",https://www.nytimes.com/2008/04/21/business/worldbusiness/21iht-21marketsfw.12190844.html?searchResultPosition=663
Singapore wealth fund defends stakes in Citigroup and UBS despite likelihood of recession,"April 21, 2008",https://www.nytimes.com/2008/04/21/business/worldbusiness/21iht-sovereign.1.12180972.html?searchResultPosition=664
Bank of America Profit Falls on Write-Downs,"April 21, 2008",https://www.nytimes.comhttps://dealbook.nytimes.com/2008/04/21/bank-of-americas-profit-drops-sharply-on-write-downs/?searchResultPosition=665
Bank of England Outlines Liquidity Plan,"April 22, 2008",https://www.nytimes.com/2008/04/22/business/worldbusiness/22boe.html?searchResultPosition=666
Banks Hunting for More Cash,"April 22, 2008",https://www.nytimes.com/2008/04/22/business/22bank.html?searchResultPosition=667
Samurai bonds flourish in global credit crisis,"April 22, 2008",https://www.nytimes.com/2008/04/22/business/worldbusiness/22iht-rbc.1.12221923.html?searchResultPosition=668
Banks racing to raise capital,"April 22, 2008",https://www.nytimes.com/2008/04/22/business/worldbusiness/22iht-bank.1.12216294.html?searchResultPosition=669
Royal Bank of Scotland seeks $24 billion from investors,"April 22, 2008",https://www.nytimes.com/2008/04/22/business/worldbusiness/22iht-rbs.4.12235956.html?searchResultPosition=670
Banks on the hunt for more cash,"April 22, 2008",https://www.nytimes.com/2008/04/22/business/worldbusiness/22iht-22bank.12215326.html?searchResultPosition=672
German banks rescue  lender after write-downs,"April 22, 2008",https://www.nytimes.com/2008/04/22/business/worldbusiness/22iht-gbank.4.12229795.html?searchResultPosition=673
Royal Bank of Scotland to raise £12 billion in rights issue,"April 22, 2008",https://www.nytimes.com/2008/04/22/business/worldbusiness/22iht-22rbs.12215804.html?searchResultPosition=674
UBS Officials Promise Changes at Bank,"April 23, 2008",https://www.nytimes.com/2008/04/23/business/worldbusiness/23cnd-ubs.html?searchResultPosition=676
Wall Street jittery over deal slowdown in Asia,"April 23, 2008",https://www.nytimes.com/2008/04/23/business/worldbusiness/23iht-rtrcol24.1.12262899.html?searchResultPosition=677
Germany investigates insider trading allegations at IKB,"April 23, 2008",https://www.nytimes.com/2008/04/23/business/worldbusiness/23iht-ikb.4.12276416.html?searchResultPosition=678
UBS to reel in investment banking business,"April 23, 2008",https://www.nytimes.com/2008/04/23/business/worldbusiness/23iht-ubs.4.12278593.html?searchResultPosition=679
"In Subprime Mess, a Bonanza of Billable Hours","April 23, 2008",https://www.nytimes.comhttps://dealbook.nytimes.com/2008/04/23/subprime-fallout-a-bonanza-of-billable-hours/?searchResultPosition=681
Credit Suisse Reports $2.1 Billion Loss,"April 24, 2008",https://www.nytimes.com/2008/04/24/business/worldbusiness/24suisse-web.html?searchResultPosition=682
UBS Vows Errant Unit Will Get Tighter Rein,"April 24, 2008",https://www.nytimes.com/2008/04/24/business/worldbusiness/24ubs.html?searchResultPosition=683
China Eases Trading Rules and Markets Soar,"April 24, 2008",https://www.nytimes.com/2008/04/24/business/24asiastox-web.html?searchResultPosition=684
Chinese stocks soar after cut in tax on trades,"April 24, 2008",https://www.nytimes.com/2008/04/24/business/worldbusiness/24iht-chistox.1.12304446.html?searchResultPosition=685
Credit Suisse writes off $5.3 billion,"April 24, 2008",https://www.nytimes.com/2008/04/24/business/worldbusiness/24iht-bank.1.12306652.html?searchResultPosition=686
Stocks soar in China as taxes on trades are cut,"April 24, 2008",https://www.nytimes.com/2008/04/24/business/worldbusiness/24iht-chistox.2.12310911.html?searchResultPosition=687
Chinese stocks soar after tax reduction,"April 24, 2008",https://www.nytimes.com/2008/04/24/business/worldbusiness/24iht-25stox.12303886.html?searchResultPosition=688
Bank of America Chief Rejects Calls to Dump Countrywide Deal,"April 24, 2008",https://www.nytimes.comhttps://dealbook.nytimes.com/2008/04/24/bank-of-america-chief-rejects-calls-to-dump-countrywide-deal/?searchResultPosition=690
Beijing’s Guiding Hand Sets Off a Market Rally,"April 25, 2008",https://www.nytimes.com/2008/04/25/business/worldbusiness/25yuan.html?searchResultPosition=691
Where the Fingers Are Pointing,"April 25, 2008",https://www.nytimes.com/2008/04/25/business/25norris.html?searchResultPosition=692
Government bonds tumble worldwide as inflation pressures mount,"April 25, 2008",https://www.nytimes.com/2008/04/25/business/worldbusiness/25iht-yen.4.12355240.html?searchResultPosition=693
Deflation fight may be over for Japan,"April 25, 2008",https://www.nytimes.com/2008/04/25/business/worldbusiness/25iht-yen.1.12340474.html?searchResultPosition=694
Where Was the Wise Man?,"April 27, 2008",https://www.nytimes.com/2008/04/27/business/27rubin.html?searchResultPosition=696
"Wall Street, Run Amok","April 27, 2008",https://www.nytimes.com/2008/04/27/business/27every.html?searchResultPosition=697
Where was the wise man?,"April 27, 2008",https://www.nytimes.com/2008/04/27/business/worldbusiness/27iht-27rubin.12367244.html?searchResultPosition=698
Where was Rubin when Citigroup went astray?,"April 27, 2008",https://www.nytimes.com/2008/04/27/business/worldbusiness/27iht-27rubin.12367776.html?searchResultPosition=699
Loan Industry Fighting Rules on Mortgages,"April 28, 2008",https://www.nytimes.com/2008/04/28/business/28mortgage.html?searchResultPosition=700
Daiwa Securities swings to a quarterly net loss in wake of credit crunch,"April 28, 2008",https://www.nytimes.com/2008/04/28/business/worldbusiness/28iht-daiwa.1.12394237.html?searchResultPosition=701
U.S. loan industry fights back against proposed mortgage rules,"April 28, 2008",https://www.nytimes.com/2008/04/28/business/worldbusiness/28iht-28mortgage.12386241.html?searchResultPosition=702
Crisis Catches Up to Deutsche Bank,"April 29, 2008",https://www.nytimes.com/2008/04/29/business/worldbusiness/29cnd-deutsche.html?searchResultPosition=703
"Junk Bonds, Mortgages and Milken","April 29, 2008",https://www.nytimes.com/2008/04/29/business/29sorkin.html?searchResultPosition=704
Losses at Deutsche Bank reflect depth of credit crisis,"April 29, 2008",https://www.nytimes.com/2008/04/29/business/worldbusiness/29iht-bank.4.12440904.html?searchResultPosition=705
'Junk bond king' deflects blame for credit crisis,"April 29, 2008",https://www.nytimes.com/2008/04/29/business/worldbusiness/29iht-deal30.1.12424148.html?searchResultPosition=706
Bush presses Congress on economy,"April 29, 2008",https://www.nytimes.com/2008/04/29/business/worldbusiness/29iht-29econ.12435737.html?searchResultPosition=707
Deutsche Bank posts first loss in five years,"April 29, 2008",https://www.nytimes.com/2008/04/29/business/worldbusiness/29iht-bank.1.12426945.html?searchResultPosition=708
BlackRock’s Chief Gets a 27% Pay Lift,"April 29, 2008",https://www.nytimes.comhttps://dealbook.nytimes.com/2008/04/29/blackrocks-chief-gets-a-27-pay-lift/?searchResultPosition=709
Don’t Blame Milken for the Mortgage Crisis,"April 29, 2008",https://www.nytimes.comhttps://dealbook.nytimes.com/2008/04/29/dont-blame-milken-for-the-mortgage-crisis/?searchResultPosition=710
The Road to a Jumbo Mortgage Was Supposed to Get Easier,"April 30, 2008",https://www.nytimes.com/2008/04/30/business/30jumbo.html?searchResultPosition=711
"Fed Cuts Rates by a Quarter Point, and It Signals a Pause","April 30, 2008",https://www.nytimes.com/2008/04/30/business/30fed-web.html?searchResultPosition=712
"Deutsche Bank Posts Quarterly Loss, Evidence of the Reach of the Financial Crisis","April 30, 2008",https://www.nytimes.com/2008/04/30/business/worldbusiness/30deutsche.html?searchResultPosition=713
Deutsche Bank Reports Quarterly Loss,"April 30, 2008",https://www.nytimes.com/2008/04/30/business/worldbusiness/29cnd-deutsche.html?searchResultPosition=714
"Fed cuts rate by a quarter point, to 2%","April 30, 2008",https://www.nytimes.com/2008/04/30/business/worldbusiness/30iht-30fedweb.12464693.html?searchResultPosition=715
Exports help U.S. economy to modest growth,"April 30, 2008",https://www.nytimes.com/2008/04/30/business/worldbusiness/30iht-30econ.12458489.html?searchResultPosition=716
Agency Floats a Proposal to Help With Home Loans,"May 1, 2008",https://www.nytimes.com/2008/05/01/business/01housing.html?searchResultPosition=717
British Bank Offers an Optimistic Outlook,"May 1, 2008",https://www.nytimes.com/2008/05/01/business/worldbusiness/01boe-web.html?searchResultPosition=718
British central bank suggests credit crisis is easing,"May 1, 2008",https://www.nytimes.com/2008/05/01/business/worldbusiness/01iht-credit.12481711.html?searchResultPosition=719
France wants U.S. help to pressure China on currency,"May 1, 2008",https://www.nytimes.com/2008/05/01/business/worldbusiness/01iht-fiscal.4.12497636.html?searchResultPosition=722
Fed Takes Steps to Add Liquidity,"May 2, 2008",https://www.nytimes.com/2008/05/02/business/02cnd-fed.html?searchResultPosition=723
"In Tougher Times, Carlyle Looks Abroad","May 2, 2008",https://www.nytimes.com/2008/05/02/business/worldbusiness/02carlyle.html?searchResultPosition=724
Fed takes steps to add liquidity,"May 2, 2008",https://www.nytimes.com/2008/05/02/business/worldbusiness/02iht-fed.4.12527903.html?searchResultPosition=725
Bernake Suggests Congress Review Student Lender Subsidies,"May 2, 2008",https://www.nytimes.comhttps://dealbook.nytimes.com/2008/05/02/bernake-suggests-congress-review-student-lender-subsidies/?searchResultPosition=726
A Government Risk-Management Panel?,"May 2, 2008",https://www.nytimes.comhttps://dealbook.nytimes.com/2008/05/02/a-government-risk-management-panel/?searchResultPosition=728
Fed Moves to Loosen Tight Credit,"May 3, 2008",https://www.nytimes.com/2008/05/03/business/03fed.html?searchResultPosition=729
A Lender Gets Caught in the Currents,"May 4, 2008",https://www.nytimes.com/2008/05/04/business/04cit.html?searchResultPosition=730
Chief of CIT defends expansion,"May 4, 2008",https://www.nytimes.com/2008/05/04/business/worldbusiness/04iht-cit.1.12545867.html?searchResultPosition=731
"Task Force to Probe Wall Street Firms and Lenders, Report Says","May 5, 2008",https://www.nytimes.comhttps://dealbook.nytimes.com/2008/05/05/task-force-to-probe-wall-street-firms-and-lenders-report-says/?searchResultPosition=732
Bernanke Urges Flexibility in Mortgage Regulation,"May 6, 2008",https://www.nytimes.com/2008/05/06/business/06fed.html?searchResultPosition=733
Bernanke urges Congress to help stem foreclosures,"May 6, 2008",https://www.nytimes.com/2008/05/06/business/worldbusiness/06iht-06fed.12595394.html?searchResultPosition=734
"UBS to cut 5,500 jobs after first-quarter loss","May 6, 2008",https://www.nytimes.com/2008/05/06/business/worldbusiness/06iht-6ubsfw.12602736.html?searchResultPosition=735
"Behind Bear Stearns' demise, a royal battle at the top","May 6, 2008",https://www.nytimes.com/2008/05/06/business/worldbusiness/06iht-bear.4.12623360.html?searchResultPosition=737
"UBS to Cut Jobs, Sell Mortgages After Big Loss","May 6, 2008",https://www.nytimes.comhttps://dealbook.nytimes.com/2008/05/06/ubs-to-cut-5500-jobs-sell-mortgage-assets-after-109-billion-loss/?searchResultPosition=738
"Merrill Doesn’t Need More Capital, Chief Says","May 6, 2008",https://www.nytimes.comhttps://dealbook.nytimes.com/2008/05/06/merrill-doesnt-need-more-capital-chief-says/?searchResultPosition=739
Fannie Mae to Raise $6 Billion After Loss,"May 6, 2008",https://www.nytimes.comhttps://dealbook.nytimes.com/2008/05/06/fannie-mae-to-raise-6-billion-after-loss/?searchResultPosition=740
"UBS Announces $10.9 Billion Loss, Job Cuts, and Tax Probe","May 7, 2008",https://www.nytimes.com/2008/05/07/business/worldbusiness/07ubs.html?searchResultPosition=741
Fannie Mae Wins Cheers Despite Loss,"May 7, 2008",https://www.nytimes.com/2008/05/07/business/07fannie.html?searchResultPosition=742
Fed president warns of inflation's dangers,"May 7, 2008",https://www.nytimes.com/2008/05/07/business/worldbusiness/07iht-07fed.12638966.html?searchResultPosition=743
Commerzbank warns it may miss profit target,"May 7, 2008",https://www.nytimes.com/2008/05/07/business/worldbusiness/07iht-commerz.4.12663146.html?searchResultPosition=745
Asian Finance Bank plans to set up bank in Indonesia and a $500 million property fund,"May 7, 2008",https://www.nytimes.com/2008/05/07/business/worldbusiness/07iht-fund.1.12643743.html?searchResultPosition=746
Fannie Mae wins cheers despite loss,"May 7, 2008",https://www.nytimes.com/2008/05/07/business/worldbusiness/07iht-07fannie.12635085.html?searchResultPosition=747
A Feud in the Bear Stearns Family,"May 7, 2008",https://www.nytimes.comhttps://dealbook.nytimes.com/2008/05/07/a-feud-in-the-bear-stearns-family/?searchResultPosition=748
"UBS Faces Tax Probe, Amid Other Woes","May 7, 2008",https://www.nytimes.comhttps://dealbook.nytimes.com/2008/05/07/ubs-faces-tax-probe-amid-other-woes/?searchResultPosition=749
Wave of Lawsuits Over Losses Could Hit a Wall,"May 8, 2008",https://www.nytimes.com/2008/05/08/business/08legal.html?searchResultPosition=750
BlackRock Is Fix-It Firm to Manage Risky Assets of Others in Distress,"May 8, 2008",https://www.nytimes.com/2008/05/08/business/08blackrock.html?searchResultPosition=752
Lawsuits over losses in mortgage market could hit a wall,"May 8, 2008",https://www.nytimes.com/2008/05/08/business/worldbusiness/08iht-housing.1.12686379.html?searchResultPosition=753
Lawsuits over losses in U.S. mortgage market could hit a wall,"May 8, 2008",https://www.nytimes.com/2008/05/08/business/worldbusiness/08iht-housing.4.12699368.html?searchResultPosition=754
BlackRock: the Mr. Fix-it of Wall Street,"May 8, 2008",https://www.nytimes.com/2008/05/08/business/worldbusiness/08iht-blackrock.4.12714551.html?searchResultPosition=755
BlackRock to the Rescue,"May 8, 2008",https://www.nytimes.comhttps://dealbook.nytimes.com/2008/05/08/blackrock-is-fix-it-firm-to-manage-risky-assets-of-others-in-distress/?searchResultPosition=758
Bad Investments and a $7.8 Billion Loss at A.I.G.,"May 9, 2008",https://www.nytimes.com/2008/05/09/business/09insure.html?searchResultPosition=759
AIG dampens sentiment on Wall St.,"May 9, 2008",https://www.nytimes.com/2008/05/09/business/worldbusiness/09iht-09marketsafw.12738401.html?searchResultPosition=760
AIG reports a $7.8 billion loss in quarter,"May 9, 2008",https://www.nytimes.com/2008/05/09/business/worldbusiness/09iht-09insure.12722961.html?searchResultPosition=761
Schwarzman’s Atomic Bomb Comment Sparks Chatter,"May 9, 2008",https://www.nytimes.comhttps://dealbook.nytimes.com/2008/05/09/schwarzmans-atomic-bomb-comment-sparks-chatter/?searchResultPosition=763
"Losing a Home, Then Losing All Out of Storage","May 11, 2008",https://www.nytimes.com/2008/05/11/business/11storage.html?searchResultPosition=764
"Positive GDP reports expected, but signs of weakening ahead","May 11, 2008",https://www.nytimes.com/2008/05/11/business/worldbusiness/11iht-rtrecon12.1.12765328.html?searchResultPosition=765
"Losing a home, then everything else in storage","May 11, 2008",https://www.nytimes.com/2008/05/11/business/worldbusiness/11iht-11storage.12763887.html?searchResultPosition=766
Westpac seeks deal to create largest Australian bank,"May 12, 2008",https://www.nytimes.com/2008/05/12/business/worldbusiness/12iht-bank.1.12799802.html?searchResultPosition=767
HSBC says U.S. recession is 'increasingly likely',"May 12, 2008",https://www.nytimes.com/2008/05/12/business/worldbusiness/12iht-hsbc.4.12815983.html?searchResultPosition=768
U.S. shares gain as crude price slips,"May 12, 2008",https://www.nytimes.com/2008/05/12/business/worldbusiness/12iht-12marketsfw.12803335.html?searchResultPosition=769
Credit crisis delays opening of U.S. auto plant,"May 12, 2008",https://www.nytimes.com/2008/05/12/business/worldbusiness/12iht-12plant.12796288.html?searchResultPosition=770
"Profit up in first quarter, HSBC says","May 12, 2008",https://www.nytimes.com/2008/05/12/business/worldbusiness/12iht-hsbc.1.12798022.html?searchResultPosition=771
Toyota considers Shariah bond to help Malaysian business,"May 12, 2008",https://www.nytimes.com/2008/05/12/business/worldbusiness/12iht-bond.1.12796265.html?searchResultPosition=772
HSBC Says 1Q Profit Up Despite $3.2 Billion Write-Down,"May 12, 2008",https://www.nytimes.comhttps://dealbook.nytimes.com/2008/05/12/hsbc-says-1q-profit-up-despite-32-billion-write-down/?searchResultPosition=773
MBIA Posts $2.4 Billion Loss for 1st Quarter,"May 12, 2008",https://www.nytimes.comhttps://dealbook.nytimes.com/2008/05/12/mbia-posts-24-billion-loss-for-1st-quarter/?searchResultPosition=774
"Oil Prices Slide, and Wall Street Cheers","May 13, 2008",https://www.nytimes.com/2008/05/13/business/13stox.html?searchResultPosition=775
Former Chief Tells Board That A.I.G. Is in ‘Crisis’,"May 13, 2008",https://www.nytimes.com/2008/05/13/business/13aig.html?searchResultPosition=776
"For HSBC, Asia Offsets Loan Problems in the U. S.","May 13, 2008",https://www.nytimes.com/2008/05/13/business/worldbusiness/13bank.html?searchResultPosition=777
"Bloomberg L.P. Fills Post, Suggesting Shift to News","May 13, 2008",https://www.nytimes.com/2008/05/13/business/media/13bloomberg.html?searchResultPosition=778
Today in Business,"May 13, 2008",https://www.nytimes.com/2008/05/13/business/13biztoday.html?searchResultPosition=779
Maurice Greenberg tells board that AIG is in 'crisis',"May 13, 2008",https://www.nytimes.com/2008/05/13/business/worldbusiness/13iht-13aig.12829617.html?searchResultPosition=780
Norman Pearlstine named chief content officer of Bloomberg,"May 13, 2008",https://www.nytimes.com/2008/05/13/business/worldbusiness/13iht-13bloomberg.12830408.html?searchResultPosition=781
Société Générale profit falls; Crédit Agricole seeks capital,"May 13, 2008",https://www.nytimes.com/2008/05/13/business/worldbusiness/13iht-socgen.4.12855701.html?searchResultPosition=782
Former Chief Tells Board That A.I.G. Is in a Crisis,"May 13, 2008",https://www.nytimes.comhttps://dealbook.nytimes.com/2008/05/13/former-chief-tells-board-that-aig-is-in-crisis/?searchResultPosition=783
BNP net drops 21% on 'violent' conditions,"May 14, 2008",https://www.nytimes.com/2008/05/14/business/worldbusiness/14iht-13BNP.12868943.html?searchResultPosition=784
French housing holds steady in face of subprime crisis,"May 14, 2008",https://www.nytimes.com/2008/05/14/business/worldbusiness/14iht-house.4.12883170.html?searchResultPosition=785
ING Reports Drop in First-Quarter Proift,"May 14, 2008",https://www.nytimes.comhttps://dealbook.nytimes.com/2008/05/14/ing-reports-drop-in-first-quarter-proift/?searchResultPosition=786
Crédit Agricole to sell assets and restructure Calyon investment banking arm,"May 15, 2008",https://www.nytimes.com/2008/05/15/business/worldbusiness/15iht-15agricole.12909137.html?searchResultPosition=787
A Values Debate (Not the Political Kind),"May 16, 2008",https://www.nytimes.com/2008/05/16/business/16place.html?searchResultPosition=788
How much are some investments really worth?,"May 16, 2008",https://www.nytimes.com/2008/05/16/business/worldbusiness/16iht-16place.12947529.html?searchResultPosition=789
Banks finding it tough to shake off subprime hangover,"May 18, 2008",https://www.nytimes.com/2008/05/18/business/worldbusiness/18iht-rtrinvest19.1.12983315.html?searchResultPosition=790
U.S. stocks slip on fears of more bank write-downs,"May 20, 2008",https://www.nytimes.com/2008/05/20/business/worldbusiness/20iht-20marketsfw.13053426.html?searchResultPosition=792
Warning scares off Macquarie shareholders,"May 20, 2008",https://www.nytimes.com/2008/05/20/business/worldbusiness/20iht-bank.2.13049664.html?searchResultPosition=793
Mitsubishi UFJ posts 71 percent profit rise,"May 20, 2008",https://www.nytimes.com/2008/05/20/business/worldbusiness/20iht-mufj.1.13044095.html?searchResultPosition=794
"While the Economy Struggles, Profits Can Be Made","May 21, 2008",https://www.nytimes.com/2008/05/21/business/smallbusiness/21Thrive.html?searchResultPosition=795
French finance minister calls for realignment of currencies,"May 21, 2008",https://www.nytimes.com/2008/05/21/business/worldbusiness/21iht-franc.4.13101475.html?searchResultPosition=796
Singapore real estate totters at a precipice,"May 21, 2008",https://www.nytimes.com/2008/05/21/business/worldbusiness/21iht-rtrinvest22.1.13079268.html?searchResultPosition=797
