Title,Date,Link
The Welcome Mat Is Out...,"Feb. 18, 2006",https://www.nytimes.com/2006/02/18/business/the-welcome-mat-is-out.html?searchResultPosition=1
Take Comfort in Mixed Signals,"Nov. 26, 2006",https://www.nytimes.com/2006/11/26/business/yourmoney/take-comfort-in-mixed-signals.html?searchResultPosition=2
Subprime Loans Going From Boon to Housing Bane,"Dec. 6, 2006",https://www.nytimes.com/2006/12/06/business/subprime-loans-going-from-boon-to-housing-bane.html?searchResultPosition=4
Study Predicts Foreclosure for 1 in 5 Subprime Loans,"Dec. 20, 2006",https://www.nytimes.com/2006/12/20/business/20home.html?searchResultPosition=5
Tremors at the Door for Subprime Mortgage Lenders,"Jan. 26, 2007",https://www.nytimes.comhttps://dealbook.nytimes.com/2007/01/26/tremors-at-the-door-for-subprime-mortgage-lenders/?searchResultPosition=7
Rising default rates hitting subprime mortgage industry hard - Business - International Herald Tribune,"Feb. 22, 2007",https://www.nytimes.com/2007/02/22/business/worldbusiness/22iht-credit.4684818.html?searchResultPosition=8
Home Lenders Hit by Higher Default Rates,"Feb. 22, 2007",https://www.nytimes.com/2007/02/22/business/22lend.html?searchResultPosition=9
Freddie Mac Toughens Policy on Risky Mortgages,"Feb. 27, 2007",https://www.nytimes.com/2007/02/27/business/28freddie.web.html?searchResultPosition=10
Subprime Mortgages May Still Haunt the Street,"March 1, 2007",https://www.nytimes.comhttps://dealbook.nytimes.com/2007/03/01/calm-returns-to-the-street-but-another-storm-is-brewing/?searchResultPosition=11
Mortgages May Be Messier Than You Think,"March 4, 2007",https://www.nytimes.com/2007/03/04/business/yourmoney/04gret.html?searchResultPosition=12
"Mortgage Crisis Spirals, and Casualties Mount","March 5, 2007",https://www.nytimes.com/2007/03/05/business/05lender.html?searchResultPosition=13
"The home mortgage crisis spirals, taking a toll in the U.S.","March 5, 2007",https://www.nytimes.com/2007/03/05/business/worldbusiness/05iht-mortgage.4799541.html?searchResultPosition=14
"Investors Get a Break, but Some Lenders Absorb Blows","March 10, 2007",https://www.nytimes.com/2007/03/10/business/10five.html?searchResultPosition=16
Crisis Looms in Market for Mortgages,"March 11, 2007",https://www.nytimes.com/2007/03/11/business/11mortgage.html?searchResultPosition=17
"This Time, the Turbulence May Last Awhile","March 11, 2007",https://www.nytimes.com/2007/03/11/business/yourmoney/11fund.html?searchResultPosition=18
Lender Faces Credit Crisis With Banks,"March 13, 2007",https://www.nytimes.com/2007/03/13/business/13lend.html?searchResultPosition=19
Mortgage lender in need of loan,"March 13, 2007",https://www.nytimes.com/2007/03/13/business/worldbusiness/13iht-mortgage.4891782.html?searchResultPosition=20
Loan defaults add to meltdown for U.S. mortgage lenders,"March 13, 2007",https://www.nytimes.com/2007/03/13/business/worldbusiness/13iht-mortgage.4898877.html?searchResultPosition=21
Bad Loans Put Wall St. in a Swoon,"March 14, 2007",https://www.nytimes.com/2007/03/14/business/14lend.html?searchResultPosition=23
Asia and Europe Stocks Follow Wall Street,"March 14, 2007",https://www.nytimes.com/2007/03/14/business/worldbusiness/14cnd-stox.html?searchResultPosition=24
Fears over loose lending jolt global markets,"March 14, 2007",https://www.nytimes.com/2007/03/14/business/worldbusiness/14iht-stocks.4909278.html?searchResultPosition=25
Stocks in Asia and Europe drop after Wall St. losses,"March 14, 2007",https://www.nytimes.com/2007/03/14/business/worldbusiness/14iht-web-0314stocks.4903391.html?searchResultPosition=26
Fears over U.S. lending jolt global markets,"March 14, 2007",https://www.nytimes.com/2007/03/14/business/worldbusiness/14iht-stocks.4911399.html?searchResultPosition=27
Wall Street Rebounds After Asian Stocks Plunge,"March 15, 2007",https://www.nytimes.com/2007/03/15/business/worldbusiness/15asiacnd3.html?searchResultPosition=28
Sale of H&R Block Loan Division May Experience Turbulence,"March 15, 2007",https://www.nytimes.comhttps://dealbook.nytimes.com/2007/03/15/sale-of-hr-block-loan-division-may-experience-turbulence/?searchResultPosition=29
Fickle Investors Bobbing in Sea of Subprime Loans,"March 17, 2007",https://www.nytimes.com/2007/03/17/business/17five.html?searchResultPosition=30
Fannie Mae Ends Purchases of Loans by New Century,"March 21, 2007",https://www.nytimes.com/2007/03/21/business/21lend.html?searchResultPosition=33
South Korean subprime lending is shrinking,"March 21, 2007",https://www.nytimes.com/2007/03/21/business/worldbusiness/21iht-mortgage.4977548.html?searchResultPosition=34
Hedge Fund Lends a Hand to Accredited Home,"March 21, 2007",https://www.nytimes.comhttps://dealbook.nytimes.com/2007/03/21/hedge-fund-lends-a-hand-to-accredited-home/?searchResultPosition=35
U.S. bank regulator admits some fault in mortgage crisis,"March 22, 2007",https://www.nytimes.com/2007/03/22/business/worldbusiness/22iht-mortgage.4998270.html?searchResultPosition=36
The Blame Game,"March 23, 2007",https://www.nytimes.comhttps://economix.blogs.nytimes.com/2007/03/23/the-blame-game/?searchResultPosition=37
Morgan Stanley to Sell Subprime Lender’s Loans,"March 27, 2007",https://www.nytimes.com/2007/03/27/business/27lend.html?searchResultPosition=38
Deal Makers Are Setting a Torrid Pace for 2007,"March 30, 2007",https://www.nytimes.com/2007/03/30/business/30deal.html?searchResultPosition=39
"Homeowners, Call Your Bankers Before They Call You","March 31, 2007",https://www.nytimes.com/2007/03/31/business/31money.html?searchResultPosition=40
"Another Fine Mess, Born of Excess","April 8, 2007",https://www.nytimes.com/2007/04/08/business/mutfund/08essa.html?searchResultPosition=41
Defaults Rise in Next Level of Mortgages,"April 10, 2007",https://www.nytimes.com/2007/04/10/business/10lend.html?searchResultPosition=42
U.S. subprime problems spill over to safer mortgages,"April 10, 2007",https://www.nytimes.com/2007/04/10/business/worldbusiness/10iht-mortgage.1.5209731.html?searchResultPosition=43
Realtors Expect Home Prices to Show First Annual Decline,"April 12, 2007",https://www.nytimes.com/2007/04/12/business/12realtors.html?searchResultPosition=44
Senate Democrats call for home-loan bailouts,"April 12, 2007",https://www.nytimes.com/2007/04/12/business/worldbusiness/12iht-housing.1.5246698.html?searchResultPosition=45
Recession Pessimism,"April 12, 2007",https://www.nytimes.comhttps://economix.blogs.nytimes.com/2007/04/12/recession-pessimism/?searchResultPosition=46
U.S. high court limits state control of national banks,"April 17, 2007",https://www.nytimes.com/2007/04/17/business/worldbusiness/17iht-mortgage.4.5320935.html?searchResultPosition=47
A Warning on Derivatives,"April 18, 2007",https://www.nytimes.comhttps://economix.blogs.nytimes.com/2007/04/18/a-warning-on-derivatives/?searchResultPosition=48
Mortgages’ Mystery: The Losses,"April 22, 2007",https://www.nytimes.com/2007/04/22/business/yourmoney/22gret.html?searchResultPosition=49
East Coast Money Lent Out West,"May 8, 2007",https://www.nytimes.com/2007/05/08/business/08lend.html?searchResultPosition=50
Fed Chairman Sees Mortgage Damage as Limited,"May 18, 2007",https://www.nytimes.com/2007/05/18/business/18fed-web.html?searchResultPosition=53
Beware of Exploding Mortgages,"June 10, 2007",https://www.nytimes.com/2007/06/10/business/yourmoney/10gret.html?searchResultPosition=54
"U.S. subprime woes could hurt Swiss banks, report says","June 14, 2007",https://www.nytimes.com/2007/06/14/business/worldbusiness/14iht-swiss.4.6143091.html?searchResultPosition=55
More Trouble in Subprime Mortgages,"June 15, 2007",https://www.nytimes.com/2007/06/15/business/15mortgage.html?searchResultPosition=56
Mortgages Give Wall St. New Worries,"June 19, 2007",https://www.nytimes.com/2007/06/19/business/19mortgage.html?searchResultPosition=57
"New Homes Construction Declined 2.1% in May, as Expected","June 20, 2007",https://www.nytimes.com/2007/06/20/business/20econ.html?searchResultPosition=58
$3.2 Billion Move by Bear Stearns to Rescue Fund,"June 23, 2007",https://www.nytimes.com/2007/06/23/business/23bond.html?searchResultPosition=59
Bear Stearns in $3.2 billion bailout of fund,"June 23, 2007",https://www.nytimes.com/2007/06/23/business/worldbusiness/23iht-bear.1.6295771.html?searchResultPosition=60
Bear Stearns fund chief struggles to fend off the 'Persian Hordes',"June 28, 2007",https://www.nytimes.com/2007/06/28/business/worldbusiness/28iht-hedge.1.6377607.html?searchResultPosition=61
Bear Stearns fund chief struggles to fend off the 'hordes',"June 28, 2007",https://www.nytimes.com/2007/06/28/business/worldbusiness/28iht-hedge.4.6397703.html?searchResultPosition=62
Bear Stearns chief weathers the storm,"June 29, 2007",https://www.nytimes.com/2007/06/29/business/worldbusiness/29iht-fund.4.6418776.html?searchResultPosition=63
Will Subprime Rules Bring Lower Prices?,"June 29, 2007",https://www.nytimes.comhttps://economix.blogs.nytimes.com/2007/06/29/will-subprime-rules-bring-lower-prices/?searchResultPosition=64
U.S. Tightens Rules on Subprime Mortgages,"June 30, 2007",https://www.nytimes.com/2007/06/30/business/30mortgage.html?searchResultPosition=65
A False Sense of Security? You Must Own a Home,"July 1, 2007",https://www.nytimes.com/2007/07/01/business/yourmoney/01view.html?searchResultPosition=66
"Posing as rescuers, companies prey on struggling homeowners","July 3, 2007",https://www.nytimes.com/2007/07/03/business/worldbusiness/03iht-fraud.1.6461625.html?searchResultPosition=67
Banking Regulators to Increase Scrutiny of Subprime Lenders,"July 18, 2007",https://www.nytimes.com/2007/07/18/business/18mortgage.html?searchResultPosition=68
Subprime Woes Rock Australian Hedge Fund,"July 19, 2007",https://www.nytimes.comhttps://dealbook.nytimes.com/2007/07/19/subprime-woes-rock-australian-hedge-fund/?searchResultPosition=69
Debt Market Is Squeezing Private Equity,"July 21, 2007",https://www.nytimes.com/2007/07/21/business/21debt.html?searchResultPosition=70
Mr. Vranos Has a Deal for You,"July 22, 2007",https://www.nytimes.com/2007/07/22/business/yourmoney/22gret.html?searchResultPosition=74
Is G.E. Too Big for Its Own Good?,"July 22, 2007",https://www.nytimes.com/2007/07/22/business/yourmoney/22ge.html?searchResultPosition=75
Daimler Says Snag Won’t Halt Sale,"July 25, 2007",https://www.nytimes.com/2007/07/25/business/25cnd-auto.html?searchResultPosition=76
Chrysler Deal in a Struggle for Financing,"July 26, 2007",https://www.nytimes.com/2007/07/26/business/26auto.html?searchResultPosition=77
Stocks Slide on Growth and Lending Worries,"July 26, 2007",https://www.nytimes.com/2007/07/26/business/26cnd-substox.html?searchResultPosition=78
Asian Stocks Fall Sharply After U.S. Sell-Off,"July 27, 2007",https://www.nytimes.com/2007/07/27/business/worldbusiness/27cnd-asiastox.html?searchResultPosition=79
Stock markets in Asia suffer from Wall Street contagion,"July 27, 2007",https://www.nytimes.com/2007/07/27/business/worldbusiness/27iht-stocks.1.6862928.html?searchResultPosition=80
"On Wall Street, Hiring Spree Meets Credit Crunch","July 30, 2007",https://www.nytimes.comhttps://dealbook.nytimes.com/2007/07/30/on-wall-street-hiring-spree-meets-credit-crunch/?searchResultPosition=81
German Lender Hit by U.S. Subprime Woes,"July 31, 2007",https://www.nytimes.com/2007/07/31/business/reuters-subprime.html?searchResultPosition=82
More Lenders Feeling Pain From Defaults,"July 31, 2007",https://www.nytimes.com/2007/07/31/business/31subprime.html?searchResultPosition=83
U.S. subprime losses leave German state-owned bank with €8.1 billion charge,"July 31, 2007",https://www.nytimes.com/2007/07/31/business/worldbusiness/31iht-ikb.5.6928245.html?searchResultPosition=84
U.S. mortgage troubles extend to Germany,"July 31, 2007",https://www.nytimes.com/2007/07/31/business/worldbusiness/31iht-mortgage.1.6911330.html?searchResultPosition=85
German Bank Suffers from Mortgage Market Troubles,"July 31, 2007",https://www.nytimes.comhttps://dealbook.nytimes.com/2007/07/31/german-banks-mortgage-problems-spark-fears-in-europe/?searchResultPosition=86
American Home Collapses,"July 31, 2007",https://www.nytimes.comhttps://economix.blogs.nytimes.com/2007/07/31/american-home-collapses/?searchResultPosition=87
U.S. mortgage crisis hits Pacific Rim markets,"Aug. 1, 2007",https://www.nytimes.com/2007/08/01/business/worldbusiness/01iht-stocks.5.6947239.html?searchResultPosition=88
Ripple effects from U.S. mortgage crisis hit Pacific Rim,"Aug. 1, 2007",https://www.nytimes.com/2007/08/01/business/worldbusiness/01iht-stocks.4.6943426.html?searchResultPosition=89
Germany: Unit Gives Bank a Lift,"Aug. 2, 2007",https://www.nytimes.com/2007/08/02/business/worldbusiness/02fobriefs-UNITGIVESBAN_BRF.html?searchResultPosition=90
Charles Prince says Citibank will keep moving despite market pullback,"Aug. 2, 2007",https://www.nytimes.com/2007/08/02/business/worldbusiness/02iht-citi.4.6962026.html?searchResultPosition=91
Asia sees 'realignment' of risk in response to U.S. subprime woes,"Aug. 2, 2007",https://www.nytimes.com/2007/08/02/business/worldbusiness/02iht-subprime.1.6954657.html?searchResultPosition=92
Bundesbank chief seeks to calm fears of banking crisis in Germany,"Aug. 2, 2007",https://www.nytimes.com/2007/08/02/business/worldbusiness/02iht-gbank.4.6961900.html?searchResultPosition=93
Credit Suisse’s Profits Rise 48 Percent,"Aug. 2, 2007",https://www.nytimes.comhttps://dealbook.nytimes.com/2007/08/02/credit-suisses-profits-rise-48-percent/?searchResultPosition=94
European Banks Report Strong Second Quarters,"Aug. 3, 2007",https://www.nytimes.com/2007/08/03/business/worldbusiness/03bank.html?searchResultPosition=95
"Without Cash, Instant Profits Were No Help","Aug. 3, 2007",https://www.nytimes.com/2007/08/03/business/03norris.html?searchResultPosition=96
Is the Dance Over? Citigroup Is Upbeat,"Aug. 3, 2007",https://www.nytimes.com/2007/08/03/business/03citi.html?searchResultPosition=97
Shockwaves continue to rattle German banks after IKB bailout,"Aug. 3, 2007",https://www.nytimes.com/2007/08/03/business/worldbusiness/03iht-gbank.4.6978701.html?searchResultPosition=98
"Mortgage crisis unlikely to upset the broader U.S. economy, Treasury official says","Aug. 3, 2007",https://www.nytimes.com/2007/08/03/business/worldbusiness/03iht-apec.1.6971595.html?searchResultPosition=99
A Volatile Week Ends With a Thud,"Aug. 5, 2007",https://www.nytimes.com/2007/08/05/business/yourmoney/05data.html?searchResultPosition=103
Bear Stearns Ousts a Top Executive,"Aug. 5, 2007",https://www.nytimes.com/2007/08/05/business/05cnd-bear.html?searchResultPosition=104
Mortgage Mania Didn’t Grip Everyone,"Aug. 5, 2007",https://www.nytimes.com/2007/08/05/business/yourmoney/05gret.html?searchResultPosition=105
The Search for Nuance From the Fed,"Aug. 5, 2007",https://www.nytimes.com/2007/08/05/business/yourmoney/05mark.html?searchResultPosition=106
A Top Official at Bear Stearns Ousted,"Aug. 6, 2007",https://www.nytimes.com/2007/08/06/business/06bear.html?searchResultPosition=107
"Fallout from U.S. subprime market widens, costing the job of a top banker","Aug. 6, 2007",https://www.nytimes.com/2007/08/06/business/worldbusiness/06iht-mortgage.4.7005463.html?searchResultPosition=108
"Crisis in global markets widens, costing the job of a top banker","Aug. 6, 2007",https://www.nytimes.com/2007/08/06/business/worldbusiness/06iht-mortgage.1.6997088.html?searchResultPosition=109
Credit crisis fells top Bear Stearns official,"Aug. 6, 2007",https://www.nytimes.com/2007/08/06/business/worldbusiness/06iht-06bear.6995550.html?searchResultPosition=110
Germany Looks Into Subprime Fallout at IKB,"Aug. 6, 2007",https://www.nytimes.comhttps://dealbook.nytimes.com/2007/08/06/germany-looks-into-subprime-fallout-at-ikb/?searchResultPosition=112
Top Official at Bear Stearns Is Ousted,"Aug. 6, 2007",https://www.nytimes.comhttps://dealbook.nytimes.com/2007/08/06/top-official-at-bear-stearns-is-ousted/?searchResultPosition=113
"In Germany, U.S. subprime fallout blamed","Aug. 7, 2007",https://www.nytimes.com/2007/08/07/business/worldbusiness/07iht-gcon.4.7024717.html?searchResultPosition=114
Bush Faults Easy Money for Volatility,"Aug. 9, 2007",https://www.nytimes.com/2007/08/09/business/09econ.html?searchResultPosition=115
Dow Falls 387 Points on New Loan Fears,"Aug. 9, 2007",https://www.nytimes.com/2007/08/09/business/09cnd-stox.html?searchResultPosition=116
BNP Paribas freezes funds over subprime plunge,"Aug. 9, 2007",https://www.nytimes.com/2007/08/09/business/worldbusiness/09iht-bnp.2.7057529.html?searchResultPosition=117
"BNP suspends funds, as ECB makes emergency loans","Aug. 9, 2007",https://www.nytimes.com/2007/08/09/business/worldbusiness/09iht-10bankweb.7059063.html?searchResultPosition=118
U.S. stocks tumble after European sell-off,"Aug. 9, 2007",https://www.nytimes.com/2007/08/09/business/worldbusiness/09iht-09cndstox.7065891.html?searchResultPosition=119
Bush calls recent market turmoil a natural adjustment,"Aug. 9, 2007",https://www.nytimes.com/2007/08/09/business/worldbusiness/09iht-usecon.1.7055627.html?searchResultPosition=121
Stocks tumble as French bank reacts to home loan worries,"Aug. 9, 2007",https://www.nytimes.com/2007/08/09/business/worldbusiness/09iht-10banks.7059798.html?searchResultPosition=123
Bush seeks to reassure amid market turbulence,"Aug. 9, 2007",https://www.nytimes.com/2007/08/09/business/worldbusiness/09iht-usecon.3.7059952.html?searchResultPosition=124
Credit crisis puts global finance to test,"Aug. 9, 2007",https://www.nytimes.com/2007/08/09/business/worldbusiness/09iht-liquidity.5.7062607.html?searchResultPosition=125
Europe slammed by U.S. credit crisis,"Aug. 9, 2007",https://www.nytimes.com/2007/08/09/business/worldbusiness/09iht-subprime.5.7062710.html?searchResultPosition=126
Paribas Freezes Funds as Subprime Woes Keep Spreading,"Aug. 9, 2007",https://www.nytimes.comhttps://dealbook.nytimes.com/2007/08/09/bnp-paribas-freezes-funds-on-subprime-woes/?searchResultPosition=127
Stocks Tumble as French Bank  Reacts to Home Loan Worries,"Aug. 10, 2007",https://www.nytimes.com/2007/08/10/business/worldbusiness/10bank-web.html?searchResultPosition=128
Mortgage Losses Echo in Europe and on Wall Street,"Aug. 10, 2007",https://www.nytimes.com/2007/08/10/business/10markets.html?searchResultPosition=129
Shaky Markets Prompt Rumors of Who’s in Trouble,"Aug. 10, 2007",https://www.nytimes.com/2007/08/10/business/10subprime.html?searchResultPosition=130
Big French Bank Suspends Funds,"Aug. 10, 2007",https://www.nytimes.com/2007/08/10/business/worldbusiness/09cnd-eurobank.html?searchResultPosition=131
Are European regulators too laissez-faire amid crisis?,"Aug. 10, 2007",https://www.nytimes.com/2007/08/10/business/worldbusiness/10iht-regs.4.7078943.html?searchResultPosition=132
Asian markets fall as credit fears spread,"Aug. 10, 2007",https://www.nytimes.com/2007/08/10/business/worldbusiness/10iht-10asiastox.7069963.html?searchResultPosition=133
Central banks act again to combat subprime crisis,"Aug. 10, 2007",https://www.nytimes.com/2007/08/10/business/worldbusiness/10iht-subprime.4.7078954.html?searchResultPosition=134
U.S. stocks are volatile after global sell-off,"Aug. 10, 2007",https://www.nytimes.com/2007/08/10/business/worldbusiness/10iht-10cndstoxB.7078204.html?searchResultPosition=135
U.S. stocks recover some ground after global sell-off,"Aug. 10, 2007",https://www.nytimes.com/2007/08/10/business/worldbusiness/10iht-10cndstoxweb.7077902.html?searchResultPosition=136
Macquarie leverage model in question during credit crisis,"Aug. 10, 2007",https://www.nytimes.com/2007/08/10/business/worldbusiness/10iht-fund.1.7071872.html?searchResultPosition=137
Banks step in as global market rout deepens,"Aug. 10, 2007",https://www.nytimes.com/2007/08/10/business/worldbusiness/10iht-astox.1.7071261.html?searchResultPosition=138
Renaissance Hedge Fund Down 7 Percent,"Aug. 10, 2007",https://www.nytimes.com/2007/08/10/business/renaissance-wire.html?searchResultPosition=139
Import Prices Rise on Higher Oil Costs,"Aug. 10, 2007",https://www.nytimes.com/2007/08/10/business/prices-wire.html?searchResultPosition=140
The Bear Stearns Golf Index,"Aug. 10, 2007",https://www.nytimes.comhttps://dealbook.nytimes.com/2007/08/10/the-bear-stearns-golf-index/?searchResultPosition=142
Europeans Are Wondering About Subprime Exposure,"Aug. 11, 2007",https://www.nytimes.com/2007/08/11/business/worldbusiness/11regulate.html?searchResultPosition=143
Fed chief faces his first crisis,"Aug. 11, 2007",https://www.nytimes.com/2007/08/11/business/worldbusiness/11iht-fed.1.7084247.html?searchResultPosition=144
"In a Credit Crisis, Large Mortgages Grow Costly","Aug. 12, 2007",https://www.nytimes.com/2007/08/12/business/12mortgage.html?searchResultPosition=145
A Rocky Week for World Markets,"Aug. 12, 2007",https://www.nytimes.com/2007/08/12/business/yourmoney/12data.html?searchResultPosition=146
A Week When Risk Came Home to Roost,"Aug. 12, 2007",https://www.nytimes.com/2007/08/12/business/yourmoney/12gret.html?searchResultPosition=147
"Chicken Little’s Brethren, on the Trading Floor","Aug. 12, 2007",https://www.nytimes.com/2007/08/12/business/yourmoney/12every.html?searchResultPosition=148
A market crisis disconnected from reality,"Aug. 12, 2007",https://www.nytimes.com/2007/08/12/business/worldbusiness/12iht-perspective.1.7086715.html?searchResultPosition=149
Credit crisis means tough choice for Fed,"Aug. 12, 2007",https://www.nytimes.com/2007/08/12/business/worldbusiness/12iht-bernanke.1.7086741.html?searchResultPosition=150
How the gears jammed in the housing machine,"Aug. 12, 2007",https://www.nytimes.com/2007/08/12/business/worldbusiness/12iht-mortgage.1.7087464.html?searchResultPosition=152
Small American investors feel less pain as stocks slide,"Aug. 12, 2007",https://www.nytimes.com/2007/08/13/business/worldbusiness/13iht-13markets.7093179.html?searchResultPosition=153
The no-risk models that weren't,"Aug. 12, 2007",https://www.nytimes.com/2007/08/12/business/worldbusiness/12iht-morgenson.1.7086519.html?searchResultPosition=154
Small Investors Seen as Safer in Stock Slide,"Aug. 13, 2007",https://www.nytimes.com/2007/08/13/business/13markets.html?searchResultPosition=155
Most Asian Markets Spring Back From Last Week’s Plunge,"Aug. 13, 2007",https://www.nytimes.com/2007/08/13/business/worldbusiness/13cnd-asiastocks.html?searchResultPosition=156
Most Global Markets Spring Back From Plunge,"Aug. 13, 2007",https://www.nytimes.com/2007/08/13/business/14stox-web.html?searchResultPosition=157
Most global markets spring back,"Aug. 13, 2007",https://www.nytimes.com/2007/08/13/business/worldbusiness/13iht-1308markets1.7100961.html?searchResultPosition=158
Small investors believed to be safer in stock slide,"Aug. 13, 2007",https://www.nytimes.com/2007/08/13/business/worldbusiness/13iht-invest.1.7094535.html?searchResultPosition=159
ECB takes lead role in calming markets,"Aug. 13, 2007",https://www.nytimes.com/2007/08/13/business/worldbusiness/13iht-policy.4.7102207.html?searchResultPosition=160
Asian markets bounce back,"Aug. 13, 2007",https://www.nytimes.com/2007/08/13/business/worldbusiness/13iht-markets.1.7096802.html?searchResultPosition=163
"In Reversal, Japan’s Central Bank Pulls Back $5 Billion","Aug. 14, 2007",https://www.nytimes.com/2007/08/14/business/worldbusiness/14japan.html?searchResultPosition=165
Fallout in Australia from U.S. mortgage losses,"Aug. 14, 2007",https://www.nytimes.com/2007/08/14/business/worldbusiness/14iht-fallout.4.7116815.html?searchResultPosition=166
ECB hints at a rate increase in September,"Aug. 14, 2007",https://www.nytimes.com/2007/08/14/business/worldbusiness/14iht-rates.4.7116778.html?searchResultPosition=167
Most global markets spring back from plunge,"Aug. 14, 2007",https://www.nytimes.com/2007/08/14/business/worldbusiness/14iht-14stoxweb.7108954.html?searchResultPosition=168
UBS paints a grim picture for investment banking,"Aug. 14, 2007",https://www.nytimes.com/2007/08/14/business/worldbusiness/14iht-ubs.4.7116377.html?searchResultPosition=169
Subprime Problems Spread Into Commercial Loans,"Aug. 15, 2007",https://www.nytimes.com/2007/08/15/business/15fund.html?searchResultPosition=171
China's industrial output slows more than expected,"Aug. 15, 2007",https://www.nytimes.com/2007/08/15/business/worldbusiness/15iht-yuan.1.7122944.html?searchResultPosition=172
Mortgage fallout leads stocks down worldwide,"Aug. 15, 2007",https://www.nytimes.com/2007/08/15/business/worldbusiness/15iht-markets.5.7133290.html?searchResultPosition=173
Stocks in Asia and Europe resume slide,"Aug. 15, 2007",https://www.nytimes.com/2007/08/15/business/worldbusiness/15iht-markets.1.7124048.html?searchResultPosition=174
Subprime woes extend into commercial paper,"Aug. 15, 2007",https://www.nytimes.com/2007/08/15/business/worldbusiness/15iht-paper.1.7122177.html?searchResultPosition=176
Aegis Files for Bankruptcy,"Aug. 15, 2007",https://www.nytimes.comhttps://dealbook.nytimes.com/2007/08/15/aegis-files-for-bankruptcy/?searchResultPosition=177
"Dow Drops 340 Points, Then Recovers Losses","Aug. 16, 2007",https://www.nytimes.com/2007/08/16/business/17stox-web.html?searchResultPosition=179
U.S. Stocks Open Lower After Major Asian Sell-Off,"Aug. 16, 2007",https://www.nytimes.com/2007/08/16/business/worldbusiness/16cnd-asiastox.html?searchResultPosition=180
How a hedge fund star lost it all,"Aug. 16, 2007",https://www.nytimes.com/2007/08/16/business/worldbusiness/16iht-hedge.1.7137166.html?searchResultPosition=183
Global stock turbulence gaining momentum,"Aug. 16, 2007",https://www.nytimes.com/2007/08/16/business/worldbusiness/16iht-markets.5.7148992.html?searchResultPosition=184
Asian countries may soon discover how much they need the U.S.,"Aug. 16, 2007",https://www.nytimes.com/2007/08/16/business/worldbusiness/16iht-asiaecon.1.7138666.html?searchResultPosition=185
